Question,Answer,LLAMA_response
"[""Is the movie 'Skyline 2010' devoid of a summary that provides an overview of its plot, themes, and other important details?""]",no,no
"[""Does the movie 'Skyline 2010' consist of a summary that provides an overview of its plot, themes, and other important details?""]",yes,no
"Does the summary of ""Skyline 2010"" exclude any details about the events and characters in the movie?",no,no
"Does the summary of ""Skyline 2010"" provide more specific information about the events and characters in the movie?",yes,no
"[""Does the message displayed in 'Skyline 2010' indicate that a user has accessed the details of a different movie's summary?""]",no,no
"[""When a message is displayed in 'Skyline 2010', can it indicate that a user has accessed the details of this particular movie's summary?""]",yes,no
,,0.5
