node_1,node_2,edge,chunk_id,count
kaal,indian hindi-language supernatural horror film,Kaal is a 2005 Indian Hindi-language supernatural horror film written and directed by Soham Shah.,fe61d139b71f4dba95800c530d6acba7,4
soham shah,kaal (film),Soham Shah is the writer and director of Kaal (film).,fe61d139b71f4dba95800c530d6acba7,4
karan johar,kaal (film),Kaal (film) was jointly produced by Karan Johar and Shah Rukh Khan.,fe61d139b71f4dba95800c530d6acba7,4
shah rukh khan,kaal (film),Shah Rukh Khan jointly produced Kaal (film) with Karan Johar.,fe61d139b71f4dba95800c530d6acba7,4
ajay devgn,kaal (film),Ajay Devgn is one of the actors in Kaal (film).,fe61d139b71f4dba95800c530d6acba7,4
john abraham,kaal (film),John Abraham is one of the actors in Kaal (film).,fe61d139b71f4dba95800c530d6acba7,4
vivek oberoi,kaal (film),Vivek Oberoi is one of the actors in Kaal (film).,fe61d139b71f4dba95800c530d6acba7,4
esha deol,kaal (film),Esha Deol is one of the actors in Kaal (film).,fe61d139b71f4dba95800c530d6acba7,4
lara dutta,kaal (film),Lara Dutta is one of the actors in Kaal (film).,fe61d139b71f4dba95800c530d6acba7,4
wildlife expert,kaal (film),The story of Kaal (film) focuses on a wildlife expert.,fe61d139b71f4dba95800c530d6acba7,4
corbett national park,kaal (film),"The story of Kaal (film) takes place in the fictional Orbit National Park, which alludes to the world-famous Jim Corbett National Park, Nainital, Uttarakhand.",fe61d139b71f4dba95800c530d6acba7,4
tour guide,kaal (film),The story of Kaal (film) involves a mysterious tour guide who helps the characters battle against a mysterious entity for their lives.,fe61d139b71f4dba95800c530d6acba7,4
british nationals,kaal (film),The story of Kaal (film) begins with the deaths of two British nationals in Corbett National Park due to a ferocious tiger.,fe61d139b71f4dba95800c530d6acba7,4
tiger attacks,kaal (film),"The story of Kaal (film) is followed by several other tiger attacks and many deaths result, prompting National Geographic to send a correspondent to the national park.",fe61d139b71f4dba95800c530d6acba7,4
national geographic,kaal (film),"National Geographic sends a correspondent, Krish Thapar, to Corbett National Park in the story of Kaal (film).",fe61d139b71f4dba95800c530d6acba7,4
krish thapar,corbett national park,Krish Thapar is sent by National Geographic to Corbett National Park in the story of Kaal (film).,fe61d139b71f4dba95800c530d6acba7,4
riya,kaal (film),Krish Thapar is accompanied by his wife Riya in the story of Kaal (film).,fe61d139b71f4dba95800c530d6acba7,4
dev malhotra,kaal (film),Dev Malhotra is one of the characters in Kaal (film) who goes on a hunting trip.,fe61d139b71f4dba95800c530d6acba7,4
ishika,kaal (film),Dev Malhotra's girlfriend Ishika accompanies him on his hunting trip in Kaal (film).,fe61d139b71f4dba95800c530d6acba7,4
sajid,kaal (film),One of the characters in Kaal (film) who goes on a hunting trip is named Sajid.,fe61d139b71f4dba95800c530d6acba7,4
vishal,kaal (film),Another character in Kaal (film) who goes on a hunting trip is named Vishal.,fe61d139b71f4dba95800c530d6acba7,4
bagga,kaal (film),An alcoholic passerby driver named Bagga gives the two groups a lift in Kaal (film).,fe61d139b71f4dba95800c530d6acba7,4
fictional orbit national park,corbett national park,"The fictional Orbit National Park, where most of the story of Kaal (film) takes place, alludes to Corbett National Park.",fe61d139b71f4dba95800c530d6acba7,4
jim corbett national park,corbett national park,"The world-famous Jim Corbett National Park is located in Nainital, Uttarakhand and is referenced in the story of Kaal (film).",fe61d139b71f4dba95800c530d6acba7,4
tigers,group,The group encounters three tigers on their way out of the jungle.,39a11bcc785d47f19d3d9e55798e65cc,4
sajid,core area,Sajid goes missing while in the core area for hunting.,39a11bcc785d47f19d3d9e55798e65cc,4
group,ds pandey,The group stays at DS Pandey's guesthouse and he agrees to lead them to the core area for hunting.,39a11bcc785d47f19d3d9e55798e65cc,4
ds pandey,core area,DS Pandey leads the group to the core area for hunting.,39a11bcc785d47f19d3d9e55798e65cc,4
bashir khan,group,Bashir Khan warns the group about the recent deaths in the jungle.,39a11bcc785d47f19d3d9e55798e65cc,4
krish,ds pandey,Krish starts to get suspicious about the real cause of DS Pandey's death in the jungle as he is an animal expert.,39a11bcc785d47f19d3d9e55798e65cc,4
bagga,group,Bagga finds the group a guesthouse to stay owned by DS Pandey.,39a11bcc785d47f19d3d9e55798e65cc,4
landslide,road,The road is blocked by rocks due to the landslide caused by rain.,39a11bcc785d47f19d3d9e55798e65cc,4
kaali pratap singh,group,Kaali shows up again and agrees to lead the group out of the jungle.,39a11bcc785d47f19d3d9e55798e65cc,4
kaali,jungle,Kaali appears to be very knowledgeable about the jungle and its history.,4ca810607b34442a9d8dff97b2e9c1d2,4
krish,mysterious deaths,"Krish, who is now more curious about the mysterious deaths,",4ca810607b34442a9d8dff97b2e9c1d2,4
kaali,crazy tour guide,"Kaali tells them a story about a crazy tour guide in this jungle,",4ca810607b34442a9d8dff97b2e9c1d2,4
tourists,wild animals,who used to lead tourists to the wrong places just to have them killed by wild animals.,4ca810607b34442a9d8dff97b2e9c1d2,4
people in nearby villages,crazy tour guide,later caught him and beat him to death but his ghost remains in the jungle and continues to kill tourists.,4ca810607b34442a9d8dff97b2e9c1d2,4
bagga,car,"Bagga later disappears while repairing his car,",4ca810607b34442a9d8dff97b2e9c1d2,4
vishal,windows of their car,Vishal is decapitated shortly thereafter when a window of their car flies and hits him due to the explosion.,4ca810607b34442a9d8dff97b2e9c1d2,4
riya,well,"Riya wakes up thirsty in the night. She decides to get water from the well despite Kaali's warning,",4ca810607b34442a9d8dff97b2e9c1d2,4
well,death,and is later accidentally hung by her foot in the well and dies.,4ca810607b34442a9d8dff97b2e9c1d2,4
kaali,tourists,Kaali's anger and hatred for tourists who come to the jungle to hunt wild animals and disrupt their well being without any regrets. This is the sole reason why he misleads tourists before killing them.,4f495bbb04d943888e87f9e7764dff3b,4
krish,dev,The trio's decision to escape the jungle once and for all after realizing that Kaali is a ghost and is responsible for all the mysterious deaths happening in the jungle.,4f495bbb04d943888e87f9e7764dff3b,4
riya,dead,The remaining group members figure out that Riya is dead and try to pull her body out from the well.,4f495bbb04d943888e87f9e7764dff3b,4
villagers,kaali,"The villagers did not kill Kaali but instead, took him to the core area where he was brutally thrashed and then thrown in front of a hungry tiger that mauled him to death.",4f495bbb04d943888e87f9e7764dff3b,4
kaali,villagers,"The story Kaali told them earlier is true and that Kaali himself is in the ghost of the tour guide mentioned in the story because the villagers did not kill him but instead, took him to the core area where he was brutally thrashed and then thrown in front of a hungry tiger that mauled him to death.",4f495bbb04d943888e87f9e7764dff3b,4
kaali,ghost of the tour guide mentioned in the story,The story Kaali told them earlier is true and that Kaali himself is in the ghost of the tour guide mentioned in the story.,4f495bbb04d943888e87f9e7764dff3b,4
vishal,dev,Dev checks all the videos which had been recorded by Vishal and notices that Kaali is not visible in any of them.,4f495bbb04d943888e87f9e7764dff3b,4
krish,tiger attacks,"relationship between the deaths in the jungle and Krish's report, where he attributes the deaths to tiger attacks rather than revealing the true cause",e8f9613e69a942a4ace0424b010f2678,4
krish,kaali,"attempts on their lives on their way out of the jungle, apparently arranged by Kaali",e8f9613e69a942a4ace0424b010f2678,4
bagga and khan,road,"driving Krish, Dev, and Ishika away from the jungle on the road",e8f9613e69a942a4ace0424b010f2678,4
krish,real cause of deaths,Krish's decision not to disclose the real cause of deaths in the jungle to anyone since no one will believe him,e8f9613e69a942a4ace0424b010f2678,4
kaali,new group of tourists,encounters a new group of tourists in the jungle,e8f9613e69a942a4ace0424b010f2678,4
member,truck,Kaali has one of the members killed by a truck in the jungle,e8f9613e69a942a4ace0424b010f2678,4
shah,karan johar,assisted Karan Johar in Kabhi Khushi Kabhie Gham...,e8f9613e69a942a4ace0424b010f2678,4
bangkok,sets,"Scenes involving tigers were shot in Bangkok, where they used to roam free on sets",e8f9613e69a942a4ace0424b010f2678,4
vivek oberoi,kaali,"Vivek Oberoi wanted to portray the character Kaali, but later accepted the role he was offered",e8f9613e69a942a4ace0424b010f2678,4
jim corbett national park,film,The film was shot at the Jim Corbett National Park,e8f9613e69a942a4ace0424b010f2678,4
film,critics,The film received mixed reviews from critics...,693ce9dd399940d392b3c3f8b1ecb216,4
horror film,mixed reviews,...noting it to be a different type of horror film received mixed reviews from critics.,693ce9dd399940d392b3c3f8b1ecb216,4
soham shah,inept at directing performances,"Planet Bollywood rated the film 5/10, stating,' Soham Shah is as inept at directing performances as he is at writing an engaging screenplay or building any sort of momentum or pacing visually.'",693ce9dd399940d392b3c3f8b1ecb216,4
soham shah,cardboard characters,Lack of strong characterization tells on the dismal level of performances from the cast.,693ce9dd399940d392b3c3f8b1ecb216,4
lara dutta,randomly,"Lara Dutta cringes, cries, and yells randomly,",693ce9dd399940d392b3c3f8b1ecb216,4
esha deol,strange expression,...consistently carries a strange expression on her face that suggests she might have just swallowed a frog.,693ce9dd399940d392b3c3f8b1ecb216,4
vivek oberoi,cardboard characters,"Capable actors, Vivek Oberoi and John Abraham are sadly curtailed by their cardboard characters.",693ce9dd399940d392b3c3f8b1ecb216,4
ajay devgan,level best to rise above the non-existent screenplay,But the daunting task of saving the film single-handedly proves too difficult even for him.,693ce9dd399940d392b3c3f8b1ecb216,4
salim–sulaiman and anand raj anand,music,The music is composed by Salim–Sulaiman and Anand Raj Anand.,693ce9dd399940d392b3c3f8b1ecb216,4
anand raj anand and kailash kher,lyrics,"The lyrics are penned by Shabbir Ahmed, Anand Raj Anand and Kailash Kher.",693ce9dd399940d392b3c3f8b1ecb216,4
indian trade website box office india,soundtrack album,"With around 16,00,000 units sold, this film's soundtrack album was the year's seventh highest-selling.",693ce9dd399940d392b3c3f8b1ecb216,4
