node_1,node_2,node_3,node_4,edge_1,edge_2,edge_3
cuba gooding jr.,charlie hinton,phil ryerson,max ryerson,"Cuba Gooding Jr. Plays the role of Charlie Hinton, who is the co-owner of Daddy Day Care and Daddy Day Camp.","Charlie Hinton has a relationship with his best friend Phil Ryerson, who is the co-owner of Daddy Day Care and Daddy Day Camp.","Phil Ryerson has a relationship with his son Max Ryerson, who is Becca and Ben's best friend."
eddie murphy,charlie hinton,phil ryerson,max ryerson,Charlie Hinton was previously played by Eddie Murphy in the original film.,"Charlie Hinton has a relationship with his best friend Phil Ryerson, who is the co-owner of Daddy Day Care and Daddy Day Camp.","Phil Ryerson has a relationship with his son Max Ryerson, who is Becca and Ben's best friend."
paul rae,phil ryerson,max ryerson,becca,"Paul Rae plays the role of Phil Ryerson, who is Charlie's best friend and co-owner of Daddy Day Care and Daddy Day Camp.","Phil Ryerson has a relationship with his son Max Ryerson, who is Becca and Ben's best friend.","Max Ryerson has a relationship with Becca, who is a smart girl and his best friend from when they first met in Daddy Day Care four years ago."
charlie hinton,phil ryerson,max ryerson,becca,"Charlie Hinton has a relationship with his best friend Phil Ryerson, who is the co-owner of Daddy Day Care and Daddy Day Camp.","Phil Ryerson has a relationship with his son Max Ryerson, who is Becca and Ben's best friend.","Max Ryerson has a relationship with Becca, who is a smart girl and his best friend from when they first met in Daddy Day Care four years ago."
paul rae,phil ryerson,max ryerson,becca,"Charlie Hinton's relationship with Phil Ryerson is related to Paul Rae, who plays the role of Phil Ryerson.","Phil Ryerson has a relationship with his son Max Ryerson, who is Becca and Ben's best friend.","Max Ryerson has a relationship with Becca, who is a smart girl and his best friend from when they first met in Daddy Day Care four years ago."
