Question & Options,Correct Answer
"What sacrifice does Princess Yue make in relation to the Moon Spirit?
Options:
A. She captures the Moon Spirit
B. She helps Iroh escape
C. She gives her life to revive the Moon Spirit
D. She battles Zhao for control",She gives her life to revive the Moon Spirit
"What sacrifice does Princess Yue make to restore the Moon Spirit?
Options:
A. She offers her waterbending abilities
B. She gives her life
C. She captures Zhao
D. She pleads with Iroh",She gives her life
