node_1,node_2,edge,chunk_id,count
superintendent washburn,glass,"Superintendent Washburn arrives at the scene, Glass shoots him and points the gun at Tramell before police tackle him.",573cca5fc2c547aa83209eb652086e20,4
glass,tramell,"Glass shoots Superintendent Washburn, points the gun at Tramell before police tackle him.",573cca5fc2c547aa83209eb652086e20,4
glass,institutionalised,"Later, Tramell visits Glass, now apparently insensible and institutionalised at a mental hospital.",573cca5fc2c547aa83209eb652086e20,4
tramell,glass,"Tramell visits Glass, now apparently insensible and institutionalised at a mental hospital.",573cca5fc2c547aa83209eb652086e20,4
tramell,best seller,Tramell tells Glass that her novel has become a best seller.,573cca5fc2c547aa83209eb652086e20,4
