node_1,node_2,edge,chunk_id,count
jamie dornan,dakota johnson,"Jamie Dornan and Dakota Johnson are the lead actors of the movie, with Jamie portraying Christian Grey and Dakota portraying Anastasia Steele.",8d22ba82849b4ac38548157b13ab3db3,4
dakota johnson,washington state university,Dakota Johnson's character Anastasia Steele is a 21-year-old English Literature student attending Washington State University.,8d22ba82849b4ac38548157b13ab3db3,4
charlie hunnam,jamie dornan,"Initially, Charlie Hunnam was cast as Christian Grey, but due to scheduling conflicts, Jamie Dornan replaced him.",8d22ba82849b4ac38548157b13ab3db3,4
eloise mumford,anastasia steele,"Eloise Mumford portrays Katherine 'Kate' Kavanagh, Anastasia Steele's best friend and roommate.",8d22ba82849b4ac38548157b13ab3db3,4
marcia gay harden,christian grey,"Marcia Gay Harden portrays Christian Grey's adoptive mother, Dr. Grace Trevelyan-Grey.",8d22ba82849b4ac38548157b13ab3db3,4
