node_1,node_2,edge,chunk_id,count
frankenstein,monster,"Frankenstein creates a monster by putting together parts of corpses and reanimating them. Horrified by his creation, Frankenstein tries to destroy it, but the monster survives and murders his wife Elizabeth. Frankenstein chases it to the Arctic, but he succumbs to the cold weather.",166cbc3b20d74fbcb4e86fef877ab67f,4
monster,demons,"The monster's creation leads to the death of Frankenstein's wife Elizabeth. The monster is pursued by demons, but survives and eventually buries Frankenstein in the Arctic.",166cbc3b20d74fbcb4e86fef877ab67f,4
adam,demon,"For the next two hundred years, Adam lives apart from society, killing any demon that pursues him and hiding from them. During the fight, a police officer is killed.",166cbc3b20d74fbcb4e86fef877ab67f,4
adam,gargoyles,"Deciding to rejoin society in the modern-day, Adam looks for and confronts a group of demons. During the fight, a police officer is killed. This causes Adam to be summoned by the gargoyles once more and they decide to imprison him as punishment.",166cbc3b20d74fbcb4e86fef877ab67f,4
gargoyles,demons,The gargoyles were created by the Archangel Michael to battle demons on Earth and protect humanity. They invite Adam to join them in this mission.,166cbc3b20d74fbcb4e86fef877ab67f,4
adam,baton-like weapons,"The gargoyles give Adam baton-like weapons to protect himself, as more demons will come after him. The weapons allow him to 'descend' demons (destroying their bodies and trapping their souls in Hell) as they have the symbol of the Gargoyle Order carved on them.",166cbc3b20d74fbcb4e86fef877ab67f,4
adam,zuriel,"attacked by Zuriel, where Adam fights him and manages to descend him",cb60a5d4325f4aa2beb3b32bd5026aab,4
