node_1,node_2,edge
all about steve,sandra bullock,Sandra Bullock starred in the movie 'All About Steve'.
all about steve,fox 2000 pictures,Fox 2000 Pictures acquired the Kim Barker penned spec script 'All About Steve' to be developed as a starring vehicle for Sandra Bullock.
all about steve,"september 4, 2009","The movie 'All About Steve' was released on September 4, 2009."
sandra bullock,bradley cooper,Bradley Cooper co-starred with Sandra Bullock in the movie 'All About Steve'.
collapsed mine,sink hole,"Scenes featuring the collapsed mine and sink hole were filmed at The Walt Disney Company's Golden Oak Ranch near Santa Clarita, California."
july 2007,production,Production of the movie 'All About Steve' began in July 2007.
