node_1,node_2,edge
crew member,youtube,"One of the crew members uploads Bucky's small penis video to YouTube, which leads to his popularity and success in the adult film industry."
miles,kathy,Miles confesses that he had told Kathy to leave Bucky so he could have his prize star all to himself.
bucky,steakhouse,Bucky opens his own steakhouse.
gary,bucky,"Gary comes into the restaurant and yells at him for owing him rent money, and tells Bucky he is 'just like John Mayer'."
kathy,horrible date with dick shadow,Kathy is on a horrible date with Dick Shadow during a film shoot.
