node_1,node_2,edge
leighton meester,rebecca evans,Leighton Meester portrays the character Rebecca Evans in the movie.
minka kelly,sara matthews,Minka Kelly plays the role of Sara Matthews in the movie.
cam gigandet,stephen danneel harris,Cam Gigandet acts as Stephen Danneel Harris in the movie.
nina dobrev,maria,Nina Dobrev portrays Maria in the movie.
aly michalka,tracy long,Aly Michalka depicts Tracy Long in the movie.
long kat graham,kim johnson,Long Kat Graham performs as Kim Johnson in the movie.
cherilyn wilson,landi rham,Cherilyn Wilson depicts Landi Rham in the movie.
frances fisher,alison evans,Frances Fisher acts as Alison Evans in the movie.
tomas arana,jeff evans,Tomas Arana portrays Jeff Evans in the movie.
