node_1,node_2,node_3,edge_1,edge_2
j. d.,sullivan's soldiers,the weavers,J. D. Is a part of Sullivan's soldiers and gets fatally shot in the ensuing gunfight.,"Sullivan's soldiers are summoned to rescue The Weavers, but they get attacked by the zombified cartel."
sullivan,patrick,lieutenant sullivan,Sullivan sacrifices himself so Patrick and Brax can escape during the gunfight.,Patrick recognizes Lieutenant Sullivan as his father in the military platoon that captures him. This reveals a previously unknown relationship between the two.
sullivan,patrick,sacrifice,Sullivan sacrifices himself so Patrick and Brax can escape during the gunfight.,"Patrick sacrifices himself and falls on it to protect the others, paying homage to how his father died years ago: protecting his troop in Venezuela by falling onto a grenade."
the remaining guests,roarke,deceased wife,"The remaining guests regroup at the resort but are cornered by Roarke, who reveals that they are in a fantasy in which they are all killed.","Roarke's own fantasy is to be with his deceased wife, and he insists that the guests' fantasies be fulfilled to continue this one. This reveals a significant aspect of his character."
damon's associates,the guests,the glowing rock,"Damon's associates send a plane to rescue the guests, but it is shot down.",The guests run to the cave to destroy the glowing rock with a grenade Patrick is carrying.
julia,roarke,deceased wife,"Julia is revealed to be Roarke's wife, brought back by the power of the island dying of a terminal disease she was suffering from when she met Roarke.","Roarke's own fantasy is to be with his deceased wife, and he insists that the guests' fantasies be fulfilled to continue this one. This reveals a significant aspect of his character."
