node_1,node_2,edge,chunk_id,count
the pianist,roman polanski,Polanski produced and directed the film The Pianist.,cf63954c88604df39096a4bb156be9da,4
the pianist,adrien brody,Brody starred in the film The Pianist.,cf63954c88604df39096a4bb156be9da,4
ronald harwood,the pianist,Harwood wrote the script for the film The Pianist.,cf63954c88604df39096a4bb156be9da,4
władysław szpilman,the pianist,The film is based on Szpilman's autobiographical book.,cf63954c88604df39096a4bb156be9da,4
france,the pianist,"The Pianist is a co-production between France, the United Kingdom, Germany and Poland.",cf63954c88604df39096a4bb156be9da,4
cannes film festival,the pianist,The film premiered at the Cannes Film Festival in 2002.,cf63954c88604df39096a4bb156be9da,4
palme d'or,the pianist,The Pianist won the Palme d'Or at the Cannes Film Festival in 2002.,cf63954c88604df39096a4bb156be9da,4
władysław szpilman,nazi germany's invasion of poland,"In September 1939, Władysław Szpilman, a Polish-Jewish pianist, was playing live on the radio in Warsaw when the station was besieged during Nazi Germany's invasion of Poland.",74a77a57308441029656b9304490cf6f,4
władysław szpilman,britain and france's declaration of war on germany,"After escaping the attack, Szpilman rejoiced with his family at home when he learned that Britain and France had declared war on Germany.",74a77a57308441029656b9304490cf6f,4
jewish people,star of david armbands,"Jews were soon prevented from working or owning businesses, and were also forced to wear blue Star of David armbands.",74a77a57308441029656b9304490cf6f,4
warsaw ghetto,isolated and overcrowded warsaw ghetto,Szpilman and his family were forced from their home into the isolated and overcrowded Warsaw Ghetto.,74a77a57308441029656b9304490cf6f,4
food shortages,starvation,"Conditions in the Warsaw Ghetto only got worse, with food shortages leading to starvation.",74a77a57308441029656b9304490cf6f,4
schutzstaffel (ss),brutality,The constant threat of Schutzstaffel (SS) brutality.,74a77a57308441029656b9304490cf6f,4
young boy,savagely beaten by a guard,"On one occasion, he saw a young boy being savagely beaten by a guard while trying to crawl through a gap in the ghetto wall; the boy was dead by the time Szpilman could pull him through.",74a77a57308441029656b9304490cf6f,4
ss,killing another family,"At dinner, Szpilman and his family witnessed the SS killing another family in an apartment across the street during a round-up, including throwing an elderly wheelchair-bound man from the window.",74a77a57308441029656b9304490cf6f,4
szpilman,operation reinhard,"On 16 August 1942, Szpilman and his family were about to be transported to Treblinka extermination camp as part of Operation Reinhard; previously they had failed to acquire a German work certificate.",36374d26d7814c49a023076ff65660e5,4
szpilman,treblinka extermination camp,"On 16 August 1942, Szpilman and his family were about to be transported to Treblinka extermination camp as part of Operation Reinhard; previously they had failed to acquire a German work certificate.",36374d26d7814c49a023076ff65660e5,4
szpilman,jewish ghetto police,A friend from the Jewish Ghetto Police led Szpilman away from his family at the Umschlagplatz as he was about to board the train.,36374d26d7814c49a023076ff65660e5,4
szpilman,slave labourer,"After being transported to an unknown location, Szpilman became a slave labourer.",36374d26d7814c49a023076ff65660e5,4
jewish revolt,szpilman,"Szpilman helped the resistance by smuggling weapons into the ghetto hidden inside bags of food, on one occasion narrowly avoiding a suspicious guard.",36374d26d7814c49a023076ff65660e5,4
jewish revolt,uprising,"Szpilman watched from his window as the uprising which he aided, unfolded and then ultimately failed in April 1943.",36374d26d7814c49a023076ff65660e5,4
neighbor,szpilman,"After a neighbor discovered Szpilman and attempted to persecute him, he fled the apartment.",36374d26d7814c49a023076ff65660e5,4
dorota,szpilman,Dorota provided Szpilman a hiding place after his old friend abandoned him and he suffered from jaundice.,36374d26d7814c49a023076ff65660e5,4
doctor,szpilman,"Dorota and her husband visited Szpilman the last time, providing him a doctor to treat his illness.",36374d26d7814c49a023076ff65660e5,4
szpilman,warsaw uprising,"Szpilman recovers and the Warsaw Uprising begins. The Home Army attacks the Schutzpolizei building across the street from the apartment, while Szpilman's hideout is destroyed by a German tank shell, forcing him to flee and hide in an abandoned hospital. Over the course of the following months, Warsaw is destroyed.",bfd70de5957e409a8df4b8d634d3c938,4
szpilman,hospital,Szpilman hides in an abandoned hospital after his hideout is destroyed by a German tank shell during the Warsaw Uprising.,bfd70de5957e409a8df4b8d634d3c938,4
szpilman,empty house,Szpilman reaches an empty house where he finds a can of pickled cucumbers while wandering through the city's ruins.,bfd70de5957e409a8df4b8d634d3c938,4
szpilman,chopin's 'ballade no. 1 in g minor',"Hosenfeld discovers Szpilman and learns that he is a pianist. He asks Szpilman to play on a grand piano in the house, and Szpilman manages to play Chopin's 'Ballade No. 1 in G minor'.",bfd70de5957e409a8df4b8d634d3c938,4
szpilman,hosenfeld,"Hosenfeld lets Szpilman hide in the attic of the house, which is used as his center of operations, and supplies food for him.",bfd70de5957e409a8df4b8d634d3c938,4
szpilman,greatcoat,Hosenfeld leaves Szpilman with a large supply of food and his greatcoat to keep warm before retreating from the Soviet offensive.,bfd70de5957e409a8df4b8d634d3c938,4
szpilman,people's army troops,Narrowly survives an ambush by several People's Army troops who mistook him for a German after Warsaw is liberated.,bfd70de5957e409a8df4b8d634d3c938,4
hosenfeld,szpilman,Meets Szpilman for the last time and promises to listen to him on Polish Radio after the war before retreating from the Soviet offensive.,bfd70de5957e409a8df4b8d634d3c938,4
szpilman,hosenfeld,"In Spring 1945, surviving concentration camp inmate Hosenfeld approached Szpilman, a fellow inmate and violinist, in a Soviet camp holding captured German soldiers. Hosenfeld requested Szpilman to rescue him as he knew his whereabouts.",b7e0adeee13141baba6a2afa42db7c00,4
szpilman,polish radio,"After the war, Szpilman resumed his career at the Polish Radio and performed Chopin's 'Grand Polonaise' with an orchestra to a large prestigious audience.",b7e0adeee13141baba6a2afa42db7c00,4
hosenfeld,soviet captivity,"The story had deep connections with director Roman Polanski because his father almost died in the camps, but they reunited after the end of World War II. However, Hosenfeld died in Soviet captivity in 1952.",b7e0adeee13141baba6a2afa42db7c00,4
szpilman,chopin's 'grand polonaise',"At the Polish Radio, Szpilman performed Chopin's 'Grand Polonaise' with an orchestra to a large prestigious audience.",b7e0adeee13141baba6a2afa42db7c00,4
polanski,kraków ghetto,Director Roman Polanski escaped from the Kraków Ghetto as a child after the death of his mother during World War II. He ended up living in a Polish farmer's barn until the war's end.,b7e0adeee13141baba6a2afa42db7c00,4
babelsberg studio,old soviet army barracks,Used to create the ruined city for The Pianist as they were going to be destroyed anyway.,9f5fb87869d0418381850f27c7d1b2d3,4
babelsberg studios,first scene shot at the studio,The complex and technically demanding scene in which Szpilman witnesses the ghetto uprising.,9f5fb87869d0418381850f27c7d1b2d3,4
rundown district of praga,original buildings,"Chosen for filming because of its abundance of original buildings. The art department built onto these original buildings, re-creating World War II-era Poland with signs and posters from the period.",9f5fb87869d0418381850f27c7d1b2d3,4
umschlagplatz,national defence university of warsaw,"The Umschlagplatz scene where Szpilman, his family, and hundreds of other Jews wait to be taken to the extermination camps was filmed at the National Defence University of Warsaw.",9f5fb87869d0418381850f27c7d1b2d3,4
holocaust experience,war,"The film 'illustrates' the theme of war and bigotry, as it relates to the Holocaust experience. Michael Wilmington of the Chicago Tribune stated that this film may signal Polanski's artistic redemption.",013ddae3b62d43a793bf54f923300d9d,4
holocaust experience,inhumanity,"The film is a powerful statement on war, inhumanity, and art's redemption. Michael Wilmington of the Chicago Tribune called it the best dramatic feature he has seen on the Holocaust experience.",013ddae3b62d43a793bf54f923300d9d,4
holocaust experience,art's redemption,"The film may signal Polanski's artistic redemption, as stated by Michael Wilmington of the Chicago Tribune. This theme is also proved through the film.",013ddae3b62d43a793bf54f923300d9d,4
film,harsh objectivity,"Richard Schickel of Time magazine called the film a 'raw, unblinkable film', citing its harsh objectivity.",013ddae3b62d43a793bf54f923300d9d,4
film,"refusal to seek our tears, our sympathies.","Richard Schickel of Time magazine also stated that we admire this film for its harsh objectivity and refusal to seek our tears, our sympathies.",013ddae3b62d43a793bf54f923300d9d,4
film,irony,Mick LaSalle of the San Francisco Chronicle mentioned moments of irony in the film.,013ddae3b62d43a793bf54f923300d9d,4
film,ambiguity,Mick LaSalle of the San Francisco Chronicle also cited moments of ambiguity in the film.,013ddae3b62d43a793bf54f923300d9d,4
film,strange beauty,"Mick LaSalle of the San Francisco Chronicle noted a scene where we finally get a look at Warsaw and see a panorama of destruction, a world of color bombed into black-and-white devastation.",013ddae3b62d43a793bf54f923300d9d,4
film,humanity,"Mick LaSalle of the San Francisco Chronicle stated that in the course of showing us a struggle for survival, the film also gives us humanity.",013ddae3b62d43a793bf54f923300d9d,4
szpilman,gaunt existential clowns,A.O. Scott of The New York Times compared Szpilman to one of Samuel Beckett's gaunt existential clowns in the bombed-out landscape.,8d4eb5ae8b3341fcad155df8907bac78,4
szpilman,"barren, bombed-out landscape",A.O. Scott of The New York Times compared Szpilman's situation to a barren and bombed-out landscape.,8d4eb5ae8b3341fcad155df8907bac78,4
szpilman,jar of pickles,A.O. Scott of The New York Times compared Szpilman to someone clutching a jar of pickles in the barren and bombed-out landscape.,8d4eb5ae8b3341fcad155df8907bac78,4
szpilman's encounter with a music-loving german officer,courted sentimentality,A.O. Scott of The New York Times felt that Szpilman's encounter with a music-loving German officer courted sentimentality by associating the love of art with moral decency.,8d4eb5ae8b3341fcad155df8907bac78,4
nazis,beethoven and wagner,"A.O. Scott of The New York Times mentioned that the Nazis themselves, steeped in Beethoven and Wagner, definitively refuted the equation of love of art with moral decency.",8d4eb5ae8b3341fcad155df8907bac78,4
the pianist,hd-dvd,"Universal released the film on HD-DVD on January 8, 2008.",9a7e8de0cdce452cafa617951cea6eb3,4
the pianist,blu-ray,"Optimum Home Entertainment released The Pianist to the European market on Blu-ray on September 13, 2010. This was the second release of the film on Blu-ray.",9a7e8de0cdce452cafa617951cea6eb3,4
the pianist (initial bd),subtitles,The initial release of The Pianist on Blu-ray had issues with subtitles. It lacked subtitles for spoken German dialogue.,9a7e8de0cdce452cafa617951cea6eb3,4
optimum home entertainment,studiocanal collection,"Optimum Home Entertainment released The Pianist as part of their StudioCanal Collection on September 13, 2010.",9a7e8de0cdce452cafa617951cea6eb3,4
the pianist (studiocanal collection),featurette,The StudioCanal Collection version of The Pianist included the featurette 'A Story of Survival'.,9a7e8de0cdce452cafa617951cea6eb3,4
the pianist (studiocanal collection),interviews,The StudioCanal Collection version also included several interviews with the makers of the film and Szpilman's relatives.,9a7e8de0cdce452cafa617951cea6eb3,4
shout factory,blu-ray,"Shout Factory released The Pianist on Blu-Ray in the US for the first time on July 13, 2021.",9a7e8de0cdce452cafa617951cea6eb3,4
the pianist (restored),original negative,"In 2023, The Pianist was completely restored from the original negative by StudioCanal and DI Factory with the assistance of cinematographer Pawel Edelman.",9a7e8de0cdce452cafa617951cea6eb3,4
the pianist (restored),4k uhd,"The restored version of The Pianist was released on 4K UHD by StudioCanal in Germany, France, and the UK.",9a7e8de0cdce452cafa617951cea6eb3,4
