node_1,node_2,edge,chunk_id,count
jack-jack attack,specifically for this home-video release,"Two newly commissioned Pixar short films, Jack-Jack Attack and Mr. Incredible and Pals, which were made specifically for this home-video release,",454d375651ef4050bcc924cdcd9cfe80,4
mr. incredible and pals,specifically for this home-video release,"Two newly commissioned Pixar short films, Jack-Jack Attack and Mr. Incredible and Pals, which were made specifically for this home-video release,",454d375651ef4050bcc924cdcd9cfe80,4
boundin',premiered alongside the feature film in its original theatrical release,"The VHS release only featured the short, Boundin'.",454d375651ef4050bcc924cdcd9cfe80,4
the incredibles,alfie,"The Incredibles was released with Alfie on November 5, 2004.",ebe891caadb5466e896c5b65a7eabb54,4
the incredibles,"november 5, 2004","The Incredibles was released on November 5, 2004.",ebe891caadb5466e896c5b65a7eabb54,4
the incredibles,70.7 million,"The Incredibles earned $70.7 million from 3,933 theaters.",ebe891caadb5466e896c5b65a7eabb54,4
the incredibles,number #1 spot at the box office,The Incredibles opened in the number #1 spot at the box office.,ebe891caadb5466e896c5b65a7eabb54,4
the incredibles,"saw, the grudge, shark tale, ray, ladder 49","The Incredibles opened in the number #1 spot at the box office dominating Saw, The Grudge, Shark Tale, Ray, Ladder 49 and other films.",ebe891caadb5466e896c5b65a7eabb54,4
the incredibles,slump,"Despite its opening, the overall Hollywood revenues fell, continuing a box office slump that had lingered for most of the fall season.",ebe891caadb5466e896c5b65a7eabb54,4
the incredibles,frozen ii,"For 15 years, The Incredibles had the biggest November opening weekend for an animated film until it was dethroned by Frozen II in 2019.",ebe891caadb5466e896c5b65a7eabb54,4
the incredibles,the polar express,The Incredibles continued to rule the box office while staying ahead of The Polar Express.,ebe891caadb5466e896c5b65a7eabb54,4
the incredibles,"april 14, 2005","The Incredibles completed its theatrical run in the United States and Canada on April 14, 2005.",ebe891caadb5466e896c5b65a7eabb54,4
the incredibles,$26 million,The Incredibles earned $26 million in its third weekend.,ebe891caadb5466e896c5b65a7eabb54,4
alfie,the incredibles,"The Incredibles was released with Alfie on November 5, 2004.",ebe891caadb5466e896c5b65a7eabb54,4
the incredibles,standard summer action film,"Eleanor Ringel Gillespie of The Atlanta Journal-Constitution described the movie as 'boring' due to its recurring pastiches of earlier action films, leading Jessica Winter of The Village Voice to criticize it for playing like a standard summer action film despite being released in early November. Winter's review was titled as 'Full Metal Racket.'",778dd072ef7847c9add39eed39d97665,4
the incredibles,one of the greatest films of the twenty-first century,"included on a number of best-of lists, based on retrospective appraisal by The Guardian",85e319e40db2479ca8cd93a45763aec1,4
the incredibles,number 6 on his list of the decade's best films,named by Travers in his list of the decade's best films,85e319e40db2479ca8cd93a45763aec1,4
the incredibles,one of the best animated films,listed as one of the best animated films by several publications,85e319e40db2479ca8cd93a45763aec1,4
the incredibles,one of the best superhero films,appeared on several lists of the best superhero films by various outlets,85e319e40db2479ca8cd93a45763aec1,4
the incredibles,"number 48 on the writers guild of america's ""101 greatest screenplays of the 21st century (so far)""",listed as number 48 on the Writers Guild of America's list,85e319e40db2479ca8cd93a45763aec1,4
the incredibles,best animated feature,led the 77th Academy Awards season with four nominations (including Best Original Screenplay and Sound Mixing) and received two Oscars: Best Animated Feature and Sound Editing.,8fda8fde204546c78eb1225b5f160419,4
the incredibles,best original screenplay,led the 77th Academy Awards season with four nominations,8fda8fde204546c78eb1225b5f160419,4
the incredibles,sound mixing,led the 77th Academy Awards season with four nominations,8fda8fde204546c78eb1225b5f160419,4
the incredibles,joe morgenstern of the wall street journal,called The Incredibles the year's best picture.,8fda8fde204546c78eb1225b5f160419,4
the incredibles,premiere magazine,released a cross-section of all the top critics in America and The Incredibles placed at number three,8fda8fde204546c78eb1225b5f160419,4
the incredibles,review aggregation website rotten tomatoes,cross-referenced reviews that suggested it was its year's highest-rated film.,8fda8fde204546c78eb1225b5f160419,4
the incredibles,empire's 500 greatest films of all time,included it as one of the top 10 films of 2004 at number 400.,8fda8fde204546c78eb1225b5f160419,4
the incredibles,american film institute,included it as one of the top 10 films of 2004.,8fda8fde204546c78eb1225b5f160419,4
the incredibles,golden globe award for best motion picture – musical or comedy,was nominated for the 2004 Golden Globe Award for Best Motion Picture – Musical or Comedy.,8fda8fde204546c78eb1225b5f160419,4
the incredibles,saturn award for best animated film,won the Saturn Award for Best Animated Film.,8fda8fde204546c78eb1225b5f160419,4
incredibles 2,sequel,A movie titled Incredibles 2 is a continuation or sequel to a previous movie.,acb9490a6d214510aff655413487edb1,4
incredibles 2,released,"The movie Incredibles 2 was officially made available for viewing on June 15, 2018.",acb9490a6d214510aff655413487edb1,4
critical success,incredibles 2,The movie Incredibles 2 received positive reviews and criticisms from the film industry.,acb9490a6d214510aff655413487edb1,4
commercial success,incredibles 2,"The movie Incredibles 2 was commercially successful, earning a significant amount of money in box office collections.",acb9490a6d214510aff655413487edb1,4
incredibles 2,considered,"Incredibles 2 is being perceived as inferior or less impressive compared to its predecessor, Incredibles.",acb9490a6d214510aff655413487edb1,4
