Question,Answer
Was R. J. Helton involved in the production process of 'From Justin to Kelly'?,No
Was Christina Christian involved in the production process of 'From Justin to Kelly'?,Yes
Were script revisions and rehearsals for dances and singing part of the production process for 'From Justin to Kelly'?,Yes
Were script revisions carried out during the production process of 'From Justin to Kelly'?,Yes
Were actor readings and script revisions part of the production process for 'From Justin to Kelly'?,Yes
Was 'From Justin to Kelly' subject to a six-week shooting schedule?,Yes
