Question,Answer
Did Rachel play a significant role in reflecting the impact of Lee's reaction to Elle's decision to go to Harvard with Noah?,No
Did Elle apply to the University of Southern California to study game design in *The Kissing Booth 3*?,Yes
Was Lee's girlfriend Rachel hoping for a future reconciliation with Lee?,Yes
Did Lee and Rachel get engaged after college?,Yes
Did Lee's girlfriend Rachel play a significant role in the emotional fallout of Elle's decision to go to Harvard with Noah?,No
Did Elle apply to the University of Southern California to study game design in *The Kissing Booth 3*?,Yes
Did Lee and Chloe share childhood memories at the beach house?,No
Did Elle choose to go to Harvard with Noah in *The Kissing Booth 3*?,Yes
Did Chloe's friendship with Noah influence Elle's decision-making process in *The Kissing Booth 3*?,No
Did Chloe play a significant role in the relationship between Elle and Noah in *The Kissing Booth 3*?,No
Is Lee's relationship with Elle perceived as less important than her relationship with Noah?,Yes
Was Linda involved in an argument with Elle's father in *The Kissing Booth 3*?,Yes
Did Elle eventually understand and accept Linda in *The Kissing Booth 3*?,Yes
Did Lee and Marco share childhood memories at the beach house in *The Kissing Booth 3*?,No
Did Elle choose to go to Harvard with Noah in *The Kissing Booth 3*?,Yes
Did Marco's job in the area represent Elle's past romantic connections in *The Kissing Booth 3*?,No
Did Elle break up with Noah because of her acceptance letter to Berkeley?,Yes
Was Marco influenced by Elle's past romantic connections when making decisions?,No
Did Marco's job in the area represent Elle's past romantic connections and potential emotional fallout of her decision-making process?,No
Did Elle eventually understand and accept Linda in *The Kissing Booth 3*?,Yes
Did Marco getting a job in the area represent Elle's past romantic connections and potential emotional fallout of her decision-making process?,Yes
Was Linda representing Elle's late mother's friendship circle in *The Kissing Booth 3*?,No
Did Elle's acceptance or rejection of Linda represent the emotional fallout of her late mother's friendship circle in *The Kissing Booth 3*?,No
Did Linda's presence in Elle's life represent her late mother's friendship circle in *The Kissing Booth 3*?,Yes
Did Elle break up with Noah because of her acceptance letter to Berkeley?,Yes
Was Linda a representation of Elle's late mother's friendship circle in *The Kissing Booth 3*?,No
Was Linda the cause of the argument between Elle and her father in *The Kissing Booth 3*?,Yes
Was Linda eventually accepted by Elle in *The Kissing Booth 3*?,Yes
Did Lee react negatively to Elle's decision to go to Harvard with Noah?,No
"Did Noah and Marco clash, showcasing the potential conflict between Elle's romantic interests and possible impact on Elle's decision-making process in *The Kissing Booth 3*?",Yes
Did Marco and Noah have a conflict-laden relationship?,Yes
Did Noah suggest going on a motorcycle ride to Elle in *The Kissing Booth 3*?,Yes
Does Elle perceive her relationship with Lee as less important than her relationship with Noah?,Yes
Does Elle prioritize her relationship with Noah over her relationship with Lee in *The Kissing Booth 3*?,Yes
Did Chloe encourage Elle to talk to Noah?,Yes
Did Chloe play a significant role in Elle's decision to go to Harvard with Noah?,Yes
Did Chloe play a significant role in helping Elle deal with Berkeley's deadline in *The Kissing Booth 3*?,Yes
Did Chloe encourage Elle to talk to Noah in *The Kissing Booth 3*?,Yes
Did Chloe encourage Elle to talk to Lee in *The Kissing Booth 3*?,No
Did Chloe play a role in encouraging Elle to talk to Noah in *The Kissing Booth 3*?,Yes
Did Chloe play a significant role in helping Elle reconcile with Linda in *The Kissing Booth 3*?,Yes
Does Rachel hope for a future reconciliation with Lee?,Yes
Did Rachel and Lee have disagreements and misunderstandings in their relationship?,Yes
Did Marco getting a job in the area represent Elle's past romantic connections and potential emotional fallout of her decision-making process?,Yes
Did Elle have an argument with her father due to his relationship with Linda in *The Kissing Booth 3*?,Yes
Did Elle eventually reconcile with Linda in *The Kissing Booth 3*?,Yes
Did Elle and Noah ride down the coastline in California on their motorcycles?,Yes
Did Elle choose to go to Harvard with Noah?,Yes
Did Noah suggest going on a motorcycle ride to help Elle with Berkeley's deadline in *The Kissing Booth 3*?,No
Did Noah and Elle break up due to Elle's acceptance letter to Berkeley?,Yes
Did Noah suggest going on a motorcycle ride with Elle when he was back in town?,Yes
Did Elle and Noah go on a motorcycle ride down the coastline in California?,Yes
Did Elle reconcile with Linda in *The Kissing Booth 3*?,Yes
Did Lee apply to Harvard with Noah in *The Kissing Booth 3*?,No
Did Elle choose to go to Harvard with Noah for academic aspirations and potential future opportunities?,Yes
Did Lee and Elle visit the fated Kissing Booth at the Charity Fair and Carnival?,Yes
Did Noah and Elle break up because of Elle's acceptance letter to Berkeley?,Yes
Does Lee feel that his relationship with Elle is less important than her relationship with Noah?,Yes
Did Elle apply to the University of Southern California to study game design in *The Kissing Booth 3*?,Yes
Did Linda reconcile with Elle's father in *The Kissing Booth 3*?,Yes
Did Rachel and Lee get back together and become engaged after college?,Yes
Did Rachel and Lee get engaged after college?,Yes
