Question,Answer
Did Larry become suspicious of The Cat after seeing him drive past on a police motorcycle?,Yes
Did Larry realize that The Cat was behind the entire day's events?,Yes
Did Larry race after Joan on a police motorcycle?,Yes
Did Joan return home with Sally in *Conrad*?,Yes
Did Joan accept Conrad's true nature as a troublemaker but acknowledge his nice qualities inside?,Yes
Was Larry humiliated and dismayed after Joan dumped him?,Yes
Did Larry try to win back Joan after she dumped him?,Yes
