node_1,node_2,edge,chunk_id,count
dark phoenix,x-men film series,"Dark Phoenix is a 2019 American superhero film based on the Marvel Comics X-Men characters, which is part of the X-Men film series.",dde5b168676543f2a1c417beea7fe929,4
simon kinberg,director,"Simon Kinberg (producer, writer, and director) led the production, writing, and direction of Dark Phoenix.",dde5b168676543f2a1c417beea7fe929,4
james mcavoy,ensemble cast,Dark Phoenix features an ensemble cast that includes James McAvoy.,dde5b168676543f2a1c417beea7fe929,4
michael fassbender,ensemble cast,Dark Phoenix also stars Michael Fassbender as part of its ensemble cast.,dde5b168676543f2a1c417beea7fe929,4
jennifer lawrence,ensemble cast,The film's ensemble cast also includes Jennifer Lawrence.,dde5b168676543f2a1c417beea7fe929,4
nicholas hoult,ensemble cast,"Dark Phoenix features an ensemble cast, which also consists of Nicholas Hoult.",dde5b168676543f2a1c417beea7fe929,4
sophie turner,jean grey,The story in Dark Phoenix revolves around Sophie Turner's character Jean Grey.,dde5b168676543f2a1c417beea7fe929,4
tye sheridan,ensemble cast,Dark Phoenix's ensemble cast also includes Tye Sheridan.,dde5b168676543f2a1c417beea7fe929,4
alexandra shipp,ensemble cast,The film's ensemble cast is completed by Alexandra Shipp.,dde5b168676543f2a1c417beea7fe929,4
jessica chastain,opponents seeking to control or kill jean grey,Dark Phoenix portrays Jessica Chastain as one of the opponents trying to control or eliminate Jean Grey.,dde5b168676543f2a1c417beea7fe929,4
jean grey,phoenix,Dark Phoenix chronicles the origin story of how Jean Grey becomes the Phoenix.,dde5b168676543f2a1c417beea7fe929,4
x-men: apocalypse,predecessor film to dark phoenix,"Dark Phoenix serves as the sequel to X-Men: Apocalypse, which was released in 2016.",dde5b168676543f2a1c417beea7fe929,4
hugh jackman,wolverine (apart from deadpool films),"Dark Phoenix, being the final installment of the prequel films, does not feature Hugh Jackman's character Wolverine (except in Deadpool movies).",dde5b168676543f2a1c417beea7fe929,4
bad hat harry productions,producer,"Though Bad Hat Harry Productions was involved in producing the X-Men films, they were uncredited due to sexual assault allegations made against Bryan Singer in 2019.",dde5b168676543f2a1c417beea7fe929,4
jean grey,charles xavier,"In 1975, Jean Grey, an eight-year-old with telekinetic powers, is orphaned in a car crash and brought to Charles Xavier's School for Gifted Youngsters where he promises to teach her to control her mutant abilities.",54d8c06aca1c456b966468c06370785e,4
jean grey,dark phoenix,"In Dark Phoenix, Jean Grey reawakens the Dark Phoenix entity within herself after being exposed to a powerful cosmic force, causing her powers to spiral out of control.",54d8c06aca1c456b966468c06370785e,4
dark phoenix,x-men,Dark Phoenix poses a severe threat to the X-Men as she seeks to claim her rightful place as the most powerful mutant in existence.,54d8c06aca1c456b966468c06370785e,4
space shuttle endeavour's damage,solar flare-like energy,"In 1992, during the Space Shuttle Endeavour’s first mission, the shuttle was damaged by solar flare-like energy.",c093ee7f6574462c90ac9e6dd7b920f0,4
president's call,x-men,The president called upon the X-Men to save the astronauts.,c093ee7f6574462c90ac9e6dd7b920f0,4
jean's psychic powers,amplified,Jean's psychic powers became amplified.,c093ee7f6574462c90ac9e6dd7b920f0,4
emotional state,deteriorates,The emotional state of Jean deteriorated.,c093ee7f6574462c90ac9e6dd7b920f0,4
xavier's suppression,jean's memory,Xavier revealed to the other X-Men that he suppressed Jean's memory of causing the car crash as a child to keep the psychological trauma from making her unstable.,c093ee7f6574462c90ac9e6dd7b920f0,4
mental blocks,destroying,Jean's enhanced power is destroying the mental blocks and she is now experiencing PTSD symptoms.,c093ee7f6574462c90ac9e6dd7b920f0,4
visions,jean,Jean saw visions of her father and found him alive.,c093ee7f6574462c90ac9e6dd7b920f0,4
jean's memory,recovers,Jean recovered her memory.,c093ee7f6574462c90ac9e6dd7b920f0,4
jean's powers,uncontrollable,"At the time, Jean's powers were uncontrollable.",c093ee7f6574462c90ac9e6dd7b920f0,4
car crash,caused,"The X-Men arrived, and after a skirmish in which Peter Maximoff was injured, it was discovered that Jean's uncontrollable powers caused the car crash.",c093ee7f6574462c90ac9e6dd7b920f0,4
jean's mother,killed,"The X-Men arrived, and after a skirmish in which Peter Maximoff was injured, it was discovered that Jean's uncontrollable powers killed her mother during the car crash.",c093ee7f6574462c90ac9e6dd7b920f0,4
raven darkhölme,frozen,Xavier mentally froze everyone to allow Raven Darkhölme to persuade Jean to come home.,c093ee7f6574462c90ac9e6dd7b920f0,4
jean,erik lehnsherr,"Fleeing to the island of Genosha, Jean asks Erik for help controlling her rage. Military helicopters arrive demanding Jean's surrender and she attacks them causing Erik to angrily banish her.",809611dc3b164ae6ab7dbbbc93ca8c1b,4
jean,vuk,"Found by Vuk, leader of the shape-shifting alien race known as the D'Bari, who explains that the cosmic force Jean absorbed had wiped out the D'Bari planet, consuming everything in its path until it was drawn to Jean.",809611dc3b164ae6ab7dbbbc93ca8c1b,4
erik lehnsherr,jean,Erik confronts Jean and Vuk but is defeated by Jean's amplified powers in the battle between their factions.,809611dc3b164ae6ab7dbbbc93ca8c1b,4
xavier,jean,"Learning of Erik's plan, Kurt Wagner teleports the X-Men to New York to save Jean and Xavier convinces Jean to read his memories, helping her former personality resurface.",809611dc3b164ae6ab7dbbbc93ca8c1b,4
hank,xavier,"Blaming Xavier for Raven's death, Hank leaves the school and allies with Erik and his faction of mutants in a plan to kill Jean.",809611dc3b164ae6ab7dbbbc93ca8c1b,4
government troops,mutant factions,Both mutant factions are subdued by government troops while Vuk escapes during the battle between them.,809611dc3b164ae6ab7dbbbc93ca8c1b,4
scott summers,jean,"When Vuk reveals the D'Bari's intent to use the Phoenix Force to conquer Earth, Scott stops Jean when she attempts to let Vuk take the force from her.",809611dc3b164ae6ab7dbbbc93ca8c1b,4
jean grey,vuk,"Vuk attempts to drain the force from Jean twice, and Jean saves the mutants from the ensuing train wreck and disintegrates the remaining D'Bari by transforming into a phoenix-shaped being of energy. The two have opposing goals: Vuk wants to extract Jean's powers for herself, while Jean uses her powers to stop Vuk.",7240bf0927d44a85a694f2864ccf3487,4
charles xavier,jean grey,"Charles confers with Jean within his mind and convinces her allies to save her. They also unite against the D'Bari attackers. Jean forgives Charles for hiding her powers, saving the mutants from a train wreck.",7240bf0927d44a85a694f2864ccf3487,4
charles xavier,hank mccoy,"Charles convinces Hank to join them in stopping Vuk and freeing the mutants. They also unite against the D'Bari attackers, and Hank takes Charles' place as dean of Xavier's school.",7240bf0927d44a85a694f2864ccf3487,4
scott shepherd,jean grey,"Scott is John Grey, Jean's father. Their relationship is not directly related to stopping Vuk, but it adds context about Jean.",7240bf0927d44a85a694f2864ccf3487,4
erik lehnsherr,charles xavier,"Erik invites Charles to a game of chess in Paris. This may indicate that Erik is still plotting against Charles, or it could just be a chance encounter.",7240bf0927d44a85a694f2864ccf3487,4
jones,vuk,Jones is Vuk's second in command and helps her with the D'Bari attack. Their relationship adds to Vuk's power and influence.,7240bf0927d44a85a694f2864ccf3487,4
president of the united states,other cast members,"The President appears briefly as a background character, indicating that this is set in the same universe as the other X-Men movies.",7240bf0927d44a85a694f2864ccf3487,4
kota eberhardt,selene gallio,"In the context, Kota Eberhardt portrays Selene Gallio.",5cb5c100d6a64d87bbeaca13db025f2c,4
andrew stehlin,ariki,"Andrew Stehlin portrays Ariki, a mutant who can utilize his hair braids as a weapon in the context.",5cb5c100d6a64d87bbeaca13db025f2c,4
halston sage,dazzler,"Halston Sage briefly appears as Dazzler in the character's first cinematic appearance, according to the context.",5cb5c100d6a64d87bbeaca13db025f2c,4
hannah emily anderson,elaine,"According to the given context, Hannah Emily Anderson appears as Jean's mother Elaine.",5cb5c100d6a64d87bbeaca13db025f2c,4
lamar johnson,match,The context mentions that Lamar Johnson appears as Match.,5cb5c100d6a64d87bbeaca13db025f2c,4
x2,the dark phoenix saga,"Writer Zak Penn convinced director Bryan Singer not to adapt the Marvel Comics storyline 'The Dark Phoenix Saga' for the film X2 (2003), believing it was 'too soon to go into the Phoenix story and it was too soon to get cosmic'. This decision was made with the intention of exploring the character of Jean Grey / Phoenix subtly, in preparation for adapting the full story in the next film instead.",48d14b0cae2a4d9682092d62ca51ef16,4
x-men: the last stand,the dark phoenix saga,"The studio chose to adapt only one of the film's 'parallel storylines', which was 'The Dark Phoenix Saga'. This version of the story, directed by Brett Ratner instead of Bryan Singer, was not well received by fans and critics.",48d14b0cae2a4d9682092d62ca51ef16,4
x-men: the last stand,gifted,"An executive at 20th Century Fox suggested that the 'Gifted' storyline also be in the film X-Men: The Last Stand, which was directed by Brett Ratner instead of Bryan Singer. This version of the story was not well received by fans and critics, as was the adaptation of 'The Dark Phoenix Saga'.",48d14b0cae2a4d9682092d62ca51ef16,4
x-men,next mainline x-men film,"In July, Kinberg said he would begin writing the next mainline X-Men film 'real soon'.",c6962a1e7ac64267abac6422a10fb019,4
kinberg,writing the new script,"At that November, Fox was said to be pressing 'the reset button' on the franchise due to the financial and critical under-performance of Apocalypse, with the franchise being reconfigured and Singer not returning to direct the next film. McAvoy, Fassbender, Lawrence, and Nicholas Hoult's contracts from the previous trilogy had ended, but Kinberg was optimistically writing the new script with them in mind.",c6962a1e7ac64267abac6422a10fb019,4
x-men,next mainline x-men film,"It was rumored in February 2017 that the next film would be titled X-Men: Supernova, and would begin filming that June.",c6962a1e7ac64267abac6422a10fb019,4
turner,return for the film,"In February, Turner confirmed that she would return for the film.",c6962a1e7ac64267abac6422a10fb019,4
kinberg,interested in making his directorial debut with the film,"Also in February, Kinberg was believed to be interested in making his directorial debut with the film,",c6962a1e7ac64267abac6422a10fb019,4
fox,"looking to negotiate new deals with lawrence, fassbender, mcavoy, and hoult to return","By the end of the month, Kinberg described reports that he might direct the film as 'premature', but added that, if he were to direct, he would not be daunted by the scale of the film due to his experience writing and producing many of the other X-Men films. He also reiterated that, if given another opportunity to do so, he would adapt 'The Dark Phoenix Saga' differently than they had in The Last Stand.",c6962a1e7ac64267abac6422a10fb019,4
jean grey,mental health issues,simon kinberg began writing the film in late 2016. The movie would work as an origin story about how jean grey becomes the phoenix and would center around her struggling with mental health issues. Research was done on various trauma-related mental illnesses.,bf7698912f2641bd9ca2364b4a51a0d7,4
emma frost,returned in the film,"concept art revealed that, originally, the film was to feature the return of emma frost and a new incarnation of the hellfire club.",bf7698912f2641bd9ca2364b4a51a0d7,4
harry leland,new member of the hellfire club,"concept art revealed that, originally, the film was to feature a new incarnation of the hellfire club. The new members were harry leland, friedrich von roehm, fenris, shinobi shaw, and the red lotus gang.",bf7698912f2641bd9ca2364b4a51a0d7,4
friedrich von roehm,new member of the hellfire club,"concept art revealed that, originally, the film was to feature a new incarnation of the hellfire club. The new members were harry leland, friedrich von roehm, fenris, shinobi shaw, and the red lotus gang.",bf7698912f2641bd9ca2364b4a51a0d7,4
fenris,new member of the hellfire club,"concept art revealed that, originally, the film was to feature a new incarnation of the hellfire club. The new members were harry leland, friedrich von roehm, fenris, shinobi shaw, and the red lotus gang.",bf7698912f2641bd9ca2364b4a51a0d7,4
shinobi shaw,new member of the hellfire club,"concept art revealed that, originally, the film was to feature a new incarnation of the hellfire club. The new members were harry leland, friedrich von roehm, fenris, shinobi shaw, and the red lotus gang.",bf7698912f2641bd9ca2364b4a51a0d7,4
the skrulls,film's villains,"after the script was rewritten, the skrulls were replaced with the d'bari.",bf7698912f2641bd9ca2364b4a51a0d7,4
jessica chastain's character,inspired by mastermind and emma frost,"andrew stehlin was set to play the red lotus gang. They were replaced with the skrulls as the film's villains after the script was rewritten, and the skrulls were replaced with the d'bari after reshoots. However, the role the aliens play in the story was still based on the hellfire club.",bf7698912f2641bd9ca2364b4a51a0d7,4
charles xavier,watched by the d'bari at the white house,"concept art revealed that the scene with the d’bari watching charles xavier at the white house was an element from the earlier script, as the hellfire club can be seen watching the event on television at their lair.",bf7698912f2641bd9ca2364b4a51a0d7,4
dark phoenix,organic and grounded approach,"Kinberg focused on an organic and grounded approach for Dark Phoenix in response to criticisms of Apocalypse's heightened reality, using real world imagery such as footage of disasters and lightning strikes while pitching the film to the studio.",b7603a7919824814b9098e341d23d344,4
dark phoenix,younger version of rogue,Parker hinted that a younger version of the character Rogue might appear in Dark Phoenix.,b7603a7919824814b9098e341d23d344,4
dark phoenix,cosmic elements of the 'dark phoenix' storyline,Parker also suggested that the film might explore the cosmic elements of the 'Dark Phoenix' storyline.,b7603a7919824814b9098e341d23d344,4
fox,dark phoenix,"Fox officially titled the film Dark Phoenix in April 2017 and gave it a release date of November 2, 2018.",b7603a7919824814b9098e341d23d344,4
dark phoenix saga,the last stand,The script for 'X-Men: Dark Phoenix' will hew closer to the original 'Dark Phoenix Saga' by Chris Claremont and John Byrne than 'X-Men: The Last Stand' did.,63484593a1674a3c9500cd9663652f93,4
lilandra,chastain,"At that time, Chastain was in talks to join the cast as Shi'ar Empress Lilandra, the film's villain.",63484593a1674a3c9500cd9663652f93,4
dazzler,apocalypse,"It was later revealed that the character Dazzler would appear in the film, after being hinted at in a scene that was eventually deleted from Apocalypse.",63484593a1674a3c9500cd9663652f93,4
kinberg,fox,"Fox confirmed that Kinberg would direct the film and that McAvoy, Fassbender, Lawrence, and Hoult had all signed on to return for one more film.",63484593a1674a3c9500cd9663652f93,4
mcavoy,kinberg,"Fox confirmed that Kinberg would direct the film and that McAvoy, Fassbender, Lawrence, and Hoult had all signed on to return for one more film.",63484593a1674a3c9500cd9663652f93,4
fassbender,kinberg,"Fox confirmed that Kinberg would direct the film and that McAvoy, Fassbender, Lawrence, and Hoult had all signed on to return for one more film.",63484593a1674a3c9500cd9663652f93,4
lawrence,kinberg,"Fox confirmed that Kinberg would direct the film and that McAvoy, Fassbender, Lawrence, and Hoult had all signed on to return for one more film.",63484593a1674a3c9500cd9663652f93,4
hoult,kinberg,"Fox confirmed that Kinberg would direct the film and that McAvoy, Fassbender, Lawrence, and Hoult had all signed on to return for one more film.",63484593a1674a3c9500cd9663652f93,4
apocalypse actors,x-men: apocalypse,"Alexandra Shipp, Tye Sheridan, and Kodi Smit-McPhee were also confirmed to be returning",63484593a1674a3c9500cd9663652f93,4
producers,x-men: dark phoenix,"At that time, Chastain was in talks to join the cast as Shi'ar Empress Lilandra, the film's villain.",63484593a1674a3c9500cd9663652f93,4
kinberg,producers,Producer for the film were revealed to be Kinberg and Parker.,63484593a1674a3c9500cd9663652f93,4
daniel orlandi,costume designer for the film,returned for the movie after working on Logan.,9f667495389c4475894b02f8eb6ec7d1,4
kinberg,worked with daniel orlandi,to come up with costumes for the X-Men that were closer to the original comic designs.,9f667495389c4475894b02f8eb6ec7d1,4
logan,"inspired design ideas for the costumes, sets, props, and title design.","Kinberg looked to Logan for general design inspiration wanting to replicate the ""naturalistic"" and ""handmade"" quality of that film.",9f667495389c4475894b02f8eb6ec7d1,4
x-men,final costumes for the film feature a combination of designs from many different incarnations.,Daniel Orlandi and Kinberg worked to come up with costumes that were closer to the original comic designs.,9f667495389c4475894b02f8eb6ec7d1,4
original comic designs,influenced kinberg's desire for costume changes in the film.,"Kinberg wanted to see in the films since he first joined the franchise, but had never been in a position to control before.",9f667495389c4475894b02f8eb6ec7d1,4
x-men,dark phoenix saga,The film is an adaptation of the comic storyline 'Dark Phoenix Saga' which is a major arc in the X-Men comics. The X-Men franchise has previously adapted parts of this storyline in 'X-Men: The Last Stand'.,e32c5837cd1044269b52c9a1a74d5c66,4
kinberg,human,"According to director Simon Kinberg, he wants the film to be 'human' and emotional like previous X-Men films. This grounded approach is in contrast to previous adaptations of this storyline which were more operatic.",e32c5837cd1044269b52c9a1a74d5c66,4
cudmore,colossus,"Daniel Cudmore has confirmed his appearance in the film, but is unsure whether he will be reprising his role as Colossus from previous films in the franchise.",e32c5837cd1044269b52c9a1a74d5c66,4
munn,appearance,"Olivia Munn has initially confirmed her appearance in the film, but is unclear whether she will be reprising her role as Betsy Braddock / Psylocke from previous films in the franchise.",e32c5837cd1044269b52c9a1a74d5c66,4
peters,quicksilver,"Evan Peters has been set to reprise his role as Quicksilver, a popular character from previous X-Men films.",e32c5837cd1044269b52c9a1a74d5c66,4
colossus,previous films in the franchise,he would be reprising his role as Colossus from previous films in the franchise,71521fe3dcc24020a25330614c53ff6e,4
colossus,current film,"filming was completed on October 14, 2017.",71521fe3dcc24020a25330614c53ff6e,4
fox,kinberg,"Fox collaborated with Kinberg to delay the release of Dark Phoenix and schedule reshoots for the film after receiving feedback from audiences during a test screening. This decision was made because not all necessary cast members could be gathered until August or September 2018, which would not have left enough time to complete post-production work before the original November 2018 release date.",e9958369d9be46049feb91f0e1cf06db,4
dark phoenix,"november 2, 2018","Dark Phoenix was originally scheduled for release on November 2, 2018. However, the film's release date was delayed by Fox in March 2018 due to the need for routine reshoots and post-production work after receiving feedback from audiences during a test screening.",e9958369d9be46049feb91f0e1cf06db,4
dark phoenix,"february 14, 2019","Following the delay, Dark Phoenix was scheduled for release on February 14, 2019. This date was chosen to avoid competition with The Nutcracker and the Four Realms (2018) and to provide enough time to complete post-production work after the reshoots.",e9958369d9be46049feb91f0e1cf06db,4
dark phoenix,third act,Kinberg revealed that he was looking to rework the third act of Dark Phoenix and re-wrote part of the script ahead of the reshoots.,e9958369d9be46049feb91f0e1cf06db,4
dark phoenix,$10 million,"According to Kinberg, the planned reshoots for Dark Phoenix would cost less than $10 million.",e9958369d9be46049feb91f0e1cf06db,4
dark phoenix,president's day weekend,"The new February release date for Dark Phoenix was noted as having the film opening on President's Day weekend, which had proved to be successful for Deadpool and Marvel's Black Panther (2018).",e9958369d9be46049feb91f0e1cf06db,4
dark phoenix,post-production work,"The delay in releasing Dark Phoenix allowed enough time to complete post-production work after the reshoots, ensuring that the film would be finished and looking perfect.",e9958369d9be46049feb91f0e1cf06db,4
dark phoenix,soundtrack initially received mixed critical response,The soundtrack for the movie Dark Phoenix received a mixed critical response upon its initial release.,29df3c298a2f488bbc823e995b5afe3d,4
xperiments from dark phoenix,second album featuring previously unreleased music written for the film,"After remaining unreleased, fan-led petitions led to the announcement of a second album, Xperiments from Dark Phoenix, which contains previously unreleased music written for the movie Dark Phoenix.",29df3c298a2f488bbc823e995b5afe3d,4
"august 5, 2019",release date of xperiments from dark phoenix,"The second album, Xperiments from Dark Phoenix, was released on August 5, 2019.",29df3c298a2f488bbc823e995b5afe3d,4
dark phoenix,x-men: the last stand,Responses to the trailer of Dark Phoenix widely considered it to be too similar to X-Men: The Last Stand.,3495fb30867048b989488a6892a00f35,4
trailer of dark phoenix,space and alien elements,"If the trailer had shown more of the film's space and alien elements, it would have differentiated it from the Last Stand adaptation.",3495fb30867048b989488a6892a00f35,4
characters,big effects or action,The focusing on the characters by Fox is a risk given that audiences have indicated through the box office numbers of X-Men: Apocalypse that they are not necessarily interested in this version of the X-Men characters.,3495fb30867048b989488a6892a00f35,4
turner,the late late show with james corden,"On September 26, 2018, Turner revealed the first trailer for Dark Phoenix on The Late Late Show with James Corden before Fox released it online.",3495fb30867048b989488a6892a00f35,4
dark phoenix,fox,Some press estimated that Fox spent a total of around $90 million promoting the film.,3495fb30867048b989488a6892a00f35,4
dark phoenix,fox marketing team,"In March 2019, a Fox marketing executive reported promotional difficulties for Dark Phoenix due to long-term employees of the team being laid off after Fox's merger with Disney. (Vanity Fair)",528a770a09b944ff98aa02be191cbf20,4
dark phoenix,disney,"After Fox's merger with Disney, there were reports of difficulties integrating Dark Phoenix into their marketing department due to a lack of time. (Deadline Hollywood)",528a770a09b944ff98aa02be191cbf20,4
dark phoenix,awareness rates,"Based on an NRG tracking poll taken in May, Dark Phoenix had lower awareness rates than any other film in the series. (The Hollywood Reporter)",528a770a09b944ff98aa02be191cbf20,4
dark phoenix,music video,"A music video for ""Extraordinary Being"" by Emeli Sandé was released featuring footage from Dark Phoenix on May 23, 2019. (Official release)",528a770a09b944ff98aa02be191cbf20,4
dark phoenix,x-men: dark phoenix,"Dark Phoenix is the international title of the film X-Men: Dark Phoenix, which was released outside of the United States.",70e87f9760e64c47bbd8b830f5fb0a6f,4
dark phoenix,emeli sandé,"The music video for Emeli Sandé's song 'Extraordinary Being' features footage from Dark Phoenix, as mentioned on May 23, 2019.",70e87f9760e64c47bbd8b830f5fb0a6f,4
dark phoenix,20th century fox,Dark Phoenix was distributed by 20th Century Fox.,70e87f9760e64c47bbd8b830f5fb0a6f,4
dark phoenix,"june 7, 2019","The United States theatrical release of Dark Phoenix began on June 7, 2019.",70e87f9760e64c47bbd8b830f5fb0a6f,4
dark phoenix,"november 2, 2018","When it was originally slated for release, Dark Phoenix was supposed to be released on November 2, 2018.",70e87f9760e64c47bbd8b830f5fb0a6f,4
dark phoenix,brie larson,"The release date of Dark Phoenix was changed and moved away from the release of Captain Marvel, which stars Brie Larson.",70e87f9760e64c47bbd8b830f5fb0a6f,4
dark phoenix,captain marvel,"Before being pushed to June, the release date of Dark Phoenix was changed and moved away from the release of Captain Marvel.",70e87f9760e64c47bbd8b830f5fb0a6f,4
dark phoenix,the secret life of pets 2,"In the United States and Canada, Dark Phoenix and The Secret Life of Pets 2 were released alongside each other. While Dark Phoenix was initially projected to gross $50–60 million from its opening weekend, after making $14 million on its first day, projections were lowered to $34 million.",d93f971ea51f4cd38807f35cc309cb8f,4
dark phoenix,$50-million debut,"In the United States and Canada, Dark Phoenix was initially projected to gross $50–60 million from its opening weekend.",d93f971ea51f4cd38807f35cc309cb8f,4
dark phoenix,$32.8 million,"Dark Phoenix debuted to $32.8 million in the United States and Canada, finishing second behind The Secret Life of Pets 2.",d93f971ea51f4cd38807f35cc309cb8f,4
dark phoenix,china,The film was projected to gross $50–60 million from China.,d93f971ea51f4cd38807f35cc309cb8f,4
