node_1,node_2,edge,chunk_id,count
dark phoenix,south korea,The film grossed $5.6 million in South Korea.,d93f971ea51f4cd38807f35cc309cb8f,4
dark phoenix,united kingdom,The film grossed $4.8 million in the United Kingdom.,d93f971ea51f4cd38807f35cc309cb8f,4
dark phoenix,x-men franchise,"The X-Men film series has come to an end with 'Dark Phoenix', which is also the lowest-rated installment of the franchise on Rotten Tomatoes. This indicates that 'Dark Phoenix' holds a low rating in comparison to other films in the X-Men franchise.",6aadb783a91f47919d6a45df270dd26d,4
dark phoenix,approval rating,"On Rotten Tomatoes, 'Dark Phoenix' has an approval rating of 22% based on 386 reviews. This suggests that a majority of the critics have not favoured the movie.",6aadb783a91f47919d6a45df270dd26d,4
dark phoenix,critical consensus,'Dark Phoenix' has a critical consensus on Rotten Tomatoes which reads: 'Dark Phoenix ends an era of the X-Men franchise by taking a second stab at adapting a classic comics arc - with deeply disappointing results.',6aadb783a91f47919d6a45df270dd26d,4
dark phoenix,audiences,The film's CinemaScore rating from audiences polled is an average grade of 'B-' on an A+ to F scale.,6aadb783a91f47919d6a45df270dd26d,4
dark phoenix,metacritic,"'Dark Phoenix' has a weighted average score of 43 out of 100 based on 52 critics on Metacritic, indicating 'mixed or average reviews.'",6aadb783a91f47919d6a45df270dd26d,4
dark phoenix,impressive send-off,"Writing for TheWrap, William Bibbiani said of the film: 'It would be wonderful to report that Dark Phoenix was an impressive send-off to this long-running franchise...' Instead it's just a disappointingly average superhero flick.",a368b2d325414d4b906f684371d8d1f9,4
dark phoenix,average superhero flick,"'...Instead it's just a disappointingly average superhero flick, with a familiar story, disinterested actors, some cool action sequences, and a whole lot of missed opportunities.'",a368b2d325414d4b906f684371d8d1f9,4
dark phoenix,lavishly brutal chore,a movie featuring more death by impalement and whirling metal than all the Saw movies put together.,a368b2d325414d4b906f684371d8d1f9,4
dark phoenix,franchise that has devolved to the point of dark phoenix,"Michael Phillips of the Chicago Tribune gave the film 1.5 out of 4 stars and said, 'It's hard to even render an opinion on the discrete strengths and weaknesses of a franchise that has devolved to the point of Dark Phoenix, a lavishly brutal chore nearly as violent as the Wolverine movie Logan.'",a368b2d325414d4b906f684371d8d1f9,4
feminist messages,dark phoenix,"The feminist messages of the film were a refreshing attempt to fix some mistakes made in the past, according to Nikolay Nikolov of Mashable.",968aeca5b86044cb9d9f555c1649c203,4
kate erbland,certain moments of dark phoenix,"Kate Erbland of Indiewire criticized certain moments of the film, particularly a moment in which Raven suggests that the name of the team be changed to the 'X-Women', for attempting to pander to female audiences.",968aeca5b86044cb9d9f555c1649c203,4
anne cohen,certain moments of dark phoenix,"Anne Cohen of Refinery29 criticized certain moments of the film, particularly a moment in which Raven suggests that the name of the team be changed to the 'X-Women', for attempting to pander to female audiences.",968aeca5b86044cb9d9f555c1649c203,4
cheeky,certain moments of dark phoenix,Kate Erbland and Anne Cohen described certain moments in which Raven suggests that the name of the team be changed to the 'X-Women' as 'cheeky'.,968aeca5b86044cb9d9f555c1649c203,4
inorganic,certain moments of dark phoenix,Kate Erbland and Anne Cohen described certain moments in which Raven suggests that the name of the team be changed to the 'X-Women' as 'inorganic'.,968aeca5b86044cb9d9f555c1649c203,4
condescending,certain moments of dark phoenix,Kate Erbland and Anne Cohen described certain moments in which Raven suggests that the name of the team be changed to the 'X-Women' as 'condescending'.,968aeca5b86044cb9d9f555c1649c203,4
similar moments,certain moments of dark phoenix,Kate Erbland compared certain moments in which Raven suggests that the name of the team be changed to the 'X-Women' to similar moments in other blockbuster films.,968aeca5b86044cb9d9f555c1649c203,4
distracted,more constructive aspects of its female-centric perspective,Kate Erbland felt that certain moments in which Raven suggests that the name of the team be changed to the 'X-Women' distracted from more constructive aspects of its female-centric perspective.,968aeca5b86044cb9d9f555c1649c203,4
diana kalogeraki,simon kinberg,"Simon Kinberg took responsibility for the film's poor reception, stating: ""I'm here, I'm saying when a movie doesn't work, put it on me. I'm the writer-director, the movie didn't connect with audiences, that's on me""",968aeca5b86044cb9d9f555c1649c203,4
dark phoenix,jean grey (phoenix),This film centers on Jean as Phoenix and the second was going to feature Dark Phoenix.,a09767f19390434b935d8f7eb9f6f756,4
audience's feelings towards jean grey (phoenix),dark phoenix,"The purpose of this film is to break their hearts, while the purpose of the second was going to feature Dark Phoenix.",a09767f19390434b935d8f7eb9f6f756,4
dark phoenix,jean grey becoming the phoenix,"According to visual effects supervisor Greg Butler, Dark Phoenix is meant to be an origin story about Jean Grey becoming the Phoenix. While the cosmic aspect of the saga would have been adapted in the second part of the two-film story.",04f71c35ed274b3fbdad3117708b7c12,4
dark phoenix,second part of the two-film story,"According to visual effects supervisor Greg Butler, Dark Phoenix is meant to be an origin story about Jean Grey becoming the Phoenix. While the cosmic aspect of the saga would have been adapted in the second part of the two-film story.",04f71c35ed274b3fbdad3117708b7c12,4
dark phoenix,challenge,"Claremont remarked, ""My problem with both iterations of Dark Phoenix onscreen, the original by Brett Ratner and the newer version by Simon Kinberg, is, I don't think you can do it effectively in 90 minutes. You can tell a good story in that timeframe, which I think Simon did, but it's not the evocation of the story that Dave and John and Paul and I created, it doesn't have the impact of knowing the characters and their dynamics and building to it conclusively in this narrative way... The challenge is, in terms of a canon like X-Men, it's more like Harry Potter and Hogwarts, or Game of Thrones. It needs time and space to evolve and to bring the reader or viewer in and give them a result that's worth the investment of that time.",04f71c35ed274b3fbdad3117708b7c12,4
dark phoenix,shi'ar alien race,"In June 2017, it was rumored that the Shi'ar alien race would be featured in the film,",04f71c35ed274b3fbdad3117708b7c12,4
kinberg,hellfire club,"In an interview, Kinberg stated that if he had four hours to tell the story, he would have included the Hellfire Club.",e4c92875133f4b54923be3b47b6c3c25,4
kinberg,lilandra neramani,"In an interview, Kinberg stated that if he had four hours to tell the story, he would have included Lilandra Neramani.",e4c92875133f4b54923be3b47b6c3c25,4
marvel studios president kevin feige,original x-men cast,Marvel Studios president Kevin Feige was reported to have approached several members of the original X-Men cast in March 2019.,e4c92875133f4b54923be3b47b6c3c25,4
patrick stewart,professor x,"In Doctor Strange in the Multiverse of Madness, Patrick Stewart did reprise his role as Professor X.",e4c92875133f4b54923be3b47b6c3c25,4
michael waldron,x-men series,"The writer of the film Michael Waldron stated that this was an alternate version of the character, but confirmed that the X-Men series was canon to the MCU multiverse.",e4c92875133f4b54923be3b47b6c3c25,4
kelsey grammer,beast,Kelsey Grammer reprised his role as Beast in the post-credit scene of The Marvels.,e4c92875133f4b54923be3b47b6c3c25,4
dark phoenix,feige,"In 2020, Feige announced at San Diego Comic-Con that an untitled mutant-centered project was in the works at Marvel Studios.",93bce052c0f04cafbeee39f3935ac858,4
dark phoenix,san diego comic-con,"In 2020, Feige announced at San Diego Comic-Con that an untitled mutant-centered project was in the works at Marvel Studios.",93bce052c0f04cafbeee39f3935ac858,4
dark phoenix,marvel studios,"In 2020, Feige announced at San Diego Comic-Con that an untitled mutant-centered project was in the works at Marvel Studios.",93bce052c0f04cafbeee39f3935ac858,4
dark phoenix,logan,"Hugh Jackman and Ryan Reynolds reprise their respective roles of Wolverine and Deadpool, with the film taking place after the events of Logan,",93bce052c0f04cafbeee39f3935ac858,4
dark phoenix,x-men,"Deadpool & Wolverine (2024) serves as a sequel to Deadpool 2 and a send-off to the Fox-produced Marvel franchise, including the X-Men film series.",93bce052c0f04cafbeee39f3935ac858,4
pyro,deadpool & wolverine (2024),Aaron Stanford and Tyler Mane also reprised their roles as Pyro and Sabretooth.,93bce052c0f04cafbeee39f3935ac858,4
sabretooth,deadpool & wolverine (2024),Aaron Stanford and Tyler Mane also reprised their roles as Pyro and Sabretooth.,93bce052c0f04cafbeee39f3935ac858,4
dopinder,deadpool & wolverine (2024),Karan Soni reprised his role as Dopinder.,93bce052c0f04cafbeee39f3935ac858,4
blind al,deadpool & wolverine (2024),Leslie Uggams reprised her role as Blind Al.,93bce052c0f04cafbeee39f3935ac858,4
vanessa carlysle,dark phoenix,Morena Baccarin reprised her role as Vanessa Carlysle.,93bce052c0f04cafbeee39f3935ac858,4
colossus,deadpool & wolverine (2024),Stefan Kapičić reprised his role as Colossus.,93bce052c0f04cafbeee39f3935ac858,4
peter wisdom,dark phoenix,Rob Delaney appeared as Peter Wisdom.,93bce052c0f04cafbeee39f3935ac858,4
negasonic teenage warhead,deadpool & wolverine (2024),Brianna Hildebrand reprised her role as Negasonic Teenage Warhead.,93bce052c0f04cafbeee39f3935ac858,4
shatterstar,deadpool & wolverine (2024),Lewis Tan appeared as Shatterstar.,93bce052c0f04cafbeee39f3935ac858,4
yukio,dark phoenix,Shioli Kutsuna reprised her role as Yukio.,93bce052c0f04cafbeee39f3935ac858,4
