Question,Answer
"[""In the 2002 movie 'Gangs of New York', did Johnny reveal his true identity and intentions to Bill out of jealousy over Jenny's affection for Amsterdam?""]",no
"[""In the 2002 film 'Gangs of New York', did Amsterdam reveal Johnny's true identity and intentions to Bill due to jealousy over Jenny's affection for Amsterdam?""]",yes
"[""In the 2002 movie 'Gangs of New York', did Amsterdam collaborate with Mulraney to solve a case together?""]",no
"[""In the film 'Gangs of New York' released in 2002, did Amsterdam kill Mulraney?""]",yes
"[""In the 2002 movie 'Gangs of New York', does Bill lose a fight to McGloin, one of his lieutenants?""]",no
"[""In 'Gangs of New York', released in 2002, does Bill, a character in the movie, beat McGloin, a former Dead Rabbit and one of his lieutenants?""]",yes
"[""In the 2002 film 'Gangs of New York', did Bill perceive Monk McGinn's run for sheriff as a benefit to his influence?""]",no
"[""In the movie 'Gangs of New York' released in 2002, did Bill murder Monk McGinn with his own club?""]",yes
"[""In the 2002 movie 'Gangs of New York', did Bill and the Natives ignore the beating of McGloin, one of Bill's lieutenants, by Amsterdam's gang?""]",no
"[""In the 2002 film 'Gangs of New York', did Bill promise to return after Amsterdam and the Dead Rabbits met them peacefully at the church?""]",yes
"""In the 2002 film 'Gangs of New York', did the character Amsterdam challenge Bill to a gang battle in Paradise Square after an incident at a church?""",yes
"""In the 2002 movie 'Gangs of New York', did the gang battle between Amsterdam and Bill take place without any interruptions?""",no
"[""In the 2002 movie 'Gangs of New York', did Amsterdam use a gun to kill Bill during the gang fight in Paradise Square?""]",no
"[""In the 2002 movie 'Gangs of New York', was Bill wounded by shrapnel during the gang fight in Paradise Square?""]",yes
"""In the 2002 movie 'Gangs of New York', does Amsterdam bury his father's knife next to Bill's tombstone?""",no
"""In 'Gangs of New York' released in 2002, does Amsterdam erect a makeshift headstone with the name William Cutting next to the tombstone of Priest Vallon?""",yes
"""In the 2002 movie 'Gangs of New York', does the skyline change from traditional Amsterdam to modern Tokyo over the next century?""",no
"""Does the transformation of the skyline in the 2002 movie 'Gangs of New York' include notable landmarks such as the Brooklyn Bridge, Empire State Building, and World Trade Center?""",yes
"""In the 2002 movie 'Gangs of New York', is the Brooklyn Bridge absent from the modern New York City skyline?""",no
"""Does the Brooklyn Bridge feature as a significant landmark in the skyline of New York City in the 2002 film 'Gangs of New York'?""",yes
"""In the 2002 movie 'Gangs of New York', is the Empire State Building a prominent feature of the skyline in modern New York City?""",yes
"""Does the Empire State Building not feature at all in the skyline of New York City in the 2002 movie 'Gangs of New York'?""",no
"""Is the World Trade Center not included in the skyline of modern New York City in the 2002 movie 'Gangs of New York'?""",no
"""Does the World Trade Center join the skyline of modern New York City, adding to its impressive and distinctive urban landscape in the 2002 movie 'Gangs of New York'?""",yes
"[""Is the cemetery in the 2002 movie 'Gangs of New York' depicted as a prominent and well-maintained area in modern New York City?""]",no
"[""In the movie 'Gangs of New York' released in 2002, does the cemetery become overgrown and forgotten in modern New York City as Amsterdam and Jenny leave?""]",yes
