Question,Answer
"[""Is it true that Alan Silvestri did not score the music for 'Captain America: The First Avenger', a movie related to 'The Avengers' released in 2012?""]",no
"[""Did Alan Silvestri, who scored 'Captain America: The First Avenger', also have a connection to 'The Avengers' released in 2012?""]",yes
"""Did Joss Whedon criticize Alan Silvestri's approach to scoring movies in 'The Avengers' released in 2012?""",no
"""In the 2012 movie 'The Avengers', did Joss Whedon praise Alan Silvestri's ability to balance giving each character their due weight?""",yes
"[""Was the soundtrack concept album for 'The Avengers' released by a company other than Hollywood Records in 2012?""]",no
"[""Did Hollywood Records release the soundtrack concept album titled 'Avengers Assemble' in 2012, inspired by the film 'The Avengers'?""]",yes
