node_1,node_2,edge,chunk_id,count
sondra currie,linda,Sondra Currie portrays Linda in the movie.,8ec9135550574b7bae027516789e1654,4
tracy,alan's mother,"In the context, Tracy has a mother who is also mentioned as Alan's mother, implying they might be related to each other.",8ec9135550574b7bae027516789e1654,4
gillian vigman,stephanie,Gillian Vigman portrays Stephanie in the movie.,8ec9135550574b7bae027516789e1654,4
nathalie fay,lisa todd phillips,"Nathalie Fay appears briefly in the movie as Mr. Creepy, who is directed by Lisa Todd Phillips.",8ec9135550574b7bae027516789e1654,4
mike vallely,neeco,"Mike Vallely's character in the movie is Neeco, a high-speed tuxedo delivery man.",8ec9135550574b7bae027516789e1654,4
