Question,Answer
"Does the summary of the movie ""Good Boy Bad Boy"" from 2007 provide details about its characters and events?",NO
"Is the summary of the movie ""Good Boy Bad Boy"" from 2007 essential for understanding its plot?",YES
"Is ""Good Boy Bad Boy"" from the year 2007 a horror film?",NO
"Is ""Good Boy Bad Boy"" from the year 2007 an Indian Hindi-language coming-of-age drama film?",YES
"Is ashwini chaudhary the director of the movie ""Good Boy Bad Boy"" released in 2007?",NO
"Is ashwini chaudhary a professional in the film industry who oversees the creative and artistic aspects of film production in ""Good Boy Bad Boy"" released in 2007?",YES
"Is Emraan Hashmi not an actor in the movie ""Good Boy Bad Boy"" released in 2007?",NO
"Is Emraan Hashmi an actor in the movie ""Good Boy Bad Boy"" released in 2007?",YES
"Is Tusshar Kapoor a director in the movie ""Good Boy Bad Boy"" released in 2007?",NO
"Is Tusshar Kapoor an actor in the movie ""Good Boy Bad Boy"" released in 2007?",YES
"Is Tanushree Dutta a male performer in the movie ""Good Boy Bad Boy"" released in 2007?",NO
"Is Tanushree Dutta an actress in the movie ""Good Boy Bad Boy"" released in 2007?",YES
"Is Isha Sharvani not an actor in the movie ""Good Boy Bad Boy"" released in 2007?",NO
"Is Isha Sharvani an actor in the movie ""Good Boy Bad Boy"" released in 2007?",YES
"Is Paresh Rawal not an actor in the movie ""Good Boy Bad Boy"" released in 2007?",NO
"Is Paresh Rawal an actor in the movie ""Good Boy Bad Boy"" released in 2007?",YES
"Is Mukta Arts Ltd the director of the movie ""Good Boy Bad Boy"" released in 2007?",NO
"Is Mukta Arts Ltd the producer of the movie ""Good Boy Bad Boy"" released in 2007?",YES
"Is Raju Farooqui the producer of the movie ""Good Boy Bad Boy"" released in 2007?",NO
"Is the producer an individual or company that oversees the financial and business aspects of the production in ""Good Boy Bad Boy"" released in 2007?",YES
"Is ""Good Boy Bad Boy"" a 1992 film?",NO
"Is ""Good Boy Bad Boy"" a type of media that tells a story through visual and auditory elements released in 2007?",YES
"Are kid 'n play not actors in the movie ""Good Boy Bad Boy"" released in 2007?",NO
"Do kid 'n play perform acting in the movie ""Good Boy Bad Boy"" released in 2007?",YES
"Is ""Good Boy Bad Boy"" an aashiq banaya aapne movie in 2007?",NO
"Does ""Good Boy Bad Boy"" released in 2007 tell a story through visual and auditory elements?",YES
"Is chocolate a type of media in the movie ""Good Boy Bad Boy"" released in 2007?",NO
"Is ""Good Boy Bad Boy"" a movie that tells a story through visual and auditory elements and was released in 2007?",YES
"Is Raju Malhotra a teacher in the movie ""Good Boy Bad Boy"" released in 2007?",NO
"Is Raju Malhotra a student in the movie ""Good Boy Bad Boy"" released in 2007?",YES
"Is Tanushree Dutta a student in the movie ""Good Boy Bad Boy"" released in 2007?",NO
"Does Tanushree Dutta play a significant role in the movie ""Good Boy Bad Boy"" released in 2007?",YES
"Is Emaan Hashmi a teacher in the movie ""Good Boy Bad Boy"" released in 2007?",NO
"Is Emaan Hashmi a student in the movie ""Good Boy Bad Boy"" released in 2007?",YES
"Is Isha Sharvani a teacher in the movie ""Good Boy Bad Boy"" released in 2007?",NO
"Is Isha Sharvani a student in the movie ""Good Boy Bad Boy"" released in 2007?",YES
"Is Rajan Malhotra a teacher in the movie ""Good Boy Bad Boy"" released in 2007?",NO
"Is Rajan Malhotra a student in the movie ""Good Boy Bad Boy"" released in 2007?",YES
"Is the section for poorly performing students a division within an educational institution based on academic performance in the movie ""Good Boy Bad Boy"" released in 2007?",NO
"Does the movie ""Good Boy Bad Boy"" released in 2007 feature a section that is a division within an educational institution based on academic performance?",YES
"Is the c section in the movie ""Good Boy Bad Boy"" in 2007 related to a section for students with excellent academic performance?",NO
"Does the c section in the movie ""Good Boy Bad Boy"" in 2007 represent a division within an educational institution based on academic performance?",YES
"Is the principal in the movie ""Good Boy Bad Boy"" from the year 2007 a character who is not involved in overseeing the management of the educational institution?",NO
"Does the character Awasthi in the movie ""Good Boy Bad Boy"" from the year 2007 have a direct relationship with the principal as someone who is managed by them?",YES
"Is the ill-reputed college in the movie ""Good Boy Bad Boy"" from 2007 known for its positive reputation?",NO
"Does the ill-reputed college in ""Good Boy Bad Boy"" from 2007 provide academic instruction and training?",YES
"Is the flocked one a highly popular and sought-after college in the movie ""Good Boy Bad Boy"" released in 2007?",NO
"Is the highly popular and sought-after college an educational institution that provides academic instruction and training in the movie ""Good Boy Bad Boy"" released in 2007?",YES
"In the movie ""Good Boy Bad Boy"" released in 2007, are Raju and Rajan being asked questions by specified individuals?",NO
"In the movie ""Good Boy Bad Boy"" released in 2007, are Raju and Rajan the characters being asked questions?",YES
"Will the characters Raju and Rajan choose to accept the challenge in the movie ""Good Boy Bad Boy"" released in 2007?",NO
"Is it unclear whether Raju and Rajan will accept the challenge in ""Good Boy Bad Boy"" released in 2007?",YES
"In the movie ""Good Boy Bad Boy"" released in 2007, do Raju and Rajan address the questions asked of them before deciding to scoot off?",NO
"In the movie ""Good Boy Bad Boy"" released in 2007, do Raju and Rajan choose to leave without addressing the questions?",YES
"Is all music in the movie ""Good Boy Bad Boy"" from 2007 composed by someone other than Himesh Reshammiya?",NO
"Is all music in the movie ""Good Boy Bad Boy"" from 2007 composed by Himesh Reshammiya?",YES
"Did a music label other than Tips Industries release the music for the movie ""Good Boy Bad Boy"" in 2007?",NO
"Did Tips Industries release the music for the movie ""Good Boy Bad Boy"" in 2007?",YES
