node_1,node_2,edge
division x,cia officer,Relationship between the sponsoring CIA officer and Division X.
lehnsherr,xavier,"Lehnsherr persuades Xavier to refuse the cure, leading to Xavier's paralysis and departure of Lehnsherr with other mutants."
mccoy,himself,"McCoy uses the cure on himself, but it backfires, giving him blue fur and leonine aspects."
xavier,soviet sailor,Xavier uses his telepathy to influence the Soviet sailor to destroy the ship carrying the missiles.
lehnsherr,shaw,"Lehnsherr shares Shaw's exclusivist view of mutants, but desires to avenge his mother and kills Shaw by pushing the Nazi coin through his brain."
mactaggert,lehnsherr,"MacTaggert tries to stop Lehnsherr, but he deflects her bullets, one of which hits Xavier in the spine when he intervenes between them."
xavier,shaw,Xavier experiences Shaw's death when he tries to stop Lehnsherr from killing Shaw.
