node_1,node_2,edge,chunk_id,count
riteish deshmukh,jaswinder,Riteish Deshmukh portrays the character of Jaswinder in the movie.,d565b617ae5f46c786f0bb7956887ac1,4
riteish deshmukh,jimmy,The character of Jimmy is played by Riteish Deshmukh in the movie.,d565b617ae5f46c786f0bb7956887ac1,4
hrishitaa bhatt,richa bedi,"Hrishitaa Bhatt and Richa Bedi are portrayed by the same actress, Hrishitaa Bhatt, in the movie.",d565b617ae5f46c786f0bb7956887ac1,4
brande roderick,sally,The character of Sally is played by Brande Roderick in the movie.,d565b617ae5f46c786f0bb7956887ac1,4
anand raj anand,anand raj anand,"The character of Anand Raj Anand is portrayed by the actor, Anand Raj Anand, in the movie.",d565b617ae5f46c786f0bb7956887ac1,4
amrish puri,jatta singh bedi,The character of Jatta Singh Bedi is portrayed by Amrish Puri in the movie.,d565b617ae5f46c786f0bb7956887ac1,4
satish shah,flower,The character of Flower is played by Satish Shah in the movie.,d565b617ae5f46c786f0bb7956887ac1,4
satish kaushik,mango singh,The character of Mango Singh is portrayed by Satish Kaushik in the movie.,d565b617ae5f46c786f0bb7956887ac1,4
kenneth mergen,philip j. roberts,The character of Philip J. Roberts is played by Kenneth Mergen in the movie.,d565b617ae5f46c786f0bb7956887ac1,4
