node_1,node_2,edge,chunk_id,count
black holes,stars,"In the context provided, black holes are related to stars as they can be depicted through practical methods along with other celestial bodies such as stars.",f614fcea4ba345fb8d7e86b9409992b4,4
supernovas,stars,The context mentions the depiction of supernovas through practical methods along with stars. This suggests a relationship between supernovas and stars in the context of practical methods.,f614fcea4ba345fb8d7e86b9409992b4,4
europe,oppenheimer's life,"Nolan and van Hoytema traveled to Europe to obtain establishing shots for the early European phase of Oppenheimer's life. While they did not bother with shooting on the actual campus of the University of Cambridge, they set up a camera across the river instead.",430064cb05414bceb8b9a3654e8ca51a,4
cambridge,oppenheimer's life,Nolan and van Hoytema did not shoot on the actual campus of the University of Cambridge while obtaining establishing shots for the early European phase of Oppenheimer's life.,430064cb05414bceb8b9a3654e8ca51a,4
trinity scene,explosion,"Digital compositing was used to add multi-layers to the explosion in the Trinity scene, which was shot in a multifaceted viewpoint.",430064cb05414bceb8b9a3654e8ca51a,4
set,visual effects,"Andrew Jackson, the visual effects supervisor, stated that the film used mostly 'invisible' visual effects through 'in-camera' special effects created on set.",430064cb05414bceb8b9a3654e8ca51a,4
dneg,visual effects,"DNEG produced more than 100 VFX shots from more than 400 practically shot elements for the film, marking their eighth collaboration with Nolan.",430064cb05414bceb8b9a3654e8ca51a,4
steven spielberg,nolan,Spielberg watched the final cut of the film and Nolan received kind words from him.,c423dbea58a34f60a8c2b158d0bc3672,4
oppenheimer (as a central character),göransson's solo violin theme,"The violin theme is associated with Oppenheimer and can evoke different emotions, from romantic to horror sounds.",c423dbea58a34f60a8c2b158d0bc3672,4
oppenheimer (as a central character),"july 16, 2023","The countdown in the teaser trailer leads up to the anniversary of the first detonation of an atomic weapon on July 16, 2023.",c423dbea58a34f60a8c2b158d0bc3672,4
oppenheimer (as a central character),nolan's style,The teaser trailer showcases Nolan's unique style in terms of weighty and brooding content.,c423dbea58a34f60a8c2b158d0bc3672,4
oppenheimer,le grand rex,"In December 2023, the world premiere of Oppenheimer took place at Le Grand Rex in Paris.",ad0295b7d220496490b38602c86cb4aa,4
oppenheimer,odeon luxe leicester square,"In July 2023, the British premiere of Oppenheimer was held at Odeon Luxe Leicester Square in London.",ad0295b7d220496490b38602c86cb4aa,4
oppenheimer,amc lincoln square 13,"In July 2023, the American premiere of Oppenheimer was held at AMC Lincoln Square 13 in New York City.",ad0295b7d220496490b38602c86cb4aa,4
le grand rex,paris,Le Grand Rex is a venue located in Paris where the world premiere of Oppenheimer took place in December 2023.,ad0295b7d220496490b38602c86cb4aa,4
odeon luxe leicester square,london,Odeon Luxe Leicester Square is a venue located in London where the British premiere of Oppenheimer was held in July 2023.,ad0295b7d220496490b38602c86cb4aa,4
amc lincoln square 13,new york city,AMC Lincoln Square 13 is a venue located in New York City where the American premiere of Oppenheimer was held in July 2023.,ad0295b7d220496490b38602c86cb4aa,4
oppenheimer,barbie,"Due to the tonal and genre dissonance between the two films, many social media users created memes about how the two films appealed to different audiences, and how they should be viewed as a double feature. This trend was dubbed 'Barbenheimer', and was described as counterprogramming during a summer of 'entertainment industry meltdown'. Cillian Murphy had endorsed the phenomenon, saying 'My advice would be for people to go see both, on the same day. If they are good films, then that's cinema's gain.'",a4cfdc415ea44b29ac4846896d30eddf,4
barbie,russia,"Barbie had also been banned by Russia's Ministry of Culture, which had refused to license screenings of the film, stating that it did not meet their goals of 'preserving and strengthening traditional Russian spiritual values'. This ban was a result of Universal Pictures halting the release of its titles in Russia, joining other major American film distributors in the boycott against the country following its invasion of Ukraine in February 2022.",a4cfdc415ea44b29ac4846896d30eddf,4
the film,japan until eight months after its initial global release,Released in Japan with a delay of eight months after its initial global release,2ce0d7841919455a9433ec21ad5199bf,4
the film,plans have not been finalized in all markets,Universal spokesperson stated that plans have not been finalized in all markets for the film's release,2ce0d7841919455a9433ec21ad5199bf,4
american films,japan a few months after the initial theatrical release,Typically released in Japan with a delay of a few months after the initial theatrical release for American films,2ce0d7841919455a9433ec21ad5199bf,4
bitters end,the film,Independent Japanese film distributor Bitters End announced to theatrically release the film in 2024 as Universal's distributor in Japan opted not to release it,2ce0d7841919455a9433ec21ad5199bf,4
the film,highest grossing foreign film in japan,"During its first three days, the film was ranked as the highest grossing foreign film in Japan after making 379.3 million yen ($2.5 million) at the box office",2ce0d7841919455a9433ec21ad5199bf,4
variety,controversial reputation in japan due to the atomic bombings of hiroshima and nagasaki,Noted the controversial reputation in Japan due to the atomic bombings of Hiroshima and Nagasaki,2ce0d7841919455a9433ec21ad5199bf,4
r-rating,insomnia (2002),Nolan's first film to receive that rating since Insomnia (2002).,551de48d79794276b1612a95a6b17d7e,4
motion picture association,film,"The film received an R-rating from the Motion Picture Association for ""some sexuality, nudity, and language"". ",551de48d79794276b1612a95a6b17d7e,4
australian classification board,film,"In Australia, the film received an MA 15+ rating from the Australian Classification Board board for ""strong sex and a suicide scene"". ",551de48d79794276b1612a95a6b17d7e,4
british board of film classification,film,"In the United Kingdom, the film received a 15 certificate from the British Board of Film Classification for ""strong language and sex"", meaning anyone under the age of 15 cannot be admitted to view the film.",551de48d79794276b1612a95a6b17d7e,4
nude body,florence pugh,"In some countries, including those in the Middle East, South Asia and Southeast Asia, Universal distributed a version of the film with Florence Pugh's nude body covered by a computer-generated black dress.",551de48d79794276b1612a95a6b17d7e,4
oppenheimer,physical media libraries,"Nolan's advocacy for physical media libraries is mentioned in the context when he expresses his concern about letting films only exist digitally or on streaming services, as it allows companies to have too much control and creates a danger for film preservation during the home release campaign of 'Oppenheimer'. This highlights the significance of physical media libraries in preserving films over time.",2c41b07d3cf743c2a33ba4a0e70003f5,4
oppenheimer,$329.9 million,"In the context, it is mentioned that 'Oppenheimer' grossed $329.9 million in the United States and Canada. This indicates a strong financial performance of the movie.",2c41b07d3cf743c2a33ba4a0e70003f5,4
oppenheimer,$647.1 million,"The context reveals that 'Oppenheimer' grossed $647.1 million in other territories, which emphasizes the movie's worldwide success.",2c41b07d3cf743c2a33ba4a0e70003f5,4
oppenheimer,$977 million,"The context mentions that 'Oppenheimer' has grossed a total of $977 million globally, highlighting its commercial success.",2c41b07d3cf743c2a33ba4a0e70003f5,4
oppenheimer,imax,"The context informs that 'Oppenheimer' grossed $190 million from IMAX alone, indicating the movie's popularity in this format.",2c41b07d3cf743c2a33ba4a0e70003f5,4
oppenheimer,peacock,"The context reveals that 'Oppenheimer' was exclusively streamed on Peacock in the US, highlighting its availability on this platform.",2c41b07d3cf743c2a33ba4a0e70003f5,4
oppenheimer,amazon prime video,"The context mentions that 'Oppenheimer' was streamed on Amazon Prime Video in Canada, underlining its availability on this platform in a particular territory.",2c41b07d3cf743c2a33ba4a0e70003f5,4
oppenheimer,jio cinema,"The context discloses that 'Oppenheimer' started streaming on Jio Cinema in India, indicating its availability on this platform in another territory.",2c41b07d3cf743c2a33ba4a0e70003f5,4
oppenheimer,"november 21, 2023","The context mentions the release date of 'Oppenheimer' for various formats like Ultra HD Blu-ray, regular Blu-ray and DVD, as well as digital streaming on November 21, 2023.",2c41b07d3cf743c2a33ba4a0e70003f5,4
oppenheimer,highest-grossing film ever to not reach the top spot at the domestic box office,"By August 2023, Oppenheimer had become the highest-grossing film ever to not reach the top spot at the domestic box office",36ec3827e91f4147a3747e910ac5e358,4
oppenheimer,highest grossing world war ii-related film,"Surpassed Dunkirk (2017), also a Nolan film, in becoming one of the top five highest-grossing IMAX releases, earning $183 million on approximately 20% of its total gross",36ec3827e91f4147a3747e910ac5e358,4
oppenheimer,november 3 rerelease,"Booked to be rereleased in IMAX theaters on November 3, including six IMAX 70 mm prints, as these theaters reported selling out during the initial release",36ec3827e91f4147a3747e910ac5e358,4
oppenheimer,net profit of $201.9 million,"Deadline Hollywood calculated the net profit of the film to be $201.9 million, when factoring together all expenses and revenues",36ec3827e91f4147a3747e910ac5e358,4
oppenheimer,barbenheimer,"In the United States and Canada, Oppenheimer was released alongside Barbie, in what became known as 'Barbenheimer'. The week of their releases, AMC Theatres announced that over 40,000 AMC Stubs members had already pre-booked tickets to both films on the same day. After grossing $33 million on its first day (including $10.5 million from Thursday night previews), it went on to debut to $82.5 million, finishing second behind Barbie and marking one of the best opening weekends ever for an R-rated drama.",56a8fd7eda1f4485b3379c2d5aeb3eee,4
oppenheimer,barbee,"The release of Oppenheimer alongside Barbie, in what became known as 'Barbenheimer', boosted interest in the film. A total of 79% of tickets sold over the weekend were for the two films (27% for Oppenheimer), a combined total of 18.5 million people.",56a8fd7eda1f4485b3379c2d5aeb3eee,4
oppenheimer,biopic film,"Oppenheimer achieved the third-highest opening weekend for a biopic film, behind The Passion of the Christ (2004) and American Sniper (2014).",56a8fd7eda1f4485b3379c2d5aeb3eee,4
barbenheimer,oppenheimer,"In the United States and Canada, Oppenheimer was released alongside Barbie, in what became known as 'Barbenheimer'.",56a8fd7eda1f4485b3379c2d5aeb3eee,4
oppenheimer,barbie,"In the second weekend, Oppenheimer earned $46.2 million and came in second behind Barbie.",d09c4a515d8648e38fa7067a4bb39447,4
oppenheimer,meg 2: the trench,"In the third weekend, Oppenheimer made $28.7 million and finished third behind Barbie and Meg 2: The Trench.",d09c4a515d8648e38fa7067a4bb39447,4
oppenheimer,sing (2016),"After four weekends, Oppenheimer surpassed Sing (2016) to become the highest-grossing film to never reach the number one spot at the box office.",d09c4a515d8648e38fa7067a4bb39447,4
oppenheimer,number one spot at the box office,"After four weekends, Oppenheimer surpassed Sing (2016) to become the highest-grossing film to never reach this spot.",d09c4a515d8648e38fa7067a4bb39447,4
oppenheimer,$300 million domestically,"In its sixth weekend, Oppenheimer passed $300 million domestically.",d09c4a515d8648e38fa7067a4bb39447,4
japan,oppenheimer,"In March 2024, Oppenheimer was released in Japan.",d09c4a515d8648e38fa7067a4bb39447,4
warner brothers,apology,"Following controversy over the Barbenheimer phenomenon, Warner Brothers issued an apology.",d09c4a515d8648e38fa7067a4bb39447,4
film,content warnings,Theaters displayed content warnings for the film.,f1cf6039a31149fe97a19bcc64e6f4f0,4
film,japanese public,Some Japanese people reported feeling discomfort and distress while watching the film.,f1cf6039a31149fe97a19bcc64e6f4f0,4
nuclear bombing of japan,film,A point of contention was on the choice to not visually depict the nuclear bombing of Japan.,f1cf6039a31149fe97a19bcc64e6f4f0,4
choice,nuclear bombing of japan,The choice was made regarding whether or not to visually depict the nuclear bombing of Japan.,f1cf6039a31149fe97a19bcc64e6f4f0,4
japanese people,choice,A number of Japanese people praised and others felt that it resulted in the downplaying or glorification of the bombing.,f1cf6039a31149fe97a19bcc64e6f4f0,4
takashi hiraoka,horror of nuclear weapons,"Takashi Hiraoka, former mayor of Hiroshima, reportedly felt that the horror of nuclear weapons had not been sufficiently portrayed in the film.",f1cf6039a31149fe97a19bcc64e6f4f0,4
oppenheimer,film,"A number of people reported feeling that Oppenheimer was glorified in the film for his role in developing the bomb,",f1cf6039a31149fe97a19bcc64e6f4f0,4
oppenheimer,distress,and a number of people felt that he was also a victim of his circumstances and experienced distress from it.,f1cf6039a31149fe97a19bcc64e6f4f0,4
masao tomonaga,film,"Masao Tomonaga, who experienced one of the nuclear bombings, felt that the film was 'anti-nuclear' and expressed disappointment in the lack of a scene for the atomic bombing in Japan,",f1cf6039a31149fe97a19bcc64e6f4f0,4
masao tomonaga,satisfaction,but was reportedly satisfied with the portrayal of Oppenheimer's distress after the bombings.,f1cf6039a31149fe97a19bcc64e6f4f0,4
japanese public,film,"Another advocated for fewer people to see the film,",f1cf6039a31149fe97a19bcc64e6f4f0,4
japanese public,advocacy,and another advocated for more people to see the film.,f1cf6039a31149fe97a19bcc64e6f4f0,4
oppenheimer,japan,"According to USC School of Cinematic Arts' Vice Dean of Faculty Akira Mizuta Lippit, Oppenheimer has enjoyed box office success in Japan, as noted in an article for Deadline Hollywood in May 2024. This success is contrasted with the reception of other films about Japan, some of which were deemed offensive or ignorant by Japanese audiences.",b5b22f51009f43d1b822604e66779c2d,4
oppenheimer,india,"In its opening weekend outside the United States and Canada, Oppenheimer grossed $98 million, making it Nolan's highest-grossing film in 30 countries, including India.",b5b22f51009f43d1b822604e66779c2d,4
oppenheimer,saudi arabia,"In its opening weekend outside the United States and Canada, Oppenheimer grossed $98 million in its opening weekend, becoming Nolan's highest-grossing film in 30 countries, including Saudi Arabia.",b5b22f51009f43d1b822604e66779c2d,4
oppenheimer,turkey,"In its opening weekend outside the United States and Canada, Oppenheimer grossed $98 million, becoming Nolan's highest-grossing film in 30 countries, including Turkey.",b5b22f51009f43d1b822604e66779c2d,4
oppenheimer,united arab emirates,"In its opening weekend outside the United States and Canada, Oppenheimer grossed $98 million, becoming Nolan's highest-grossing film in 30 countries, including the United Arab Emirates.",b5b22f51009f43d1b822604e66779c2d,4
oppenheimer,uk,"As of September 10, 2023, Oppenheimer's highest-grossing territory is the UK, where it has earned $75 million.",b5b22f51009f43d1b822604e66779c2d,4
oppenheimer,china,"As of September 10, 2023, Oppenheimer's second-highest-grossing territory is China, where it has earned $61.6 million.",b5b22f51009f43d1b822604e66779c2d,4
oppenheimer,germany,"As of September 10, 2023, Oppenheimer's third-highest-grossing territory is Germany, where it has earned $51.9 million.",b5b22f51009f43d1b822604e66779c2d,4
oppenheimer,france,"As of September 10, 2023, Oppenheimer's fourth-highest-grossing territory is France, where it has earned $43.1 million.",b5b22f51009f43d1b822604e66779c2d,4
oppenheimer,australia,"As of September 10, 2023, Oppenheimer's fifth-highest-grossing territory is Australia, where it has earned $25.9 million.",b5b22f51009f43d1b822604e66779c2d,4
critical acclaim,the film received,the film received critical acclaim.,9147d23b93df42078562445c408422bb,4
critics praised,"oppenheimer primarily for its screenplay, cast performances, and visuals.","critics praised oppenheimer primarily for its screenplay, cast performances, and visuals.",9147d23b93df42078562445c408422bb,4
oppenheimer,the film,oppenheimer marks another engrossing achievement from christopher nolan that benefits from murphy's tour-de-force performance and stunning visuals.,9147d23b93df42078562445c408422bb,4
murphy's tour-de-force performance,oppenheimer,ben kingsley's tour-de-force performance in oppenheimer.,9147d23b93df42078562445c408422bb,4
critics praised,some criticism was aimed towards the writing of the female characters.,"while some critics praised the film, others criticized the writing for its portrayal of women.",9147d23b93df42078562445c408422bb,4
oppenheimer marks another engrossing achievement from christopher nolan that benefits from murphy's tour-de-force performance and stunning visuals.,the film received critical acclaim.,"oppenheimer, which received critical acclaim, is another engrossing achievement from christopher nolan due to ben kingsley's outstanding performance and breathtaking visuals.",9147d23b93df42078562445c408422bb,4
93%,rotten tomatoes,"the film received critical acclaim, with 93% of critics on rotten tomatoes giving positive reviews.",9147d23b93df42078562445c408422bb,4
90,metacritic,"the film received a score of 90 from metacritic based on 69 critics' reviews, indicating 'universal acclaim'.",9147d23b93df42078562445c408422bb,4
average grade of 'a',cinemascore,audiences who saw the film gave it an average score of 'a' on cinemascore.,9147d23b93df42078562445c408422bb,4
93%,posttrak,"according to posttrak, 93% of viewers responded positively to the film.",9147d23b93df42078562445c408422bb,4
oppenheimer,magnificent,"Richard Roeper of the Chicago Sun-Times called Oppenheimer 'magnificent' in his review, further praising it as 'one of the best films of the 21st century'.",fc86971dd68b44e49a3c61c20adfeb7d,4
oppenheimer,masterpiece,"The A.V. Club's Matthew Jackson referred to Oppenheimer as a 'masterpiece', highlighting it as 'Christopher Nolan's best film so far, a step up to a new level for one of our finest filmmakers and a movie that burns itself into your brain'.",fc86971dd68b44e49a3c61c20adfeb7d,4
oppenheimer,character study,"Empire's Dan Jolin characterized Oppenheimer as a 'masterfully constructed character study', drawing attention to the film's impressive portrayal of its lead character.",fc86971dd68b44e49a3c61c20adfeb7d,4
murphy,oppenheimer,"In his review, Peter Suderman from Reason noted that Oppenheimer is a 'warning' and went on to praise Gary Oldman's portrayal of J. Robert Oppenheimer, referring to him as 'both great and terrible.'",fc86971dd68b44e49a3c61c20adfeb7d,4
oppenheimer,nuclear conflict,"According to Peter Suderman's analysis, Oppenheimer evokes a sense of 'fear and foreboding about the horror of full-on nuclear conflict in the wake of the nuclear bomb.'",fc86971dd68b44e49a3c61c20adfeb7d,4
van hoytema,oppenheimer,"In his assessment, Empire's Dan Jolin credited James Franklin van Hoytema with IMAX cinematography that is 'terrifically impressive'",fc86971dd68b44e49a3c61c20adfeb7d,4
oppenheimer,nolan's storytelling,Seitz praised Nolan's skillful narration of Oppenheimer's story.,c1a00ce97c99482f8ed083ab094c6941,4
oppenheimer,exploration of oppenheimer's character,Seitz commended Nolan for his portrayal of Oppenheimer's personality in the film.,c1a00ce97c99482f8ed083ab094c6941,4
oppenheimer,technical achievements,Seitz applauded the movie's technical accomplishments related to Oppenheimer.,c1a00ce97c99482f8ed083ab094c6941,4
oppenheimer,physical experience,"According to Seitz, the film provides an extraordinary physical experience, which is both fascinating and hard to define.",c1a00ce97c99482f8ed083ab094c6941,4
nolan's storytelling,exploration of oppenheimer's character,Seitz linked Nolan's narration and his portrayal of Oppenheimer's personality in the film.,c1a00ce97c99482f8ed083ab094c6941,4
nolan's storytelling,technical achievements,Seitz also connected Nolan's narration and the movie's technical accomplishments related to Oppenheimer.,c1a00ce97c99482f8ed083ab094c6941,4
oppenheimer,monumental achievement,Travers described Oppenheimer as a monumental achievement related to the movie itself.,c1a00ce97c99482f8ed083ab094c6941,4
oppenheimer,boldly imaginative,James related Oppenheimer's imagination and boldness in the film.,c1a00ce97c99482f8ed083ab094c6941,4
oppenheimer,commercially-enticing action,James also linked the commercially appealing action sequences of the movie with Oppenheimer.,c1a00ce97c99482f8ed083ab094c6941,4
memento,inception,James compared the cerebral underpinnings of Memento and Inception to Oppenheimer's characteristics.,c1a00ce97c99482f8ed083ab094c6941,4
the dark knight trilogy,cerebral underpinnings,James also linked the cerebral underpinnings of The Dark Knight trilogy with Oppenheimer's.,c1a00ce97c99482f8ed083ab094c6941,4
history channel movie,fancy editing,Description provided by Richard Broody of The New Yorker when comparing the film's style to a History Channel documentary with visually stunning editing,6493c4da0bc24d35ba1d2df65fbc9667,4
representational completists,profound absence,Explanation provided by Justin Chang of the Los Angeles Times regarding how the film portrays the true victims of the work depicted in the film,6493c4da0bc24d35ba1d2df65fbc9667,4
brian lowry,somewhat works to the movie's detriment,Description provided by CNN's Brian Lowry when discussing how Nolan juggles a lot of elements in the film,6493c4da0bc24d35ba1d2df65fbc9667,4
brett mason,crucial role that british science and australian physicist mark oliphant played,Explanation provided by Brett Mason regarding how non-Americans contributed to the quest depicted in the film,6493c4da0bc24d35ba1d2df65fbc9667,4
oppenheimer,best film list,"For IndieWire's annual critics poll, in which 158 critics and journalists from around the world voted, Oppenheimer was placed second in their Best Film list, with 69 overall mentions and 17 first-place votes.",9b14958f3a8e4d3a83851843622ec9b6,4
oppenheimer,nolan,"Chris Nolan deemed the film 'a real accomplishment' and implied that it is the movie he has been building toward. The film also appeared in over 410 critics' lists of the best films released in 2023, and was ranked first in 99 of them.",9b14958f3a8e4d3a83851843622ec9b6,4
oppenheimer,best performance list,Emily Blunt's performance in the film placed on the fourth position in the Best Performance list.,9b14958f3a8e4d3a83851843622ec9b6,4
oppenheimer,japanese people,"Some critics, including Spike Lee and Japanese director Takashi Yamazaki, felt that the film should have shown what happened to the Japanese people because of its length.",9b14958f3a8e4d3a83851843622ec9b6,4
oppenheimer,best director list,Christopher Nolan was ranked second on the Best Director list.,9b14958f3a8e4d3a83851843622ec9b6,4
oppenheimer,best cinematography list,Hoyte van Hoytema's work in the film topped the Best Cinematography list.,9b14958f3a8e4d3a83851843622ec9b6,4
oppenheimer,classic,Oliver Stone called Oppenheimer 'a classic'.,9b14958f3a8e4d3a83851843622ec9b6,4
oppenheimer,masterpiece,Denis Villeneuve called it 'a masterpiece'.,9b14958f3a8e4d3a83851843622ec9b6,4
trinity site,radiation exposure compensation act,The renewed attention to the Trinity site and associated nuclear testing encouraged the United States Congress to revise the Radiation Exposure Compensation Act.,024bf09cd14548ba8830d6fda87edb5b,4
navajo nation,downwinders,"People affected by radiation and nuclear testing during the Cold War, primarily consisting of the Navajo Nation, are commonly referred to as 'Downwinders'.",024bf09cd14548ba8830d6fda87edb5b,4
trinity site,nuclear testing,The Trinity site was the location of a nuclear test during the Cold War.,024bf09cd14548ba8830d6fda87edb5b,4
oppenheimer,black holes,"Although Oppenheimer's discovery of black holes was indeed significant, he was not as excited about it as shown in the film.",024bf09cd14548ba8830d6fda87edb5b,4
trinity test,donald hornig,"During the Trinity test, Donald Hornig had his hand on the kill switch for a faster reaction time, as opposed to being near it as depicted in the film.",024bf09cd14548ba8830d6fda87edb5b,4
truman,oppenheimer,"Truman called Oppenheimer a 'crybaby', but this was in a letter to Dean Acheson one year later, not immediately after meeting Oppenheimer.",024bf09cd14548ba8830d6fda87edb5b,4
incorrect american flag,current 50-star flag,"during the war, the american flag had only 48 stars as hawaii and alaska had yet to become states. The current 50-star flag is shown in the film, but this version was not adopted until 1960.",640439229e1a4be1bc05929f8fbc7d43,4
oppenheimer,incorrect action (poisoning tutor's apple),"based on accounts that oppenheimer gave of the incident, but it is unclear whether it occurred in real life. Oppenheimer is depicted as putting potassium cyanide in the apple before having a change of heart the next day and narrowly preventing it from being eaten.",640439229e1a4be1bc05929f8fbc7d43,4
niels bohr,apple (involvement),there is no evidence that bohr nearly ate the apple or had any involvement in the incident.,640439229e1a4be1bc05929f8fbc7d43,4
