node_1,node_2,edge,chunk_id,count
oppenheimer,j. robert oppenheimer,Oppenheimer is the American theoretical physicist depicted in this biographical thriller drama film.,3eddf748d7304e11a90f0e1f388a0f25,4
biographical thriller drama film,oppenheimer,"Oppenheimer is the title of the 2023 movie directed, written, and produced by Christopher Nolan, which chronicles the life of J. Robert Oppenheimer.",3eddf748d7304e11a90f0e1f388a0f25,4
christopher nolan,oppenheimer,"Christopher Nolan is the director, writer, and producer of Oppenheimer, a 2023 epic biographical thriller drama film.",3eddf748d7304e11a90f0e1f388a0f25,4
kai bird,american prometheus,"American Prometheus is the title of the 2005 biography authored by Kai Bird, which serves as the inspiration for Christopher Nolan's Oppenheimer.",3eddf748d7304e11a90f0e1f388a0f25,4
martin j. sherwin,american prometheus,"Martin J. Sherwin is a co-author of American Prometheus, the biography that served as inspiration for Christopher Nolan's Oppenheimer.",3eddf748d7304e11a90f0e1f388a0f25,4
j. robert oppenheimer,los alamos laboratory,"J. Robert Oppenheimer was the director of Los Alamos Laboratory during World War II, where he led the development of the first nuclear weapons.",3eddf748d7304e11a90f0e1f388a0f25,4
lewis strauss,robert downey jr.,"In Christopher Nolan's Oppenheimer, Lewis Strauss is portrayed by Robert Downey Jr.",3eddf748d7304e11a90f0e1f388a0f25,4
emily blunt,oppenheimer,"Emily Blunt appears in Christopher Nolan's Oppenheimer, a 2023 biographical thriller drama film.",3eddf748d7304e11a90f0e1f388a0f25,4
matt damon,oppenheimer,"Matt Damon appears in Christopher Nolan's Oppenheimer, a 2023 biographical thriller drama film.",3eddf748d7304e11a90f0e1f388a0f25,4
florence pugh,oppenheimer,"Florence Pugh appears in Christopher Nolan's Oppenheimer, a 2023 biographical thriller drama film.",3eddf748d7304e11a90f0e1f388a0f25,4
josh hartnett,oppenheimer,"Josh Hartnett appears in Christopher Nolan's Oppenheimer, a 2023 biographical thriller drama film.",3eddf748d7304e11a90f0e1f388a0f25,4
casey affleck,oppenheimer,"Casey Affleck appears in Christopher Nolan's Oppenheimer, a 2023 biographical thriller drama film.",3eddf748d7304e11a90f0e1f388a0f25,4
rami malek,oppenheimer,"Rami Malek appears in Christopher Nolan's Oppenheimer, a 2023 biographical thriller drama film.",3eddf748d7304e11a90f0e1f388a0f25,4
kenneth branagh,oppenheimer,"Kenneth Branagh appears in Christopher Nolan's Oppenheimer, a 2023 biographical thriller drama film.",3eddf748d7304e11a90f0e1f388a0f25,4
imax 65 mm,oppenheimer,"In his direction of Oppenheimer, Christopher Nolan employed IMAX 65 mm and 65 mm large-format film.",3eddf748d7304e11a90f0e1f388a0f25,4
oppenheimer,barbie,"Both films, Oppenheimer and Barbie, had a concurrent release in the United States and the United Kingdom on July 21, 2023, leading to the 'Barbenheimer' phenomenon where audiences saw both films as a double feature.",8ce178ae7eb24b0f91f73ab17a2a884d,4
oppenheimer,le grand rex,"Oppenheimer premiered at Le Grand Rex in Paris on July 11, 2023.",8ce178ae7eb24b0f91f73ab17a2a884d,4
universal pictures,oppenheimer,"Universal Pictures theatrically released Oppenheimer in the United States and the United Kingdom on July 21, 2023.",8ce178ae7eb24b0f91f73ab17a2a884d,4
murphy,oppenheimer,Christian Bale starred as J. Robert Oppenheimer in Oppenheimer.,8ce178ae7eb24b0f91f73ab17a2a884d,4
downey,oppenheimer,Robert Downey Jr. Played Lewis Strauss in Oppenheimer.,8ce178ae7eb24b0f91f73ab17a2a884d,4
nolan,oppenheimer,Christopher Nolan directed Oppenheimer.,8ce178ae7eb24b0f91f73ab17a2a884d,4
over $977 million,oppenheimer,Oppenheimer grossed over $977 million worldwide.,8ce178ae7eb24b0f91f73ab17a2a884d,4
third-highest-grossing film,oppenheimer,Oppenheimer became the third-highest-grossing film of 2023.,8ce178ae7eb24b0f91f73ab17a2a884d,4
world war ii-related film,highest-grossing,Oppenheimer became the highest-grossing World War II-related film.,8ce178ae7eb24b0f91f73ab17a2a884d,4
biographical film,highest-grossing,Oppenheimer became the highest-grossing biographical film.,8ce178ae7eb24b0f91f73ab17a2a884d,4
r-rated film,second-highest-grossing,Oppenheimer became the second-highest-grossing R-rated film at the time of its release.,8ce178ae7eb24b0f91f73ab17a2a884d,4
academy awards,oppenheimer,"Oppenheimer won seven Academy Awards, including Best Picture and Best Director for Christopher Nolan.",8ce178ae7eb24b0f91f73ab17a2a884d,4
golden globe awards,oppenheimer,"Oppenheimer won five Golden Globe Awards, including Best Motion Picture – Drama.",8ce178ae7eb24b0f91f73ab17a2a884d,4
british academy film awards,oppenheimer,"Oppenheimer won seven British Academy Film Awards, including Best Film.",8ce178ae7eb24b0f91f73ab17a2a884d,4
top ten films of 2023,oppenheimer,Oppenheimer was named one of the top ten films of 2023 by the National Board of Review and the American Film Institute.,8ce178ae7eb24b0f91f73ab17a2a884d,4
j. robert oppenheimer,niels bohr,"In 1926, Cambridge doctoral student, J. Robert Oppenheimer, seeks advice from scientist Niels Bohr regarding his dissatisfaction in the laboratory. This interaction leads to Oppenheimer's decision to study theoretical physics in Germany at the University of Gottingen under Max Born.",20e1b3679ef04131a59c0446e0d3271b,4
j. robert oppenheimer,max born,"Oppenheimer completes his PhD in theoretical physics at the University of Gottingen, Germany under Max Born in 1927.",20e1b3679ef04131a59c0446e0d3271b,4
ernest o. lawrence,j. robert oppenheimer,Oppenheimer befriends experimental physicist Ernest O. Lawrence at Berkeley's Radiation Lab after returning to the US to teach quantum physics.,20e1b3679ef04131a59c0446e0d3271b,4
communist party,berkeley's professors and graduate students,The involvement of Berkeley's professors and graduate students in activities of the Communist Party brings Oppenheimer into contact with them.,20e1b3679ef04131a59c0446e0d3271b,4
jean tatlock,j. robert oppenheimer,"Oppenheimer engages in an affair with Stanford psychiatrist Jean Tatlock, which lasts until his eventual marriage to Katherine Puening.",20e1b3679ef04131a59c0446e0d3271b,4
katherine puening,j. robert oppenheimer,Oppenheimer marries biologist and ex-communist Katherine Puening after his affair with Jean Tatlock ends.,20e1b3679ef04131a59c0446e0d3271b,4
us army colonel leslie groves,j. robert oppenheimer,"Despite past communist ties, Oppenheimer is recruited for the Manhattan Project by US Army Colonel Leslie Groves during World War II.",20e1b3679ef04131a59c0446e0d3271b,4
albert einstein,j. robert oppenheimer,Oppenheimer consults with Albert Einstein about the impact of the bomb during the Manhattan Project.,20e1b3679ef04131a59c0446e0d3271b,4
werner heisenberg,physicist,The German nuclear program under Werner Heisenberg is believed to be outpaced by the Manhattan Project's physicists.,20e1b3679ef04131a59c0446e0d3271b,4
edward teller,j. robert oppenheimer,"Physicist Edward Teller predicts that an atomic detonation could wipe out the world during the Manhattan Project, but his calculations are later disproved.",20e1b3679ef04131a59c0446e0d3271b,4
trinity test,atomic bombings of hiroshima and nagasaki,"causal relationship between the successful Trinity nuclear test in New Mexico and the atomic bombings of Hiroshima and Nagasaki two weeks later, leading to Japan's surrender in World War II",ed635600631d4c73a7d47890016d76aa,4
oppenheimer,guilt over the bomb's destruction and effects of radioactive fallout,"emotional relationship between Oppenheimer, as a key scientist involved in the development of the atomic bomb, and his deep feelings of guilt and remorse over its devastating consequences",ed635600631d4c73a7d47890016d76aa,4
oppenheimer,truman,"relationship between Oppenheimer and President Truman, as Oppenheimer advises him to cease further atomic weapons development in a private meeting but is ignored",ed635600631d4c73a7d47890016d76aa,4
teller,hydrogen bomb,"relationship between Teller and the hydrogen bomb, as Teller's research on fusion bombs using deuterium continues amidst the burgeoning Cold War",ed635600631d4c73a7d47890016d76aa,4
groves,compartmentalization,"relationship between Groves and compartmentalization, as he complains about lack of compartmentalization in light of rumors abounding about spies at the Los Alamos facility",ed635600631d4c73a7d47890016d76aa,4
chevalier,oppenheimer's past ties with communism,"relationship between Chevalier and Oppenheimer's past ties with communism, as indirect approaches by the Soviet Union to Chevalier are brought up in light of his friendship with Oppenheimer",ed635600631d4c73a7d47890016d76aa,4
tatlock,oppenheimer,"relationship between Tatlock and Oppenheimer, as she briefly rekindles her affair with him before being found dead in an apparent suicide",ed635600631d4c73a7d47890016d76aa,4
oppenheimer,einstein,"During a visit to Princeton with Lewis Strauss, Oppenheimer consults with Einstein again. Strauss resents the meeting as he believes Oppenheimer 'turned Einstein against me.' When the Soviets successfully detonate their own bomb, Strauss accuses Oppenheimer of having harbored spies at Los Alamos. However, in a flashback, Einstein predicts Oppenheimer's downfall and eventual reconciliation with the US, while Oppenheimer expresses remorse to Einstein over his role in inadvertently starting a nuclear arms race that could one day destroy the world.",09701a84b6c442c3a897a668c9a697bf,4
oppenheimer,strauss,"Strauss orchestrates a private security hearing for renewal of Oppenheimer's Q clearance. The board's attorney, Roger Robb, uses evidence of past communist ties and stance against Teller's hydrogen bomb, to convince the board to revoke Oppenheimer's clearance, limiting his influence on US nuclear policy.",09701a84b6c442c3a897a668c9a697bf,4
strauss,oppenheimer,Strauss accuses Oppenheimer of having harbored spies at Los Alamos because Oppenheimer 'turned Einstein against me.',09701a84b6c442c3a897a668c9a697bf,4
einstein,oppenheimer,"In a flashback, Einstein predicts Oppenheimer's downfall and eventual reconciliation with the US.",09701a84b6c442c3a897a668c9a697bf,4
nolan,oppenheimer,"In September 2021, it was announced that Nolan would write and direct a biographical film about Oppenheimer and his contributions to the Manhattan Project, with Cillian Murphy in negotiations to star.",65c863e73e5e49f8bbcba9b60e7c2d74,4
oppenheimer,manhattan project,Oppenheimer's contributions to,65c863e73e5e49f8bbcba9b60e7c2d74,4
nolan,universal,"According to insiders, Paramount was ruled out early in the process due to the replacement of the CEO and chairman, Jim Gianopulos, with Brian Robbins, an advocate for increased streaming-service releases. Nolan signed with Universal because he had previously worked with Donna Langley, chairwoman and chief content officer of the NBCUniversal studio group, on an unsuccessful attempt to make a film version of the UK television series The Prisoner.",65c863e73e5e49f8bbcba9b60e7c2d74,4
universal,oppenheimer,"Langley agreed with Nolan's stance on traditional film exhibition and Universal agreed to finance and distribute Oppenheimer, with production set to begin in the first quarter of 2022.",65c863e73e5e49f8bbcba9b60e7c2d74,4
universal,nolan's terms,"Universal also agreed to Nolan's terms, which included a production budget of $100 million,",65c863e73e5e49f8bbcba9b60e7c2d74,4
universal,exclusive theatrical window,"an exclusive theatrical window ranging from 90 to 120 days,",65c863e73e5e49f8bbcba9b60e7c2d74,4
universal,first-dollar gross,"8Nolan received an equal marketing budget and a three-week period both before and after the opening, in which Universal could not release another new film.",65c863e73e5e49f8bbcba9b60e7c2d74,4
nolan,sting,Inspiration for Nolan's interest in Oppenheimer was sparked after hearing the lyric 'How can I save my little boy from Oppenheimer’s deadly toy?' in Sting's song 'Russians',4e48b0741d42464db79bdde565ab5a8a,4
nolan,nuclear holocaust fears,"Grew up during the era of CND and anti-nuclear protests at RAF Greenham Common, leading to an enduring fascination with nuclear threats",4e48b0741d42464db79bdde565ab5a8a,4
nolan,howard hughes biopic script,Writing of a Howard Hughes biopic during the production of The Aviator provided Nolan insights on writing scripts about people's lives,4e48b0741d42464db79bdde565ab5a8a,4
bird,nolan,Bird and Sherwin began discussing the Oppenheimer script with Roven and Nolan in September 2021,4e48b0741d42464db79bdde565ab5a8a,4
oppenheimer,first-person narrative,"Nolan wrote the Oppenheimer script from Oppenheimer's perspective, giving the film a unique 'texture'",4e48b0741d42464db79bdde565ab5a8a,4
oppenheimer,narrative,as he wanted the narrative to be conveyed from Oppenheimer's perspective.,b45d63c8cfbb4935af104edc0929198e,4
texture,film,how the personal interacts with the historic and the geopolitical,b45d63c8cfbb4935af104edc0929198e,4
oppenheimer's affair with jean tatlock,tatlock's influence on oppenheimer's life,"Nolan wanted to candidly portray his affair with Jean Tatlock and explore her influence on Oppenheimer's life since she was a Communist, which had 'enormous ramifications for [Oppenheimer’s] later life and his ultimate fate'",c9f7ae6fa9f14388ab2bdbaf799d3334,4
oppenheimer,admiral lewis strauss,"Nolan was inspired by the relationship between Wolfgang Amadeus Mozart and Antonio Salieri as depicted in Amadeus (1984) and sought to explore the relationship between Oppenheimer and Admiral Lewis Strauss, former chair of the US Atomic Energy Commission",c9f7ae6fa9f14388ab2bdbaf799d3334,4
oppenheimer,nolan,The film Oppenheimer marks the sixth collaboration between director Christopher Nolan and actor Cillian Murphy. Murphy enthusiastically accepted Nolan's offer to play the lead role after being inspired by David Bowie's appearance in the 1970s.,7e5affefb7cb48d9814647bd2bcbed45,4
oppenheimer,murphy,"To prepare for his role as Oppenheimer, Murphy read extensively on the physicist's life.",7e5affefb7cb48d9814647bd2bcbed45,4
oppenheimer,thorne,"Nobel laureate Kip Thorne set up a phone call between Murphy and himself, as Thorne had attended some of Oppenheimer's seminars and explained his experience with the physicist's gift for facilitating group discussions of difficult scientific concepts.",7e5affefb7cb48d9814647bd2bcbed45,4
oppenheimer,downey jr.,"Robert Downey Jr. Played the role of Oppenheimer in the film, as mentioned in the context.",f3002c1ea4d04e418bcf7f4bb1ed7720,4
groves,damon,"Matt Damon played the part of Leslie Groves in the film, as stated in the context. However, this information was not explicitly mentioned for Downey Jr., indicating that they may not have had a direct relationship.",f3002c1ea4d04e418bcf7f4bb1ed7720,4
oppenheimer,blunt,"Emily Blunt took the role of Katherine 'Kitty' Oppenheimer in the film, as revealed in the context. Since there is no mention of a direct relationship between Oppenheimer and Blunt's character, we cannot infer that they are directly related.",f3002c1ea4d04e418bcf7f4bb1ed7720,4
downey jr.,nolan,"According to Downey Jr., he went to Nolan's house to read the script for Oppenheimer, suggesting a possible collaboration or working relationship between the two.",f3002c1ea4d04e418bcf7f4bb1ed7720,4
blunt,nolan,"When Blunt was offered the role of Katherine 'Kitty' Oppenheimer in Oppenheimer, she accepted it enthusiastically and even reached out to Murphy to learn about working with Nolan.",f3002c1ea4d04e418bcf7f4bb1ed7720,4
damon,nolan,"Damon initially took a break from acting due to negotiations with his wife in couples therapy, but signed on to Oppenheimer at Nolan's request after reserving one exception for such circumstances.",f3002c1ea4d04e418bcf7f4bb1ed7720,4
nolan,benny safdie,Nolan cast Benny Safdie as physicist Edward Teller in the film.,47e891ddc52248cc90ebc562fd0f02dc,4
edward teller,benny safdie,"Benny Safdie played physicist Edward Teller in the film, based on Nolan's request and recommendation from director Paul Thomas Anderson.",47e891ddc52248cc90ebc562fd0f02dc,4
nolan,michael caine,"Nolan's previous film Insomnia (2002) featured Michael Caine, but this film does not.",47e891ddc52248cc90ebc562fd0f02dc,4
glen powell,josh hartnett,Glen Powell auditioned for the role that eventually went to Josh Hartnett.,47e891ddc52248cc90ebc562fd0f02dc,4
gary oldman,harry s. truman,"Nolan considered Gary Oldman, who was on a break from filming Slow Horses (2022–present), to play Harry S. Truman due to his contractual obligation not to cut his hair. However, Oldman suggested that either he could wear a prosthetic cap and wig or someone else should play the part.",47e891ddc52248cc90ebc562fd0f02dc,4
new mexico,santa fe,"Pre-production for the film began in New Mexico, where a casting call was held in Santa Fe and Los Alamos to audition people to play local residents, military personnel, and scientists.",47e891ddc52248cc90ebc562fd0f02dc,4
new mexico,los alamos,"Pre-production for the film began in New Mexico, where a casting call was held in Santa Fe and Los Alamos to audition people to play local residents, military personnel, and scientists.",47e891ddc52248cc90ebc562fd0f02dc,4
principal photography,ghost ranch,"began on february 28, 2022, at ghost ranch in new mexico",29b5dd4d2b9d4df884785d8bbe90d149,4
principal photography,hoyte van hoytema,served as cinematographer for the duration of principal photography,29b5dd4d2b9d4df884785d8bbe90d149,4
principal photography,approximately 85 days,"had been set aside for filming, but due to budget and location constraints, it was reduced to 57 days",29b5dd4d2b9d4df884785d8bbe90d149,4
location shooting,california,and new jersey were efficiently used during principal photography,29b5dd4d2b9d4df884785d8bbe90d149,4
location shooting,new mexico,high-quality historically accurate sets were constructed for principal photography,29b5dd4d2b9d4df884785d8bbe90d149,4
oldman,may,"appeared in a day's worth of shooting, specifically for one scene and a page and a half of dialogue",29b5dd4d2b9d4df884785d8bbe90d149,4
nixon presidential library,oval office location,fell through a week before filming due to scheduling conflicts with oldman's dates. Production design team redressed veep's oval office set for filming instead.,29b5dd4d2b9d4df884785d8bbe90d149,4
flora (nolan's daughter),a young woman disintegrated in a nuclear explosion,"featured in one of oppenheimer's visions, representing the destructive nature of creating ultimate destructive power.",29b5dd4d2b9d4df884785d8bbe90d149,4
imax black-and-white photographic film,film,"The film used a combination of IMAX 65 mm and this specific type of film, which was created and developed by Kodak and FotoKem for the movie.",aa10cfe95cc846fb81a03915f51aeab1,4
imax black-and-white photographic film,photographic film,"This type of film, used in the combination with IMAX 65 mm film, is a specific variant of photographic film developed by Kodak and FotoKem for the movie.",aa10cfe95cc846fb81a03915f51aeab1,4
imax mkiv or imax msm 9802 cameras,imax cameras,The production used these specific types of IMAX cameras for filming certain sections of the movie.,aa10cfe95cc846fb81a03915f51aeab1,4
panavision panaflex system 65 studio cameras,imax cameras,Some scenes shot on these Panavision cameras were filmed using IMAX cameras.,aa10cfe95cc846fb81a03915f51aeab1,4
panavision sphero 65 and panavision system 65 lenses,panavision lenses,The production had these specific types of Panavision lenses used when filming on the Panavision Panaflex System 65 Studio cameras.,aa10cfe95cc846fb81a03915f51aeab1,4
custom probe lens,imax cameras,The production constructed this custom-made probe lens to allow for macro and microphotography with IMAX cameras.,aa10cfe95cc846fb81a03915f51aeab1,4
miniatures filmed at 48 frames per second,imax cameras,Miniature effects were filmed using these specific types of IMAX cameras at this specific frame rate.,aa10cfe95cc846fb81a03915f51aeab1,4
arriflex 435 es camera at 150 frames per second,miniatures needing higher speed,"When miniature effects required a higher frame rate, they were filmed using this specific type of camera.",aa10cfe95cc846fb81a03915f51aeab1,4
institute for advanced study,location,Filming took place at this specific location in New Jersey.,aa10cfe95cc846fb81a03915f51aeab1,4
"university of california, berkeley",location,Some scenes were filmed on or around the campus of this university in California.,aa10cfe95cc846fb81a03915f51aeab1,4
pasadena,location,Scenes set in Berkeley itself were filmed in this nearby city in California.,aa10cfe95cc846fb81a03915f51aeab1,4
los alamos,ghost ranch,"In 2021, during a research trip, Nolan discovered that Los Alamos had drastically changed from its 1940s appearance and could not be used for exterior shots of the town due to the presence of a Starbucks. Instead, the production team constructed a version of 1940s-era Los Alamos on top of a similar plateau at Ghost Ranch.",6195aa0bac2c4a7ca62757181bce337d,4
main street,ghost ranch,"As mentioned in the text, the town's equivalent of Main Street has not been explicitly named, but it is stated that it could not be used for exterior shots due to its modern appearance.",6195aa0bac2c4a7ca62757181bce337d,4
academic lecture halls,historic women's army corps dormitory in los alamos,"To save time and money, the production team decided against attempting to reconstruct academic lecture halls as sets at Ghost Ranch and instead shot them inside a historic Women's Army Corps dormitory in Los Alamos.",6195aa0bac2c4a7ca62757181bce337d,4
oppenheimer's original cabin,interior shooting,"Many scenes in the film take place inside Oppenheimer's original cabin in Los Alamos, and interior shooting for those scenes began on March 8, 2022.",6195aa0bac2c4a7ca62757181bce337d,4
new york hotel,albuquerque's old post office building,The New York hotel scenes were shot in Albuquerque's Old Post Office building.,6195aa0bac2c4a7ca62757181bce337d,4
"washington, d.c.",state government buildings in santa fe,"The Washington, D.C. Scenes were shot in state government buildings in the state capital of Santa Fe.",6195aa0bac2c4a7ca62757181bce337d,4
ucla's kerckhoff hall,cambridge and göttingen scenes,"Three days were set aside for filming at UCLA's Kerckhoff Hall, which was used for both the Cambridge and Göttingen scenes.",595b43e41ee347a0b4d3475670715278,4
the millennium biltmore hotel,mark hopkins hotel,The Millennium Biltmore Hotel in Downtown Los Angeles stood in for the Mark Hopkins Hotel for one of Oppenheimer's encounters with Tatlock.,595b43e41ee347a0b4d3475670715278,4
the millennium biltmore hotel,plaza hotel,The Millennium Biltmore Hotel in Downtown Los Angeles stood in for the Plaza Hotel for Strauss's 1949 birthday celebration.,595b43e41ee347a0b4d3475670715278,4
the millennium biltmore hotel,"unnamed washington, d.c. hotel",For the scene where Szilard and Hill try to get Oppenheimer to sign a petition against dropping the bomb on Japan.,595b43e41ee347a0b4d3475670715278,4
disused office building in the former manufacturing headquarters for the petrochemical company c.f. braun & co.,oppenheimer's security hearing,"The scene in which Oppenheimer's security clearance was revoked was shot on May 19, 2022, the production's last day in Alhambra.",595b43e41ee347a0b4d3475670715278,4
filming,real explosives,"The production team used real explosives during filming to recreate the Trinity nuclear test, as opposed to relying on computer-generated graphics.",39d19bca47f140bca4e767843efe8e1b,4
filming,white sands missile range,"The production team was able to obtain government permission to film at White Sands Missile Range, but only at highly inconvenient hours, which led them to choose to film the scene elsewhere in the New Mexico desert.",39d19bca47f140bca4e767843efe8e1b,4
trinity test scenes,"belen, new mexico","The production filmed the Trinity test scenes in Belen, New Mexico.",39d19bca47f140bca4e767843efe8e1b,4
murphy,steel tower,"During filming of the Trinity test scenes, Murphy climbed a 100-foot steel tower, which was a replica of the original site used in the Manhattan Project.",39d19bca47f140bca4e767843efe8e1b,4
special set,"gasoline, propane, aluminum powder, and magnesium","To create the explosive effect during filming of the Trinity test scenes, the production team used a special set that utilized gasoline, propane, aluminum powder, and magnesium.",39d19bca47f140bca4e767843efe8e1b,4
special effects team,forced perspective,The special effects team used forced perspective to make the models they built for the practical effect look closer to their intended real-life size during filming of the Trinity test scenes.,39d19bca47f140bca4e767843efe8e1b,4
visualizations,"interactions between atoms, molecules and energy waves","During the film's visual effects, practical methods were used to depict visualizations of the interactions between atoms, molecules and energy waves.",39d19bca47f140bca4e767843efe8e1b,4
visualizations,"stars, black holes and supernovas","During the film's visual effects, practical methods were also used to depict stars, black holes and supernovas.",39d19bca47f140bca4e767843efe8e1b,4
atoms,energy waves,"In the context provided, atoms and energy waves are both achieved through practical methods. This suggests a relationship between the two concepts in the context of practical methods.",f614fcea4ba345fb8d7e86b9409992b4,4
molecules,atoms,The context states that atoms and molecules are both achieved through practical methods. This implies a relationship between the two concepts in the context of practical methods.,f614fcea4ba345fb8d7e86b9409992b4,4
stars,practical methods,The context states that stars can be depicted through practical methods. This indicates a direct relationship between stars and practical methods.,f614fcea4ba345fb8d7e86b9409992b4,4
