node_1,node_2,edge,chunk_id,count
einstein,specific conversations,the specific conversations which the film revolves around never happened.,640439229e1a4be1bc05929f8fbc7d43,4
karl compton,recruitment (aggressive),"groves' aggressive recruitment of oppenheimer, but arthur compton at the metallurgical laboratory was the first to appoint oppenheimer to take over the research into the bomb-design part of the manhattan project.",640439229e1a4be1bc05929f8fbc7d43,4
strauss,oppenheimer,"Strauss had another reason to undermine Oppenheimer's credibility by revoking his security clearance, which was Oppenheimer's opposition to further development of the hydrogen bomb by the United States. This action by Strauss could possibly have been a constraint upon the nuclear arms race between the US and USSR, as described by Scott Sagan as a 'broader tragedy' less clearly depicted in the film than the scientist's personal tragedy. However, the production is called 'highly accurate' otherwise for a Hollywood film.",5573b93a9dea43efb1a3e34404a1f930,4
oppenheimer,interpersonal conflicts,"Oppenheimer was involved in interpersonal conflicts at Los Alamos, as depicted in the film. This fact is not related to his opposition to further development of the hydrogen bomb by the United States.",5573b93a9dea43efb1a3e34404a1f930,4
los alamos,oppenheimer,"Oppenheimer was working at Los Alamos during the Manhattan Project. Most of the efforts undertaken at other Manhattan Project sites like Hanford, Washington and Oak Ridge, Tennessee were not shown in the film.",5573b93a9dea43efb1a3e34404a1f930,4
general leslie groves,many efforts undertaken at other manhattan project sites,"General Leslie Groves was overseeing many efforts undertaken at other Manhattan Project sites like Hanford, Washington and Oak Ridge, Tennessee. These efforts focused on producing the radioactive material that powered the nuclear explosions.",5573b93a9dea43efb1a3e34404a1f930,4
metallurgical laboratory,others working at other project sites,"The University of Chicago's Metallurgical Laboratory, where others working at other Project sites like Hanford, Washington and Oak Ridge, Tennessee were also expressing concerns about using the atomic bomb against Japan.",5573b93a9dea43efb1a3e34404a1f930,4
plutonium production,fizzle,The technical problem of fizzle was accurately represented throughout the film in relation to plutonium production. This refers to the uncontrolled nuclear reaction that occurs during the production process.,40a1757d0ec34edd8ea731f488de0207,4
plutonium production,ingenuity,The film highlighted the ingenuity required for overcoming setbacks and engineering breakthroughs in plutonium production.,40a1757d0ec34edd8ea731f488de0207,4
plutonium production,setbacks,The technical issue of setbacks was also mentioned in the film's portrayal of plutonium production.,40a1757d0ec34edd8ea731f488de0207,4
plutonium production,engineering breakthroughs,"Engineering breakthroughs, which are significant advancements in the technology or process involved in plutonium production, were also discussed in the film.",40a1757d0ec34edd8ea731f488de0207,4
plutonium production,determination to succeed,The film emphasized the crucial role played by determination to succeed in overcoming technical issues and achieving plutonium production.,40a1757d0ec34edd8ea731f488de0207,4
enrico fermi,manhattan project,"Enrico Fermi, a key scientist involved in the Manhattan Project, was not given adequate recognition in the film for his contributions to plutonium production.",40a1757d0ec34edd8ea731f488de0207,4
kyoto,stimson,"The film portrays Stimson removing Kyoto from the list of top atomic bomb targets due to it being a favored honeymoon destination for him and his wife. However, historian Alex Wellerstein clarifies that this portrayal is a myth as Stimson's diary does not mention Kyoto during his travels with his wife in 1926 and he only briefly visited there in 1929 during a single night stay while on a 'fact-finding' mission. The film overlooked that Stimson's objection to targeting Kyoto was primarily strategic rather than personal as he expressed this viewpoint to President Truman multiple times, including at the Potsdam Conference.",8603e82515c4451b9aeefe21cf4778ad,4
stimson,truman,"Stimson expressed his viewpoint of not targeting Kyoto to President Truman multiple times, including at the Potsdam Conference. Truman agreed with this suggestion and emphasized his own concurring belief on the subject.",8603e82515c4451b9aeefe21cf4778ad,4
kyoto,targeting,"Kyoto was considered as a target for atomic bombs, but Stimson's objection to targeting Kyoto was primarily strategic rather than personal.",8603e82515c4451b9aeefe21cf4778ad,4
oppenheimer,leading five golden globe awards,"The film won numerous other accolades, including a leading five Golden Globe Awards.",37589ce7ed4e428ca3078724dc9860fe,4
oppenheimer,best motion picture - drama,"The film won a leading five Golden Globe Awards, receiving Best Motion Picture – Drama at the 81st ceremony.",37589ce7ed4e428ca3078724dc9860fe,4
oppenheimer,best director,Nolan received Best Director for Oppenheimer at the 81st Golden Globe Awards.,37589ce7ed4e428ca3078724dc9860fe,4
murphy,best actor in a motion picture - drama,Murphy received Best Actor in a Motion Picture – Drama for Oppenheimer at the 81st Golden Globe Awards.,37589ce7ed4e428ca3078724dc9860fe,4
downey jr.,best supporting actor - motion picture,Downey Jr. Received Best Supporting Actor – Motion Picture for Oppenheimer at the 81st Golden Globe Awards.,37589ce7ed4e428ca3078724dc9860fe,4
göransson,best original score,"Oppenheimer's score, composed by Göransson, won Best Original Score at the 81st Golden Globe Awards.",37589ce7ed4e428ca3078724dc9860fe,4
national board of review,oppenheimer,The National Board of Review named Oppenheimer one of the top-ten films of 2023.,37589ce7ed4e428ca3078724dc9860fe,4
american film institute,oppenheimer,The American Film Institute named Oppenheimer one of the top-ten films of 2023.,37589ce7ed4e428ca3078724dc9860fe,4
