Question & Options,Correct Answer
"Which statements are true regarding the soundtrack of 'Chandni Chowk to China'?
Options:
A. A) Bohemia performed both songs 'Chandni Chowk To China (CC2C)' and 'Bohemia'.
B. B) Bohemia is a contributing artist to the soundtrack of 'Chandni Chowk to China'.
C. C) The soundtrack album was composed by Shankar–Ehsaan–Loy and other notable artists.
D. D) The film 'Chandni Chowk to China' was released in 2009.","A) Bohemia performed both songs 'Chandni Chowk To China (CC2C)' and 'Bohemia'., B) Bohemia is a contributing artist to the soundtrack of 'Chandni Chowk to China'., C) The soundtrack album was composed by Shankar–Ehsaan–Loy and other notable artists."
"Which statements are true regarding the music related to 'Chandni Chowk to China'?
Options:
A. A) The song 'Bohemia' is performed by Bohemia.
B. B) Bohemia is featured on the soundtrack of 'Chandni Chowk to China'.
C. C) 'S.I.D.H.U' is a song from the album 'Chandni Chowk to China'.
D. D) 'Chandni Chowk to China' is a movie released in 2009.","A) The song 'Bohemia' is performed by Bohemia., B) Bohemia is featured on the soundtrack of 'Chandni Chowk to China'., C) 'S.I.D.H.U' is a song from the album 'Chandni Chowk to China'."
"Which statements are true regarding the music from the movie 'Chandni Chowk to China'?
Options:
A. A) Bohemia performed both 'Chandni Chowk to China (CC2C)' and 'Bohemia'.
B. B) Bohemia is an Indian rapper who contributed to the soundtrack of 'Chandni Chowk to China'.
C. C) 'India Se Aaya Tera Dost (Aap Ki Khatir)' is part of the same album as 'Chandni Chowk to China'.
D. D) Bohemia is not associated with the soundtrack of 'Chandni Chowk to China'.","B) Bohemia is an Indian rapper who contributed to the soundtrack of 'Chandni Chowk to China'., C) 'India Se Aaya Tera Dost (Aap Ki Khatir)' is part of the same album as 'Chandni Chowk to China'."
"Which statements are true regarding the songs and artist related to 'Chandni Chowk to China'?
Options:
A. A) Bohemia performed the song 'Chandni Chowk To China (CC2C)'
B. B) Bohemia contributed to the soundtrack of 'Chandni Chowk to China'
C. C) 'Tera Naina' is in the same album as 'Chandni Chowk to China'
D. D) 'Bohemia' is the title of the album containing 'Tera Naina'","A) Bohemia performed the song 'Chandni Chowk To China (CC2C)', B) Bohemia contributed to the soundtrack of 'Chandni Chowk to China', C) 'Tera Naina' is in the same album as 'Chandni Chowk to China'"
"Which of the following statements are true regarding the songs and artists related to 'Chandni Chowk to China'?
Options:
A. A) Bohemia performed both 'Chandni Chowk To China (CC2C)' and 'Bohemia'.
B. B) Bohemia contributed to the soundtrack of 'Chandni Chowk to China'.
C. C) 'Chak Lein De' is part of the same album as 'Chandni Chowk to China'.
D. D) 'Chandni Chowk to China' is a song performed by Bohemia.","B) Bohemia contributed to the soundtrack of 'Chandni Chowk to China'., C) 'Chak Lein De' is part of the same album as 'Chandni Chowk to China'."
"Which statements are true regarding the songs related to 'Chandni Chowk to China'?
Options:
A. A) Bohemia performed both 'Chandni Chowk To China (CC2C)' and 'Bohemia'.
B. B) Bohemia contributed to the soundtrack of 'Chandni Chowk to China'.
C. C) 'S.I.D.H.U (Remix)' is a remix version of 'Chandni Chowk to China'.
D. D) Both songs 'Chandni Chowk To China (CC2C)' and 'Bohemia' are performed by Bohemia.","B) Bohemia contributed to the soundtrack of 'Chandni Chowk to China'., D) Both songs 'Chandni Chowk To China (CC2C)' and 'Bohemia' are performed by Bohemia."
