node_1,node_2,edge,chunk_id,count
ghost rider,christopher young,Ghost Rider score composed by Christopher Young,eb254ca04ede4bb484ca93f31652b1f5,4
spider-man 3,christopher young,"Christopher Young composed Ghost Rider score. In addition, Spiderbait, a band that Johnson befriended during filming in Australia,[35] performed a cover of 'Ghost Riders in the Sky' for the end credits.[37]",eb254ca04ede4bb484ca93f31652b1f5,4
spider-man 3,spiderbait,Band Spiderbait performed a cover of 'Ghost Riders in the Sky' for the end credits.,eb254ca04ede4bb484ca93f31652b1f5,4
christopher young,orchestral,"Film score, orchestral",eb254ca04ede4bb484ca93f31652b1f5,4
the grudge 2,christopher young,Christopher Young composed Ghost Rider score.,eb254ca04ede4bb484ca93f31652b1f5,4
