node_1,node_2,edge,chunk_id,count
mark wahlberg,cade yeager,Main article: List of Transformers film series cast and characters Humans Mark Wahlberg as Cade Yeager:  A single father and struggling inventor.,8a18ca844f544f6f9802321382e35ebf,4
nicola peltz,tessa yeager,"Humans Mark Wahlberg as Cade Yeager:  A single father and struggling inventor. Kelsey Grammer as Harold Attinger:  A former Navy SEAL and rogue government official who created the CIA black-ops unit, Cemetery Wind to eliminate all Transformers, Autobot or Decepticon, from Earth.",8a18ca844f544f6f9802321382e35ebf,4
jack reynor,shane dyson,"Humans Mark Wahlberg as Cade Yeager:  A single father and struggling inventor. Kelsey Grammer as Harold Attinger:  A former Navy SEAL and rogue government official who created the CIA black-ops unit, Cemetery Wind to eliminate all Transformers, Autobot or Decepticon, from Earth.",8a18ca844f544f6f9802321382e35ebf,4
kelsey grammer,harold attinger,"Humans Mark Wahlberg as Cade Yeager:  A single father and struggling inventor. Kelsey Grammer as Harold Attinger:  A former Navy SEAL and rogue government official who created the CIA black-ops unit, Cemetery Wind to eliminate all Transformers, Autobot or Decepticon, from Earth.",8a18ca844f544f6f9802321382e35ebf,4
stanley tucci,joshua joyce,"Humans Mark Wahlberg as Cade Yeager:  A single father and struggling inventor. Stanley Tucci as Joshua Joyce:  An ambitious, arrogant businessman and the head of KSI who wants to build his own Transformers.",8a18ca844f544f6f9802321382e35ebf,4
sophia myles,darcy tyril,"Humans Mark Wahlberg as Cade Yeager:  A single father and struggling inventor. Stanley Tucci as Joshua Joyce:  An ambitious, arrogant businessman and the head of KSI who wants to build his own Transformers.",8a18ca844f544f6f9802321382e35ebf,4
li bingbing,su yueming,"Humans Mark Wahlberg as Cade Yeager:  A single father and struggling inventor. Stanley Tucci as Joshua Joyce:  An ambitious, arrogant businessman and the head of KSI who wants to build his own Transformers. Li Bingbing as Su Yueming: (苏月明 Sū Yuèmíng)  The owner of the Chinese factory used by KSI to build their artificial Transformers.",8a18ca844f544f6f9802321382e35ebf,4
titus welliver,james savoy,"Kelsey Grammer as Harold Attinger:  A former Navy SEAL and rogue government official who created the CIA black-ops unit, Cemetery Wind to eliminate all Transformers, Autobot or Decepticon, from Earth. Humans Mark Wahlberg as Cade Yeager:  A single father and struggling inventor.",8a18ca844f544f6f9802321382e35ebf,4
titus welliver,attinger,"Titus Welliver as James Savoy: A ruthless, corrupt CIA officer and second in-command of the Cemetery Wind working for Attinger.",b61a205cffea40d88b4979fa64a12de4,4
welliver,attinger,"Titus Welliver as James Savoy: A ruthless, corrupt CIA officer and second in-command of the Cemetery Wind working for Attinger.",b61a205cffea40d88b4979fa64a12de4,4
miller,cade's employee and best friend mechanic,"T.J. Miller as Lucas Flannery,  Cade's employee and best friend mechanic.",b61a205cffea40d88b4979fa64a12de4,4
anderson,graves,"Greg Anderson, Ethan Graves, Melanie Specht and Victoria Summer play Joshua's assistants.",b61a205cffea40d88b4979fa64a12de4,4
han geng,ksi executive,Ed Welburn plays a KSI executive.,b61a205cffea40d88b4979fa64a12de4,4
cleo king,realtor,Cleo King appears as a realtor.,b61a205cffea40d88b4979fa64a12de4,4
peter cullen,optimus prime,"Voices Peter Cullen as Optimus Prime: The leader of the Autobots who transforms into a rusty 1977 Marmon 97 semi truck and later, a blue and red 2014 Western Star 5700 XE semi-trailer truck with flame decals.",b61a205cffea40d88b4979fa64a12de4,4
frank welker,galvatron,Frank Welker as Galvatron: A human-made KSI Transformer drone modeled after Optimus Prime who transforms into a black and grey 2014 Freightliner Argosy cab over trailer truck that uses data from the remains of the Decepticon leader Megatron; while being possessed by the latter as a new body.,b61a205cffea40d88b4979fa64a12de4,4
john goodman,hound,"John Goodman as Hound: An Autobot commando who is a member of the Autobot special forces branch called the Wreckers, and is the weapons specialist of the team who transforms into an Oshkosh Defense Medium Tactical Vehicle.",b61a205cffea40d88b4979fa64a12de4,4
ken watanabe,drift,"Ken Watanabe plays the character Drift, who is a Samurai-motif Autobot, tactician, and a former Decepticon assassin.",793bad6c9dfb47db9c655800380d7d45,4
drift,bugatti veyron 16.4 grand sport vitesse,Drift transforms into a black and blue 2014 Bugatti Veyron 16.4 Grand Sport Vitesse.,793bad6c9dfb47db9c655800380d7d45,4
drift,sikorsky s-97 raider helicopter,Drift also transforms into a Sikorsky S-97 Raider Helicopter.,793bad6c9dfb47db9c655800380d7d45,4
robert foxworth,ratchet,"Robert Foxworth plays the character Ratchet, who is the Autobot medical officer and transforms into a white and green 2009 S.A.R. Hummer H2 ambulance.",793bad6c9dfb47db9c655800380d7d45,4
john dimaggio,crosshairs,"John DiMaggio plays the character Crosshairs, who is an Autobot paratrooper and elite sniper, as well as the weapons tactician and mechanic. He transforms into a black and green 2014 Chevrolet Corvette C7 Stingray.",793bad6c9dfb47db9c655800380d7d45,4
mark ryan,lockdown,"Mark Ryan plays the character Lockdown, who is a Cybertronian assassin and bounty hunter. He transforms into a grey 2014 Lamborghini Aventador LP 700–4 Coupe.",793bad6c9dfb47db9c655800380d7d45,4
reno wilson,brains,"Reno Wilson plays the character Brains, who is a former Decepticon drone turned Autobot. He survived the Battle of Chicago and has lost his right leg. This character explains that Galvatron is a reincarnation of Megatron.",793bad6c9dfb47db9c655800380d7d45,4
ben schwartz as bumblebee,optimus prime's new second-in-command,Bumblebee is Optimus Prime's new second-in-command in the film.,bf22598bafc9473386c8765aa6681038,4
bumblebee,1967 chevrolet camaro (transformable form),Bumblebee transforms into a black 1967 Chevrolet Camaro in the film.,bf22598bafc9473386c8765aa6681038,4
bumblebee,2014 chevrolet camaro (transformable form),Bumblebee transforms into a yellow and black 2014 Chevrolet Camaro in the film.,bf22598bafc9473386c8765aa6681038,4
ben schwartz as bumblebee,non-speaking robots (grimlock),"Bumblebee, who is played by Ben Schwartz in the film, does not interact with the non-speaking robot Grimlock.",bf22598bafc9473386c8765aa6681038,4
stinger,bumblebee,"Stinger, a human-made KSI drone who works for Galvatron and is a remake of Bumblebee, is different from the original Bumblebee.",bf22598bafc9473386c8765aa6681038,4
stinger,2014 pagani huayra sports car (transformable form),Stinger transforms into a 2014 Pagani Huayra sports car in the film.,bf22598bafc9473386c8765aa6681038,4
strafe,dinobots,Strafe is a Dinobot as mentioned in the context.,bf22598bafc9473386c8765aa6681038,4
strafe,two-headed pteranodon (transformable form),Strafe transforms into a two-headed Pteranodon in the film.,bf22598bafc9473386c8765aa6681038,4
slug,dinobots,Slug is a Dinobot as mentioned in the context.,bf22598bafc9473386c8765aa6681038,4
slug,mechanical spiked triceratops (transformable form),Slug transforms into a mechanical spiked Triceratops in the film.,bf22598bafc9473386c8765aa6681038,4
scorn,dinobots,Scorn is a Dinobot as mentioned in the context.,bf22598bafc9473386c8765aa6681038,4
scorn,spike,"In the film, Scorn's nickname is 'Spike'.",bf22598bafc9473386c8765aa6681038,4
junkheap,human-made ksi prototype,"Junkheap is a human-made KSI prototype, as mentioned in the context.",bf22598bafc9473386c8765aa6681038,4
junkheap,three separate robots (split form),"Unlike other transformers in the series, Junkheap splits into three separate robots in the film.",bf22598bafc9473386c8765aa6681038,4
