Question,Answer
Did Nitya Mehra direct a film produced by Excel Entertainment that was initially attached to Aamir Khan?,Yes.
Did Nitya Mehra direct a film associated with Deepika Padukone?,No.
Did Nitya Mehra direct a project for Excel Entertainment that involved Anushka Sharma?,No.
Did Nitya Mehra direct a project associated with Karan Johar?,Yes.
Did Nitya Mehra direct a film produced by Excel Entertainment starring Sidharth Malhotra?,Yes.
Did Excel Entertainment produce a film featuring Katrina Kaif?,Yes.
