Question,Answer
Is the soundtrack album for 'Thugs of Hindostan' composed by Ajay-Atul?,Yes.
Did Ajay-Atul compose the soundtrack album for 'Thugs of Hindostan'?,Yes.
Is the soundtrack album for *Thugs of Hindostan* released by YRF MusicDivo?,Yes.
Is the soundtrack album for 'Thugs of Hindostan' released in multiple languages?,Yes.
Did the composer duo Ajay-Atul create music for the movie 'Thugs of Hindostan' after composing for 'Dhadak'?,Yes.
Is Suraiyya featured in the song Vashmalle from the movie Thugs of Hindostan?,No.
Is 'Majjaare Khudaa' also featured in the film Thugs of Hindostan?,Yes.
