Question,Answer
Does Karan Rajput have a false identity related to Kabir's murder count?,Yes
Does Karan Rajput have a false identity related to Aayan in the context of their undercover mission?,Yes
Is there a strained relationship between Karan Rajput and Kabir due to past events?,Yes.
Does Karan Rajput have a false identity created during an undercover mission involving the Intelligence Agency?,Yes.
Is Karan Rajput involved in a false identity created by Aayan related to poison?,Yes.
Is Guru Saldanah corrupt and a threat to Karan Rajput?,Yes
Does Karan Rajput have a false identity created during an undercover mission with Kabir?,No.
Did Kabir get shot by Izna during a critical moment in the plot?,Yes
Did Izna kill Kabir due to Aayan's lies?,Yes.
Does Karan Rajput have a false identity that affects his perception of heaven?,Yes.
Does Karan Rajput have a false identity that connects to the concept of hell in the context of their mission?,Yes.
Does Karan Rajput have a false identity created by Aayan during their undercover mission?,Yes.
Did Karan Rajput have a false identity created by Aayan during their undercover mission involving Guru Saldanah?,Yes.
Did Karan Rajput have a false identity created during a mission that involved Kabir Wilson?,Yes.
Did Karan Rajput create a false identity during an undercover mission related to the love letter?,Yes
Is Kabir's house involved in the false identity created by Karan Rajput during the undercover mission?,No
Does Karan Rajput have any involvement in Kabir's murder count?,No
Does Karan Rajput have a false identity created by Aayan during their undercover mission?,Yes
Is there a historical association between Karan Rajput and Kabir in the context of their missions?,No
Does Karan Rajput have a connection to the intelligence agency?,Yes.
Does Karan Rajput have a connection to the poison used in the mission?,Yes.
Does Karan Rajput have a false identity that is linked to Guru Saldanah's intentions?,Yes.
Does Karan Rajput have a false identity created by Aayan?,Yes.
Did Izna shoot Kabir in the stomach during their undercover mission?,Yes.
Did Izna kill Kabir because of Aayan's lies?,Yes
Is Karan Rajput's false identity a crucial element in the mission that leads to Izna's vision of heaven?,Yes.
Does Karan Rajput have a false identity that relates to hell?,Yes.
Is a false identity created by Karan Rajput during an undercover mission related to Aayan Thakur?,Yes.
Does Karan Rajput have a false identity created by Aayan during their undercover mission?,Yes.
Did Karan Rajput have a false identity created by Aayan during their undercover mission?,Yes
Does Karan Rajput play a role in the creation of a love letter in the context of the story?,No.
Does Karan Rajput have a false identity related to Kabir's house?,No
Does Karan Rajput have any connection to Kabir's murder count?,No
Does Karan Rajput have a false identity created by Aayan during their undercover mission?,Yes
Is there a strained relationship between Karan Rajput and Kabir due to Izna's actions?,Yes
Is Karan Rajput involved in a false identity created during an undercover mission related to the intelligence agency?,Yes.
Does Karan Rajput have a false identity related to poison in the story?,Yes.
Is Guru Saldanah corrupt in relation to Karan Rajput's undercover mission?,Yes.
Did Kabir offer Izna a way to escape during their undercover mission?,Yes.
Did Kabir get shot by Izna during their confrontation?,Yes.
Did Izna confess to killing Kabir because of Aayan's lies?,Yes
"Does Izna believe that without Kabir, heaven is not a heaven?",Yes.
Does Karan Rajput have any connection to the concept of hell in the context of the story?,Yes.
Does Izna believe she can manipulate Aayan Thakur more easily by moving into Kabir's house?,Yes.
Does Izna believe she can steal the data more easily with Guru Saldanah's involvement?,Yes.
Does Izna believe she can steal the data more easily when she moves into Kabir Wilson's house?,Yes.
Does Izna believe that moving into Kabir's house will help her steal the love letter more easily?,Yes.
Does Izna believe she can steal the data more easily when she moves into Kabir's house?,Yes
Does Izna believe she can access sensitive information related to Kabir's murder count?,Yes
Does Izna believe she can steal the data more easily when she moves into Aayan's house?,Yes
Does Izna believe she can steal data more easily by moving into Kabir's house?,Yes
Does Izna believe she can successfully steal data for the intelligence agency?,Yes
Does Izna have a malicious intent towards Kabir in the context of poison?,Yes.
Is Guru Saldanah corrupt and a threat to Izna in the movie *Jism 2*?,Yes.
Does Izna believe that moving into Kabir's house will help her steal the data more easily?,Yes
Does Izna believe she can steal data more easily by moving into Kabir's house?,Yes
Does Izna believe she can steal the data more easily when moving into Kabir's house?,Yes.
"Does Izna believe that without Kabir, heaven is not a heaven?",Yes
Does Izna believe she has no reason to be afraid of hell before dying?,Yes
Does Izna believe she can steal data more easily from Aayan Thakur?,Yes
Does Izna believe she can manipulate Guru Saldanah more easily after moving in with Kabir?,Yes
Does Izna believe she can steal the data more easily when she moves into Kabir Wilson's house?,Yes
Did Izna believe she could steal the data more easily by moving into Kabir's house because of her feelings for him?,Yes.
Does Izna believe that moving into Kabir's house will help her steal the data more easily?,Yes.
Does Izna believe that moving into Kabir's house will help her in her plans regarding Kabir's murder count?,Yes
Does Izna believe that moving into Kabir's house will help her steal the data more easily from Aayan?,Yes
Does Izna believe she can steal data more easily by moving into Kabir's house?,Yes.
Does Izna have a connection with the intelligence agency in the plot of the movie?,Yes
Does Izna have a malicious intent towards Kabir involving poison?,Yes
Does Izna believe that Guru Saldanah will kill her once she gets the hard disk?,Yes.
Does Izna believe that moving into Kabir's house will help her steal the data more easily?,Yes.
Does Izna believe that moving into Kabir's house will help her steal the data more easily?,Yes.
Does Izna believe she can achieve her goals more easily by moving into Kabir's house?,Yes.
"Does Izna believe that without Kabir, heaven is not a heaven?",Yes
Does Izna believe she has no reason to be afraid of hell before dying?,Yes
Does Izna believe that Aayan Thakur can help her in stealing data more easily?,Yes.
Does Izna believe that she can manipulate Guru Saldanah more easily by moving into Kabir's house?,Yes
Does Izna believe she can steal data more easily when she moves into Kabir Wilson's house?,Yes
Did Izna write a love letter in her own blood?,Yes.
Does Izna believe she can steal the data more easily when she moves into Kabir's house?,Yes.
Does Izna believe she can access sensitive information related to Kabir's murder count?,Yes.
Does Izna believe she can steal the data more easily when she moves into Aayan's house?,Yes
Does Izna believe she can achieve her goals more easily by being close to Kabir?,Yes.
Does Izna have a professional association with the intelligence agency in the context of her mission?,Yes.
Does Izna have a malicious intent towards Kabir involving poison?,Yes
Does Izna believe that Guru Saldanah intends to kill her after the mission?,Yes
Does Izna believe that moving into Kabir's house will help her steal the data more easily?,Yes.
Does Izna believe that moving into Kabir's house will help her steal the data more easily?,Yes
Did Izna kill Kabir because of Aayan's lies?,Yes.
"Does Izna believe that without Kabir, heaven is not a heaven?",Yes
Does Izna believe that moving into Kabir's house will help her overcome her fear of hell?,Yes.
Does Izna believe that she can steal the data more easily when she is with Aayan Thakur?,Yes
Does Izna believe that Guru Saldanah will help her in stealing the data?,Yes
Does Izna believe she can steal data more easily when she moves into Kabir Wilson's house?,Yes
Does Izna express her feelings for Kabir through a love letter?,Yes
Does Izna believe she can steal the data more easily when she moves into Kabir's house?,Yes
Does Izna believe that moving into Kabir's house will help her with Kabir's murder count?,Yes
Does Izna believe she can steal the data more easily when she is with Aayan?,Yes
Does Izna believe she can achieve her goals more easily by moving into Kabir's house?,Yes.
Does Izna work for the intelligence agency?,Yes
Does Izna have malicious intentions towards Kabir involving poison?,Yes
Is Guru Saldanah corrupt in the context of Izna's story?,Yes.
Does Izna believe she can steal data more easily when she moves into Kabir's house?,Yes
Does Izna believe she can steal data more easily when she moves into Kabir's house?,Yes
Did Izna confess to killing Kabir?,Yes
"Does Izna believe that without Kabir, heaven is not a heaven?",Yes
Does Izna believe that moving into Kabir's house will help her avoid hell?,Yes.
Did Sumit attack Aayan Thakur after reading a text message?,Yes.
Did Sumit attack Guru Saldanah after reading a text message?,Yes.
Did Sumit attempt to kill Kabir Wilson after reading a text message?,Yes
Does Sumit have a connection to the love letter in the plot?,Yes.
Did Sumit attack and try to kill someone at Kabir's house?,Yes.
Did Sumit attack Kabir's murder count after reading the text message?,Yes
Does Sumit attempt to kill Aayan after reading a text message?,Yes.
Does Sumit have a strained relationship with Kabir due to suspicions of corruption?,Yes
Does Sumit have a connection to the intelligence agency?,No
Does Sumit have a potentially lethal connection to Poison in the context of the events in the plot?,Yes.
Is Guru Saldanah corrupt and a threat to Sumit?,Yes
Does Sumit attack Kabir after reading a text message?,Yes
Did Sumit attack Kabir after reading a text message?,Yes
Did Izna confess to killing Kabir due to Aayan's lies in the context of their relationship?,Yes
"Does Sumit feel that without Izna, heaven is not a heaven?",Yes
Does Sumit attack and try to kill because of a text message related to hell?,Yes
Does Sumit attempt to kill Aayan Thakur after reading a text message?,Yes.
Does Sumit attempt to kill Guru Saldanah after reading a text message?,Yes
Did Sumit attack Kabir Wilson after reading a text message?,Yes
Does Sumit have a violent reaction towards the love letter in the context of the story?,Yes.
Did Sumit attack someone after reading a text message related to Kabir's house?,Yes.
Did Sumit have any involvement in Kabir's murder count?,Yes
Did Sumit attack Aayan after reading a text message?,Yes
Does Sumit attack Kabir after reading a text message?,No
Does Sumit have any involvement with the Intelligence Agency?,No
Is Poison associated with Sumit in a potentially harmful way?,Yes.
Is Guru Saldanah corrupt and a threat to Sumit?,Yes
Does Sumit attack Kabir after reading a text message?,Yes
Did Izna shoot Kabir after he offered her a way to escape?,Yes
Did Izna confess to killing Kabir due to Aayan's lies?,Yes
"Does Sumit believe that without Izna, Heaven is not truly a heaven?",Yes.
Does Sumit attempt to kill Hell after reading a text message?,Yes.
Does Sumit attack Aayan Thakur after reading the text message?,Yes.
Did Sumit attack Guru Saldanah after reading a text message?,Yes
Did Sumit attack Kabir Wilson after reading a text message?,Yes.
Did Sumit play a role in the events surrounding the love letter?,Yes
Did Sumit attack someone in Kabir's house?,Yes.
Did Sumit have an influence on Kabir's murder count?,Yes
Does Sumit attack Aayan after reading a text message?,Yes
Did Sumit attack Kabir after reading a text message?,No
Does Sumit have a connection to the intelligence agency?,No
Does Sumit have a connection to the poison in the context of the plot?,Yes
Did Sumit play a role in the events that led to Guru Saldanah's intentions to kill?,Yes.
Did Sumit attack Kabir after reading a text message?,Yes
Did Sumit attack Kabir after reading a text message?,No
Did Izna kill Kabir because of Aayan's lies?,Yes
Does Sumit attack and try to kill Heaven after reading a text message?,No
Does Sumit attack and try to kill Hell after reading a text message?,Yes.
Does Sumit have a conflict with Aayan Thakur?,Yes
Does Sumit have a violent confrontation with Guru Saldanah?,Yes
Did Sumit attack Kabir Wilson after reading a text message?,No
Does Sumit have a connection to the love letter in the context of the story?,No
Did Sumit attack someone at Kabir's house?,Yes
Does Sumit play a role in the circumstances surrounding Kabir's murder count?,Yes
Does Sumit have a violent confrontation with Aayan in the context of their relationship?,Yes
Does Sumit have a conflict with Kabir in the context of their relationships?,Yes.
Does Sumit have a connection to the intelligence agency through his actions?,Yes
Does Sumit attack Poison in a fit of rage?,Yes
Is Guru Saldanah corrupt in the context of the events involving Sumit?,Yes.
Did Sumit attack Kabir after reading a text message?,No
Did Sumit attack Kabir after reading a text message?,No
Did Sumit play a role in the events that led to Kabir's death?,Yes
"Does Izna believe that without Kabir, heaven is not a heaven?",Yes.
Does Sumit have a direct connection to Hell in the context of the story?,No
Does Kabir have any reason to suspect Aayan Thakur's involvement with the Intelligence Agency?,No.
Does Kabir have any reason to suspect Guru Saldanah's intentions?,No
Does Kabir Wilson have any reason to suspect Kabir?,No
Did Kabir receive a love letter from Izna?,Yes
Does Kabir have any reason to suspect Izna's involvement with the Intelligence Agency at his house?,No
Is Kabir's murder count influenced by his relationship with Izna?,Yes.
Does Aayan believe that Izna will be able to steal the data more easily when she moves into Kabir's house?,Yes
Does Kabir suspect that he has a reason to distrust Izna?,Yes.
Does Kabir have doubts about Izna's loyalty towards the intelligence agency?,Yes
Does Kabir have any reason to suspect the poison in his coffee?,No.
Does Kabir believe that Guru Saldanah is corrupt?,Yes.
Does Kabir have a reason to suspect himself in the plot of the movie?,No
Does Kabir have a reason to suspect himself in the situation?,No
Is Kabir involved in a romantic relationship with Izna in the context of the plot?,Yes.
"Does Kabir's forgiveness make Izna feel that without him, heaven is not a heaven?",Yes.
Does Kabir believe he has no reason to be afraid of hell?,Yes
Is Aayan Thakur connected to Aayan through a subplot involving a hearing aid?,Yes.
Is Guru Saldanah involved in a plot against Aayan?,Yes
Is Kabir Wilson involved in the drug smuggling plot connected to Aayan?,Yes.
Is the love letter significant to Aayan's storyline in the movie?,Yes.
Is Aayan's hearing aid found at Kabir's house?,No
Does Aayan have any connection to Kabir's murder count?,Yes.
Is Aayan involved in a potential sub-plot related to the Intelligence Agency?,Yes
Is there a potential subplot involving Aayan and Kabir in the context of corruption?,Yes.
Is Aayan's connection to the intelligence agency significant in the plot of the story?,Yes.
Is there a connection between Aayan and poison in the context of the plot?,Yes
Is Guru Saldanah a corrupt character in the story involving Aayan?,Yes.
Does Aayan have a connection to Kabir through the events involving Izna?,Yes.
Does Aayan have a connection to Kabir through the events in the plot?,Yes
Did Izna confess to killing Kabir because of Aayan's lies?,Yes
Is Aayan's hearing aid found in heaven?,No
Does Aayan have a connection to the concept of hell?,Yes
Does Kabir have a complicated relationship with Izna in the movie?,Yes
Does Kabir have a negative relationship with Izna in the movie?,Yes
Did Kabir express his feelings for Izna in a dramatic way?,Yes
Did Kabir apologize to Izna in a dramatic way?,Yes
Is Izna involved in a cover story with Aayan?,Yes
Is Izna involved in a dangerous situation due to her relationship with Aayan?,Yes.
Does Kabir propose to Izna in the movie?,Yes
Does Kabir believe that Izna is in danger because of Guru Saldanah?,Yes
Is Sumit suspected of involvement with Izna in a plot related to the Intelligence Agency?,Yes
Is Izna involved with the Intelligence Agency in *sumit*?,Yes.
Does Aayan have a conflict with Izna regarding her involvement with the Intelligence Agency?,Yes
Does Aayan express concern for Izna's safety in relation to Guru Saldanah?,Yes
Is Izna involved in uncovering corruption related to Guru Saldanah?,Yes
Is Izna aware of Guru Saldanah's corruption in the context of the plot?,Yes
Does Aayan realize that Izna is in danger due to Guru Saldanah's intentions?,Yes
Does Aayan realize that Izna is in danger due to Guru Saldanah's intentions?,Yes.
Does Aayan have an antagonistic relationship with Izna in the movie?,Yes
Does Aayan have an antagonistic relationship with Izna in the context of their story?,Yes.
Does the conflict involving guru saldanah's team ultimately lead to a threat against Izna?,Yes.
Is Izna involved in a corruption scandal related to Kabir?,Yes
Does Izna ultimately learn the truth about Kabir's claims regarding Guru Saldanah?,Yes
Did Izna ultimately realize that Kabir was telling the truth about Guru Saldanah's corruption?,Yes
Did Izna confess to killing Kabir due to Aayan's lies?,Yes
Did Karan Rajput create a false identity during an undercover mission involving Izna?,Yes.
Did Karan Rajput create a false identity during an undercover mission involving Izna?,Yes.
Does Izna believe that she can steal the data more easily when she moves into Kabir's house?,Yes.
Does Izna believe she can steal the data more easily when she moves into Kabir's house?,Yes
Did Sumit try to kill Izna after reading a text message?,Yes
Did Sumit try to kill Izna after reading a text message?,Yes
Did Kabir have a previous affiliation with the intelligence agency?,Yes
Did Kabir ever work for the intelligence agency?,Yes
Was Aayan involved with an intelligence agency in a cover story?,Yes
Did Kabir work for the Intelligence Agency in the past?,Yes
Is Sumit suspected of involvement with an intelligence agency?,Yes
Does Aayan warn Izna about the dangers of being involved with the Intelligence Agency?,Yes
Did Guru Saldanah have any involvement with the Intelligence Agency?,No
Did Aayan's actions relate to the Intelligence Agency in any way?,Yes.
Does Aayan have any connection to the intelligence agency?,Yes
Is there a significant emotional conflict between Kabir and Izna in the context of their relationship?,Yes
Is Kabir's laptop the target of a data theft attempt in the story?,Yes
Does Kabir have a complicated relationship with Izna in *Jism 2*?,Yes.
Does Kabir have a conflict with Sumit in the movie?,No
Did Guru Saldanah attempt to kill Izna in the context of Kabir's story?,Yes.
Is there a strong emotional conflict between Kabir and Izna in the movie?,Yes
Does Kabir have a direct conflict with Guru Saldanah in the movie?,Yes
Does Kabir have a negative relationship with Izna in *Jism 2*?,Yes
Did Kabir express his feelings for Izna in a dramatic way?,Yes
Did Kabir use his laptop to communicate with Izna?,No
Did Kabir express his feelings for Izna in a dramatic way?,Yes
Did Kabir express his feelings for Izna in a dramatic way?,Yes
Did Kabir's actions lead to Guru Saldanah being revealed as corrupt?,Yes
Did Kabir express his feelings for Izna in a dramatic way in *Jism 2*?,Yes
Did Kabir play a significant role in the events leading to Guru Saldanah's demise?,Yes.
Does Kabir have a significant emotional connection with Izna in the movie?,Yes
Is there an engagement between Aayan and Izna in the plot of *Jism 2*?,Yes
Did Aayan attempt to steal data from Kabir's laptop?,Yes
Is there an engagement between Aayan and Izna in the plot of *Jism 2*?,Yes
Does Aayan have a connection to Sumit through the plot of the movie?,Yes
Did Aayan learn that Guru Saldanah tried to kill Izna?,Yes
Did Aayan's engagement with Izna play a significant role in the plot of *Jism 2*?,Yes
Did Aayan kill Guru Saldanah in the movie *Jism 2*?,Yes.
Did Aayan threaten Izna if she didn't change her mind about starting a new life together?,Yes
Does Kabir have a romantic relationship with Izna in the context of the plot?,Yes.
Did Kabir's laptop play a crucial role in the events surrounding Kabir's proposal to Izna?,Yes
Does Kabir have a significant relationship with Izna in the context of the plot?,Yes
Does Kabir's proposal to Izna create a connection to Sumit in the plot of the movie?,Yes.
Did Kabir's actions lead to Guru Saldanah's attempt to kill Izna?,Yes.
Does Kabir have a significant relationship with Izna in the context of the plot?,Yes
Did Kabir have a role in the events leading to Guru Saldanah's death?,Yes.
Does Kabir have a romantic interest in Izna?,Yes
Is Sumit suspicious of Izna's involvement with the Intelligence Agency?,Yes.
Is Sumit suspected of being involved with the Intelligence Agency in relation to Kabir's laptop?,Yes
Is Sumit suspicious of Izna's involvement with the Intelligence Agency?,Yes
Is Sumit suspected of involvement with the Intelligence Agency?,Yes
Is Guru Saldanah involved in any criminal activities that could impact Sumit's situation?,Yes
Is Sumit suspicious of Izna's involvement with the Intelligence Agency?,Yes.
Did Sumit suspect Guru Saldanah's involvement with the Intelligence Agency?,No
Does Sumit suspect Izna's involvement with the Intelligence Agency?,Yes
Is there a romantic engagement between Aayan and Izna in the context of their cover story?,Yes
Does Aayan attempt to steal data from Kabir's laptop?,Yes.
Does Aayan warn Izna about being involved with the Intelligence Agency?,Yes.
Does Aayan have a connection to Sumit through a hearing aid found at Sumit's place?,Yes.
Did Aayan learn that Guru Saldanah tried to kill Izna?,Yes.
Does Aayan have a reason to be concerned about Izna's involvement with the Intelligence Agency?,Yes.
Did Aayan kill Guru Saldanah in the context of the plot?,Yes
Does Aayan have a hostile relationship with Izna in the context of their involvement with the Intelligence Agency?,Yes.
Does Guru Saldanah have a connection to Izna in the context of the story?,Yes
Did Guru Saldanah play a role in revealing the truth about Kabir's corruption related to the laptop?,Yes
Does Guru Saldanah have a connection to Izna in the context of the story?,Yes
Does Guru Saldanah have a connection to Sumit in the plot of the movie?,Yes
Is Guru Saldanah involved in a plot related to corruption?,Yes
Did Guru Saldanah have intentions that could harm Izna during the mission?,Yes
Does Guru Saldanah face a fatal outcome in his interactions with Izna?,Yes
Does Guru Saldanah have any connection to Izna's decisions regarding Aayan?,Yes
Did Aayan's actions ultimately put Izna in danger?,Yes
Did Aayan attempt to steal data from Kabir's laptop?,Yes
Did Aayan realize that Guru Saldanah had intended to kill Izna?,Yes.
Does Aayan's hearing aid being found at Sumit's place suggest a significant connection between them?,Yes.
Did Aayan learn that Guru Saldanah intended to kill Izna?,Yes
Did Aayan realize that Guru Saldanah had intended to kill Izna?,Yes
Did Aayan confront Guru Saldanah in *Jism 2*?,Yes
Does Aayan threaten to shoot Izna if she doesn't change her mind about starting a new life together?,Yes
Does Aayan have an antagonistic relationship with Izna in the context of *Jism 2*?,Yes
Does Aayan have a motive to steal data from Kabir's laptop?,Yes
Does Aayan have a hostile relationship with Izna in the context of their interactions?,Yes.
Is there a potential sub-plot involving Aayan and Sumit in the context of *Jism 2*?,Yes.
Did Aayan have an antagonistic relationship with Guru Saldanah?,No
Does Aayan have a conflicted relationship with Izna in the context of their interactions?,Yes
Did Aayan kill Guru Saldanah in the movie?,Yes
Is there an antagonistic relationship between Aayan and Izna in the context of *Jism 2*?,Yes
Does Kabir have any reason to suspect Izna?,No
Does Kabir have any reason to suspect his laptop is being targeted?,No
Does Kabir have any reason to suspect Izna?,No
Does Kabir have a reason to suspect Sumit?,No
Did Kabir tell the truth about Guru Saldanah's corruption?,Yes
Does Kabir have any reason to suspect Izna?,No
Did Kabir have any reason to suspect Guru Saldanah?,No
Does Kabir have any reason to suspect Izna's intentions?,No
Is there a significant connection between Aayan and Izna in the plot of the movie?,Yes
Did Aayan attempt to steal data from Kabir's laptop?,Yes
Does Aayan's connection with Izna involve any significant plot development in the story?,Yes.
Is there a significant connection between Aayan and Sumit in the plot of the movie?,Yes
Did Aayan learn about Guru Saldanah's intentions through Izna?,Yes.
Does Aayan have a connection to Izna that involves a potential threat?,Yes
Did Aayan end up killing Guru Saldanah?,Yes.
Does Aayan threaten to shoot Izna if she doesn't change her mind about starting a new life together?,Yes
Is there a history of conflict between Kabir and Izna in *Jism 2*?,Yes
Is there unresolved tension between Kabir and Izna in *Jism 2*?,Yes
Is there a strained relationship between Kabir and Izna in the context of their past?,Yes
Does Kabir have any reason to suspect Sumit of involvement in the corruption scandal?,No
Does Kabir have a history of working with the intelligence agency?,Yes
Does Kabir have a history of animosity towards corrupt operatives?,Yes.
Does Kabir believe that Guru Saldanah will harm Izna?,Yes
Does Kabir express dislike towards the impostors?,Yes
Is there a strong emotional conflict between Kabir and Izna in the movie?,Yes
Does Kabir express his feelings for Izna in a dramatic way?,Yes
Is there a significant emotional conflict between Kabir and Izna in the movie *Jism 2*?,Yes
