Question,Answer
Is Linda the same person who humorously agreed to a 'divorce' the night before Tony and Natasha's wedding?,Yes.
Did Linda use the passports to escape from Tony?,Yes
Did Jay's actions involving the car door ultimately affect Linda's escape?,Yes
Did the car door play a role in the events involving the passports?,Yes.
"Does Gina fall for Jay, who is involved with Linda and Tony?",Yes.
Is Bob Grover a powerful figure in the story involving Tony?,Yes.
Does Robin help Linda and Jay escape from Tony?,Yes
"Did Gina fall for Jay, who helped Linda and Jay escape?",Yes.
Does Robin assist Bob Grover in any way throughout the plot of the movie?,No
Does Robin assist in helping himself escape from Tony in the movie?,Yes.
"Does Gina fall for Jay, who is at their house when Robin comes to give them the passports?",Yes.
Is Bob Grover the father of Gina in the context of the house?,Yes
Is Robin a friend who helps the couple escape from their problems?,Yes
"Did Gina fall for Jay, who was sending text messages during a car chase?",Yes.
Is Bob Grover a wealthy character in the context of the movie 'Kites'?,Yes
Does the text message from Linda indicate that she wants to escape from her current situation?,Yes
"Did Gina fall for Jay, who was involved in a car chase that led to Linda's death?",Yes.
Did Linda's actions have a significant impact on Bob Grover's character in the movie?,Yes
Did a cliff play a significant role in the events surrounding Robin in the movie?,Yes
Is Jay Ray involved in the escape plan in the movie 'Kites'?,Yes
Does Jay have a friend who helps him escape from Tony and the police?,Yes
Did the wedding play a crucial role in Robin helping Jay Ray escape?,Yes
Did Robin play a crucial role in the wedding of Linda and Jay?,Yes
Did Tony shoot Jay Ray unexpectedly?,No
Did Tony's actions lead to Jay and Linda's escape?,Yes
Did Jay Ray kill Tony using the car door?,Yes.
Did Jay kill Tony by smashing his face into the car door?,Yes
Did Jay learn about Linda's whereabouts from Jamaal while aboard the train?,Yes
