node_1,node_2,edge,chunk_id,count
american bullshit,hustle,"The film began as an Eric Warren Singer screenplay titled American Bullshit, and Hustle is a highly fictionalized version of the Abscam scandal.",0c90e2a2bf504045876bdda9a35b5a33,4
eric warren singer,david o. russell,"Russell rewrote Singer's screenplay, replacing the characters with caricatures of their respective real-life figures.",0c90e2a2bf504045876bdda9a35b5a33,4
ben affleck,david o. russell,"Roven and Richard Suckle producing through Atlas Entertainment initially considered Ben Affleck to direct, before David O. Russell ultimately signed on to helm the film.",0c90e2a2bf504045876bdda9a35b5a33,4
hustle,abscam scandal,Hustle is a highly fictionalized version of the Abscam scandal of the late 1970s and early 1980s.,0c90e2a2bf504045876bdda9a35b5a33,4
boston,new york city,"The film was shot in and around Boston, Massachusetts (such as in Worcester), and in New York City.",0c90e2a2bf504045876bdda9a35b5a33,4
boston marathon bombings,hustle,"Filming was put on hold in the aftermath of the Boston Marathon bombings, with the city in lockdown. After lockdown was lifted, the film wrapped its Boston shoot and spent its final few days of production in New York City.",0c90e2a2bf504045876bdda9a35b5a33,4
american hustle (soundtrack),hustle,Main article: American Hustle (soundtrack),0c90e2a2bf504045876bdda9a35b5a33,4
