node_1,node_2,edge,chunk_id,count
independence day: resurgence,worst director,Roland Emmerich was nominated for Worst Director for Independence Day: Resurgence in the 37th ceremony of the Golden Raspberry Awards.,eea2d662d9744ca1907e9a12e1a278af,4
independence day: resurgence,worst screenplay,"The screenplay for Independence Day: Resurgence, written by Nicolas Wright, James A. Woods, Dean Devlin, Roland Emmerich, and James Vanderbilt was nominated for Worst Screenplay in the 37th ceremony of the Golden Raspberry Awards.",eea2d662d9744ca1907e9a12e1a278af,4
independence day: resurgence,sela ward,Sela Ward was nominated for Worst Supporting Actress for Independence Day: Resurgence in the 37th ceremony of the Golden Raspberry Awards.,eea2d662d9744ca1907e9a12e1a278af,4
houston film critics society,independence day: resurgence,"In its 2016 awards, the Houston Film Critics Society nominated Independence Day: Resurgence for Worst Film.",eea2d662d9744ca1907e9a12e1a278af,4
independence day 3,disney's preference for franchise films,"Emmerich stated that once Disney purchased Fox, he thought the chances of a third movie were over, but still had hopes given Disney's preference for franchise films.",fbd412b37c6d4b0485e3ffc1afc8c6aa,4
independence day 3,second film's success,Emmerich stated during an interview with Empire magazine in June 2016 that a third film could be made depending on the success of the second one.,fbd412b37c6d4b0485e3ffc1afc8c6aa,4
intergalactic journey,third film,"According to Emmerich, the third film will depict an intergalactic journey.",fbd412b37c6d4b0485e3ffc1afc8c6aa,4
