Question & Options,Correct Answer
"What action does Xavier take involving the Soviet sailor in *X-Men: First Class*?
Options:
A. He saves him from drowning
B. He influences him to destroy the ship carrying the missiles
C. He recruits him to join the X-Men
D. He fights him to prevent a disaster",He influences him to destroy the ship carrying the missiles
"What event leads to Xavier's paralysis in *X-Men: First Class*?
Options:
A. A bullet deflected by Lehnsherr
B. Shaw's death
C. Lehnsherr's persuasion
D. A fight with MacTaggert",A bullet deflected by Lehnsherr
