Question & Options,Correct Answer
"Which of the following statements are true regarding the accolades of 'Laal Singh Chaddha' released in 2022?
Options:
A. A. Kareena Kapoor Khan received a nomination for Best Actress at the Filmfare Awards.
B. B. 'Laal Singh Chaddha' won the Best Actress award at the Filmfare Awards.
C. C. The Filmfare Awards ceremony for this nomination took place on April 27, 2023.
D. D. Kareena Kapoor Khan was the only actress nominated for any award at the Filmfare Awards for this film.","A, C"
"Which of the following accolades are associated with the movie 'Laal Singh Chaddha' released in 2022?
Options:
A. Pritam received a nomination for Best Music Director at the Filmfare Awards.
B. The film was nominated for Best Picture at the Oscars.
C. Aamir Khan received a nomination for Best Actor at the Filmfare Awards.
D. The film won Best Music Director at the Filmfare Awards.",Pritam received a nomination for Best Music Director at the Filmfare Awards.
"Which of the following accolades did 'Laal Singh Chaddha' receive nominations for at the Filmfare Awards in 2023?
Options:
A. Best Special Effects
B. Best Actor
C. Best Director
D. Best Cinematography",Best Special Effects
"Which of the following accolades are associated with Amitabh Bhattacharya for the movie 'Laal Singh Chaddha' (2022)?
Options:
A. Nominated for Best Lyricist at the Filmfare Awards
B. Won Best Actor at the Filmfare Awards
C. Nominated for Best Song at the Filmfare Awards
D. Nominated for Best Lyricist for 'Tere Hawaale'","Nominated for Best Lyricist at the Filmfare Awards, Nominated for Best Lyricist for 'Tere Hawaale'"
"Which of the following statements are true regarding the accolades received by 'Laal Singh Chaddha' (2022)?
Options:
A. Sonu Nigam received a nomination for Best Playback Singer - Male at the Filmfare Awards for the song 'Main Ki Karaan?'
B. The Filmfare Awards ceremony took place on April 27, 2023.
C. Laal Singh Chaddha won the Best Film award at the Filmfare Awards.
D. Sonu Nigam performed the song 'Main Ki Karaan?' in Laal Singh Chaddha.","Sonu Nigam received a nomination for Best Playback Singer - Male at the Filmfare Awards for the song 'Main Ki Karaan?', The Filmfare Awards ceremony took place on April 27, 2023."
"Which of the following accolades are associated with the movie 'Laal Singh Chaddha' (2022)?
Options:
A. Nominated for Best Playback Singer - Female at the Filmfare Awards
B. Won Best Film at the Filmfare Awards
C. Nominated for Best Actor at the Filmfare Awards
D. Nominated for Best Music Album at the Filmfare Awards",Nominated for Best Playback Singer - Female at the Filmfare Awards
"Which of the following accolades are associated with the movie 'Laal Singh Chaddha' released in 2022?
Options:
A. Nominated for Best Sound Design at the Filmfare Awards
B. Won Best Actor at the Filmfare Awards
C. Nominated for Best Film at the Filmfare Awards
D. Nominated for Best Sound Design by Shajith Koyeri","Nominated for Best Sound Design at the Filmfare Awards, Nominated for Best Sound Design by Shajith Koyeri"
"Which of the following statements are true regarding the accolades of 'Laal Singh Chaddha' released in 2022?
Options:
A. A. The film received a nomination for Best Sound Design at the Filmfare Awards.
B. B. M. Lakshmi Naidu was recognized for his work in the film.
C. C. The Filmfare Awards ceremony took place on April 27, 2023.
D. D. The film won the Best Film award at the Filmfare Awards.","A, B, C"
"Which of the following accolades were awarded for 'Laal Singh Chaddha' in 2022?
Options:
A. Best Cinematography at the Zee Cine Awards
B. Best Actor at the Filmfare Awards
C. Best Film at the National Film Awards
D. Best Director at the IIFA Awards",Best Cinematography at the Zee Cine Awards
