Question & Options,Correct Answer
"Which of the following statements are true regarding the movie *CODA*?
Options:
A. a) Emilia Jones plays the character Ruby Rossi.
B. b) Ruby Rossi has interactions with Eugenio Derbez's character.
C. c) Eugenio Derbez plays Ruby Rossi's father.
D. d) All of the above","a) Emilia Jones plays the character Ruby Rossi. 
b) Ruby Rossi has interactions with Eugenio Derbez's character."
"Which of the following statements are true regarding the characters in *CODA*?
Options:
A. a) Emilia Jones plays Ruby Rossi.
B. b) Ruby Rossi is the daughter of Frank Rossi.
C. c) Troy Kotsur plays Ruby Rossi's father.
D. d) Ruby Rossi is a character in *CODA*.",All of the above
"Which of the following statements are true regarding the characters in *CODA*?
Options:
A. a) Emilia Jones plays Ruby Rossi.
B. b) Ruby Rossi has a romantic interest in Miles.
C. c) Ferdia Walsh-Peelo portrays Miles.
D. d) All of the above.",d) All of the above.
"Which of the following statements are true regarding the characters in *CODA*?
Options:
A. Emilia Jones portrays Ruby Rossi
B. Ruby Rossi is the sibling of Leo Rossi
C. Daniel Durant plays Leo Rossi
D. All of the above",All of the above
"Which of the following statements is true regarding the characters in the movie *CODA*?
Options:
A. a) Emilia Jones portrays Ruby Rossi.
B. b) Ruby Rossi interacts with Tanya.
C. c) Sarah Clarke plays the role of Tanya.
D. d) All of the above",d) All of the above
