Question,Answer
Was Sadness initially perceived as an unnecessary burden for Riley in *Inside Out*?,Yes
Was Bing Bong encountered by Joy and Sadness while navigating the vast long-term memory area in *Inside Out*?,Yes
Was Bing Bong encountered by Joy and Sadness while navigating the vast long-term memory area in *Inside Out*?,Yes
Was Sadness able to reactivate the console in *Inside Out*?,Yes
Did Joy try to limit Sadness's influence in Riley's mind in the movie *Inside Out*?,Yes
Did Joy accidentally knock loose the other core memories during a struggle with Sadness in *Inside Out*?,Yes
Was Joy initially present when Riley had poor experiences and cried in front of her class?,No
Did Riley cry in front of her class due to Sadness retroactively saddening joyous memories?,Yes
Did Joy and Bing Bong fall into the Memory Dump in *Inside Out*?,Yes
Did Joy discover a sad memory of losing a hockey game that turned happy in *Inside Out*?,Yes
Did Joy and Bing Bong attempt to escape the Memory Dump using a song-fueled wagon rocket?,Yes
Was Fear forced to take control of Riley in the absence of Joy and Sadness in *Inside Out*?,No
"Was Joy absent in the situation where Anger, Fear, and Disgust were forced to take control of Riley?",No
Was the console disabled by Anger's idea in *Inside Out*?,Yes
"Was Joy absent when Anger, Fear, and Disgust were forced to take control of Riley in *Inside Out*?",No
Did Riley have poor experiences when she first moved to the new house in *Inside Out*?,Yes
Did Joy and Sadness encounter Bing Bong while navigating the vast long-term memory area?,Yes
Did Joy and Sadness encounter Bing Bong while navigating the vast long-term memory area?,Yes
Was Joy able to reactivate the console and return Riley to her parents in *Inside Out*?,Yes
Did Riley tell her parents that she misses her old life in *Inside Out*?,Yes
Did Riley's parents comfort her and tell her they also miss Minnesota in *Inside Out*?,Yes
Did Riley's parents comfort her and tell her they also miss Minnesota in *Inside Out*?,Yes
Did Joy discover a sad memory that turned happy when Riley's parents and friends comforted her in *Inside Out*?,Yes
Did Joy discover Sadness's purpose in alerting others when Riley is emotionally overwhelmed and needs help?,Yes
Did Joy discover Sadness's purpose in alerting others when Riley is emotionally overwhelmed?,Yes
Did Joy hand control of the console to Sadness in *Inside Out*?,Yes
Was Anger's idea responsible for disabling the console in *Inside Out*?,No
Was Sadness able to reactivate the console and return Riley to her parents?,Yes
